"441",441,489,"2017-09-07 19:04:13","2017-09-07 19:35:35",31,0.6894,5,"I believe that I don't know if a god or gods exist.  I'm open to the possibility.  I know that most other people have faith in one or more gods.",NA,"None.  My family members are either Catholic or general Christian.",NA,2,75,25,4,4,4,4,4,4,4,4,4,4,0,0,0,0,0,0,0,0,0,0,0,0,1,0,0,0,0,2,7,7,"It is generally going the right direction, despite political leadership.",NA,5,5,47,3,29,15,4,20,3,3,5,5,3,5,5,5,2,2,2,2,2,2,2,1,3,2,2,1,4,4,2,4,2,2,2,2,2,3,2,3,3,4,5,4,5,3,4,3,5,6,4,3,4,5,4,4,5,3,3,3,3,3,2,4,3,3,4,4,3,4,5,5,3,3,4,3,4,1,"",4,"",2,1,2,4,1,1,6,1,1,1,1,47,4,3,12,4,1,2,1,2,1,17,1,1,4,8,1,88,0,0,0,0,2,2,441
"442",442,490,"2017-09-07 19:04:49","2017-09-07 19:23:41",18,0.6848,5,"That there is a prime mover some call god that is responsible for all that exists.",NA,"Roman Catholic",NA,1,65,35,6,2,4,2,4,6,7,1,4,1,1,0,0,0,0,0,0,0,0,0,0,0,0,0,0,0,0,1,2,2,"Wrong direction because our elected president is the most dangerous leader since Adolph Hitler.",NA,10,100,47,3,29,15,4,30,3,2,5,6,4,7,5,6,1,2,1,1,1,1,1,2,4,3,4,2,4,3,2,3,2,3,3,3,3,3,4,4,4,4,4,4,6,2,5,2,5,6,3,2,1,5,3,7,5,1,4,1,2,2,1,1,3,2,4,4,1,1,6,6,2,5,2,3,4,2,"",4,"",2,1,1,1,1,1,7,1,1,1,1,70,6,4,14,4,1,1,1,2,1,21,1,1,3,5,1,57,0,0,0,0,2,5,442
"443",443,491,"2017-09-07 19:04:52","2017-09-07 20:04:30",59,1.176,2,"yes",NA,"catholic",NA,1,90,10,6,6,6,5,4,5,6,2,6,6,1,0,0,0,0,0,0,0,0,0,0,0,0,0,0,0,0,2,5,4,"wrong  directon          too much  greed  among  us.",NA,10,20,24,3,15,20,9,30,2,5,5,5,5,5,3,5,1,1,1,1,1,1,1,1,3,3,4,1,4,3,3,4,2,2,1,4,2,1,3,1,3,6,6,3,5,3,3,3,6,6,2,3,6,5,6,3,6,4,2,4,2,3,1,1,3,3,3,5,3,3,3,5,3,5,3,4,5,2,"",4,"",1,1,2,2,1,1,7,1,1,2,1,72,6,4,10,3,4,1,1,3,1,14,1,1,3,7,1,74,0,1,0,0,2,5,443
"444",444,492,"2017-09-07 19:05:19","2017-09-07 19:39:54",34,1.0527,5,"yes",NA,"Catholic",NA,1,50,50,6,6,6,6,4,6,6,6,6,5,1,0,0,0,0,0,0,0,0,0,0,0,0,0,0,0,0,1,7,5,"wrong",NA,10,100,96,0,0,0,6,10,2,3,6,6,6,6,6,6,3,3,1,2,2,3,2,1,2,3,3,3,3,3,3,3,2,3,2,4,2,4,3,4,5,2,2,6,6,3,6,1,6,5,2,1,6,3,3,3,6,2,1,2,3,6,6,4,4,4,4,4,6,3,4,4,3,4,4,6,4,1,"",4,"",2,2,2,2,1,1,6,1,1,1,1,27,2,1,12,4,1,2,1,1,3,4,5,1,2,3,2,35,0,0,0,0,1,1,444
"445",445,493,"2017-09-07 19:05:28","2017-09-07 19:27:14",21,0.7649,5,"",-1,"catholic",NA,1,98,2,7,7,7,-1,4,7,7,7,7,7,1,0,0,0,0,0,0,0,0,0,0,0,0,0,0,0,0,1,7,2,"",-1,10,100,24,3,15,20,2,10,3,3,5,6,5,5,5,5,3,3,2,2,2,3,2,1,2,3,3,1,3,4,4,3,2,4,4,4,2,3,3,3,2,-1,6,3,6,2,5,1,6,6,4,2,2,5,4,6,3,5,2,4,1,4,2,2,3,5,4,4,5,6,6,6,3,4,4,6,4,1,"",4,"",1,1,5,5,1,1,5,1,4,1,1,58,5,3,9,2,1,2,1,2,1,9,1,0,2,4,1,43,0,0,0,0,2,1,445
"446",446,494,"2017-09-07 19:06:10","2017-09-07 19:19:46",13,0.3023,5,"They may or may not exist (I would guess not — though it is also a matter of definition: what exactly is meant by ""god""?)  If they do, I do not think they take an active interest in our personal lives...",NA,"Atheist.
I'm a member a various dog clubs.",NA,2,55,45,2,2,2,3,2,3,2,2,2,2,0,0,0,0,0,0,0,0,1,0,0,0,1,0,0,0,0,1,8,7,"Wrong direction.
The extreme political polarization and accompanying hate is very bad and not helping anyone.",NA,5,5,47,3,29,15,4,20,3,5,6,5,4,5,4,6,2,2,2,2,2,1,1,2,3,2,2,3,4,3,3,3,3,1,1,1,1,1,1,1,2,6,5,2,5,3,4,4,3,5,4,6,4,4,5,4,5,1,-1,1,2,3,4,5,4,1,4,4,1,2,5,5,2,5,4,4,4,2,"",4,"",2,2,2,3,1,1,6,1,1,1,1,55,5,3,13,4,5,1,1,2,1,14,1,1,4,9,1,91,0,0,0,0,2,2,446
"447",447,495,"2017-09-07 19:06:23","2017-09-07 19:23:08",16,0.6751,5,"nothing",NA,"none",NA,1,75,25,6,6,4,5,3,5,4,4,5,3,0,1,0,0,0,0,0,0,0,0,0,0,0,0,0,0,0,2,8,6,"wrong, too much pc correctness",NA,10,20,24,6,30,20,9,10,2,6,6,4,5,6,3,5,2,2,1,2,2,2,1,1,3,3,4,2,2,3,3,3,2,2,2,4,1,3,2,4,1,6,6,1,7,6,6,6,7,7,3,1,4,5,3,5,2,6,3,6,1,3,4,4,5,6,6,5,5,5,6,5,3,3,4,4,5,2,"",4,"",1,2,6,6,1,1,3,1,2,1,1,73,6,4,10,3,1,1,1,2,1,8,1,1,1,1,1,14,0,0,0,0,2,5,447
"448",448,496,"2017-09-07 19:06:45","2017-09-07 19:53:28",46,0.7337,5,"No",NA,"Self-Realization Fellowship",NA,2,85,15,1,1,5,1,7,7,1,1,5,1,0,0,0,0,0,0,0,0,0,0,0,0,0,0,0,1,0,1,5,6,"Wrong direction. Market capitalism has taken control of the minds of Americans through manipulation and exploitation of humanity's natural desires (E.g., greed, lust, power, materialism, narcissism, divisionism). That coupled with lies put forth by religious authority, it has stolen human dignity and forced us into a material world where many only care for their own physical desires. There's no balance anymore between materialism and spirituality. We're now all objectified to be exploited.",NA,10,100,47,3,30,20,8,20,3,1,7,6,3,7,6,5,4,4,3,1,2,4,2,1,1,1,3,2,4,3,2,3,2,4,4,2,4,2,4,2,1,2,5,3,6,1,5,1,3,7,3,5,2,6,3,3,5,3,3,1,1,6,2,3,2,7,6,2,7,1,2,7,1,2,3,5,7,2,"",3,"",1,2,1,5,1,1,3,1,3,1,1,38,3,2,13,4,1,1,0,3,2,17,5,1,4,9,1,93,0,0,0,0,3,1,448
"449",449,497,"2017-09-07 19:07:36","2017-09-07 19:50:45",43,1.1833,2,"",-1,"Catholicism",NA,1,75,25,7,7,7,7,1,7,7,6,7,5,1,0,0,0,0,0,0,0,0,0,0,0,0,0,0,0,0,1,1,1,"Wrong direction.  The wrong is becoming the norm",NA,10,100,24,3,30,20,6,10,2,2,6,5,2,6,5,5,2,1,1,1,1,1,1,1,3,2,4,2,1,3,2,3,2,3,2,4,3,4,3,4,5,4,3,6,3,6,4,3,6,5,2,1,2,6,5,6,5,4,1,4,3,6,6,1,3,3,3,5,2,2,5,6,3,3,5,2,5,2,"",4,"",2,2,6,6,1,1,1,1,2,2,1,50,4,3,12,4,4,1,1,1,1,19,3,1,3,7,1,74,0,0,0,0,1,1,449
"450",450,498,"2017-09-07 19:08:19","2017-09-07 19:31:27",23,1.507,5,"I believe god the eternal father and in his son Jesus Christ and in the Holy Ghost",NA,"The church of Jesus Christ of Latter Day Saints",NA,1,65,35,7,7,7,5,6,6,7,6,7,6,0,0,0,1,0,0,0,0,0,0,0,0,0,0,0,0,0,1,2,1,"Wrong direction. Many deny the existence of god or believe but choose not to keep his commandments",NA,10,100,47,12,30,-1,9,0,3,5,5,6,4,6,4,6,2,1,1,2,2,2,3,2,3,1,3,2,3,2,2,3,2,4,4,4,4,4,4,4,2,3,4,5,5,2,5,2,4,6,3,3,3,3,4,4,6,5,2,5,1,4,2,2,4,3,5,4,4,5,4,4,2,2,4,-1,4,1,"",4,"",1,1,5,5,1,1,2,1,3,1,1,29,2,1,11,3,1,2,1,5,1,13,1,1,2,3,1,32,0,2,1,0,2,7,450
"451",451,499,"2017-09-07 19:08:24","2017-09-10 21:33:15",4464,0.8158,1,"I believe in a ""god"" as more of a force of the world that we interact with as to not feel alone. That force to me is purely spiritual and is within me and others.",NA,"None",NA,2,85,15,2,2,5,5,6,6,1,1,6,5,0,0,0,0,0,0,0,0,0,0,0,0,1,0,0,0,0,1,8,3,"Going in the wrong direction because of the distrust that many have about our elected officials, institutions. GREED has now become the prime focus of our world, and our younger people have taken up that banner. Many have learned from their parent(s) that are owed for being on this planet.",NA,10,100,24,6,15,20,18,10,2,3,6,6,6,4,4,7,2,2,1,1,1,1,2,2,4,2,3,1,4,3,3,3,2,3,3,3,1,3,2,3,2,2,4,5,6,2,4,2,5,6,1,4,2,6,4,4,6,2,2,1,1,4,1,1,6,2,4,4,2,2,4,2,2,4,6,2,2,2,"",3,"",1,1,1,4,1,1,7,1,1,2,1,72,6,4,9,2,4,1,1,1,3,4,5,1,3,5,2,59,0,0,0,0,1,5,451
"452",452,501,"2017-09-07 19:08:45","2017-09-07 19:27:01",18,0.8995,5,"In the beginning, God created the heavens and earth.....",NA,"Church of Christ - non denominational",NA,1,60,40,7,7,6,6,6,6,7,7,6,2,0,0,0,0,0,0,0,0,0,0,1,0,0,0,0,0,0,2,1,1,"Wrong direction -- too much liberalism...   People need to sit down and think what they are doing and why....",NA,10,100,24,3,30,20,3,103,3,2,5,5,4,6,5,6,2,2,2,2,2,2,2,2,3,3,3,2,2,3,3,3,2,3,2,3,3,3,3,3,4,3,3,5,5,3,5,3,5,5,3,3,3,5,3,5,4,4,3,4,4,4,4,4,3,3,4,4,3,3,4,5,3,4,-1,4,4,2,"",4,"",2,2,6,6,1,1,1,1,2,1,1,59,5,3,11,3,1,1,1,5,1,18,1,1,3,5,1,59,0,0,0,0,5,1,452
"453",453,502,"2017-09-07 19:08:46","2017-09-07 20:01:56",53,0.7502,5,"yes",NA,"Unitarian, Agape",NA,1,80,20,6,2,6,2,6,7,4,2,6,5,0,0,0,0,0,0,0,0,0,1,0,0,0,0,0,0,0,2,5,2,"I have an abundant life and feel that everything works itself out in the end.",NA,10,100,36,3,1,20,3,30,3,3,5,6,4,6,5,5,2,1,1,1,1,1,1,2,3,4,4,2,3,4,2,4,2,3,2,3,1,3,3,3,5,3,4,5,6,2,7,3,5,6,2,3,4,5,2,3,6,2,1,2,2,4,4,4,4,2,5,4,3,4,4,4,3,5,4,5,3,1,"",4,"",1,2,2,3,1,1,6,1,3,1,1,59,5,3,12,4,1,2,1,1,2,20,3,1,4,9,2,93,0,0,0,0,1,2,453
"454",454,504,"2017-09-07 19:09:47","2017-09-10 20:29:36",4399,1.6179,5,"God exists",NA,"",-1,1,60,40,4,4,4,4,4,4,4,4,4,4,0,0,0,0,0,0,0,0,0,0,0,0,0,0,0,1,0,1,7,6,"",-1,5,5,47,3,29,15,4,20,3,4,5,5,3,5,5,6,2,2,1,2,2,2,2,2,2,1,3,2,3,3,2,3,2,2,3,2,2,2,2,2,2,5,5,5,5,3,5,2,4,4,3,3,3,5,2,5,5,3,4,3,2,4,2,2,3,3,3,5,2,2,5,5,2,4,3,3,4,2,"",4,"",1,1,2,2,2,4,5,3,5,1,1,35,3,2,10,3,3,1,1,3,3,7,1,1,1,2,2,21,0,1,0,0,2,2,454
"455",455,505,"2017-09-07 19:10:55","2017-09-07 19:30:36",19,1.2228,5,"",-1,"None",NA,1,90,10,4,5,5,5,4,5,5,5,6,4,0,1,0,0,0,0,0,0,0,0,0,0,0,0,0,0,0,2,8,6,"Wrong, because we have Childish misinformed leaders, as well as selfish, corrupted politicians only out for the money and fame.",NA,5,5,47,3,30,20,3,30,2,4,5,5,4,5,3,3,2,1,2,2,1,1,1,1,3,2,2,3,3,2,4,2,2,3,1,1,2,1,1,1,3,5,5,3,4,3,2,4,4,4,4,5,3,5,3,4,5,3,3,3,3,5,5,5,3,3,4,5,4,4,5,5,3,4,4,5,4,2,"",2,"",2,2,3,4,1,1,5,1,1,1,1,22,1,1,11,3,1,1,0,2,1,6,5,1,3,5,1,56,0,0,0,0,2,1,455
"456",456,506,"2017-09-07 19:10:59","2017-09-07 19:16:42",5,1.6085,5,"I truly believe in existence of god.",NA,"temple",NA,1,70,30,6,6,6,5,6,6,6,6,7,6,0,0,0,0,0,0,0,1,0,0,0,0,0,0,0,0,0,1,5,5,"when there is good, there will be bad as well. Can't say it is going in right direction or wrong direction until the destination is reached",NA,-1,-1,-1,-1,-1,-1,-1,-1,2,-1,-1,-1,-1,-1,-1,-1,-1,-1,-1,-1,-1,-1,-1,-1,-1,-1,-1,-1,-1,-1,-1,-1,1,-1,-1,-1,-1,-1,-1,-1,-1,-1,-1,-1,-1,-1,-1,-1,-1,-1,-1,-1,-1,-1,-1,-1,-1,-1,-1,-1,-1,-1,-1,-1,-1,-1,-1,-1,-1,-1,-1,-1,-1,-1,-1,-1,-1,2,"",4,"",2,1,-1,-1,2,4,5,3,5,1,1,36,3,2,12,4,3,1,1,4,1,19,1,1,3,5,1,56,0,1,1,0,2,1,456
"457",457,507,"2017-09-07 19:11:10","2017-09-07 19:53:38",42,1.3824,5,"I believe that there's one God in three person.  God the father,  God the son and God the Holly Spirit. God is real,  and it is great to have hope in Jesus(the son) especially around time like these.",NA,"Pentecostal",NA,1,95,5,7,7,7,7,7,7,7,6,7,6,0,1,0,0,0,0,0,0,0,0,0,0,0,0,0,0,0,2,6,1,"I truly can't tell whether it is heading into the right or wrong direction because we only see the evil that are being done while there are so many hidden good that are being done. The more evil you see,  there's even more righteousness at play.  That's my opinion.",NA,10,100,96,3,15,20,6,10,1,4,7,6,6,6,2,7,3,2,1,1,2,3,4,1,2,1,2,1,4,1,4,1,2,2,1,1,1,1,1,1,1,4,6,4,5,4,5,5,5,7,5,6,5,1,7,3,5,4,2,4,2,5,5,4,4,4,4,4,4,5,4,4,3,3,4,4,4,1,"",4,"",1,1,6,6,1,1,6,1,1,1,1,34,2,2,11,3,2,2,1,4,3,10,1,1,3,5,2,59,1,1,0,0,2,4,457
"458",458,509,"2017-09-07 19:11:55","2017-09-07 19:40:34",28,1.1068,5,"God is the creator of the Universe.",NA,"Protestant",NA,1,95,5,7,7,7,7,6,7,7,7,7,7,0,1,0,0,0,0,0,0,0,0,0,0,0,0,0,0,0,1,1,1,"Wrong direction.  People have turn their backs on God and the principles this Country was founded upon.",NA,10,5,47,3,29,15,4,20,3,3,6,6,3,5,6,6,1,1,1,2,1,1,2,1,3,2,4,1,3,2,3,3,2,3,3,3,3,3,3,3,2,5,5,3,5,3,5,3,6,6,2,2,2,6,1,7,5,3,2,5,3,5,5,5,5,3,5,5,3,3,3,5,3,3,5,3,3,2,"",4,"",2,2,7,5,1,1,3,1,3,1,1,39,3,2,13,4,2,1,1,4,1,19,1,1,4,9,1,93,0,0,1,1,2,1,458
"459",459,510,"2017-09-07 19:13:02","2017-09-07 19:44:15",31,0.6796,5,"I do believe in a higher existence",NA,"I am Christian of the roman catholic faith",NA,1,85,15,6,6,6,6,5,7,6,4,6,4,1,0,0,0,0,0,0,0,0,0,0,0,0,0,0,0,0,1,5,1,"Wrong direction. People need to accept other people for who they are and understand that their opinions are equally valid. We must learn to treat others as we would have others treat us.",NA,10,5,47,6,30,45,4,10,3,3,7,7,1,6,6,7,4,4,2,2,2,2,2,2,3,2,3,2,3,3,2,3,2,2,2,2,2,3,2,2,4,3,2,7,5,3,5,2,6,6,1,2,4,5,4,5,4,2,3,4,2,5,5,5,2,2,2,4,1,1,6,7,1,5,2,1,5,2,"",4,"",2,2,4,6,1,1,1,1,2,1,1,48,4,3,12,4,1,1,1,5,1,16,1,1,1,2,1,21,0,0,1,1,3,1,459
"460",460,511,"2017-09-07 19:14:13","2017-09-07 19:31:32",17,0.7198,5,"Everyone has there own beleifs",NA,"Lutheran",NA,1,80,20,6,5,6,5,6,6,6,4,6,6,0,1,0,0,0,0,0,0,0,0,0,0,0,0,0,0,0,2,5,3,"Right direction.",NA,10,5,24,3,29,15,3,10,2,4,4,4,4,4,4,4,2,2,2,1,2,1,2,2,3,2,2,2,2,3,2,3,2,1,1,1,1,1,1,1,4,4,4,4,4,4,4,4,4,4,4,4,4,4,4,4,4,4,4,4,4,4,4,4,4,4,4,4,4,4,4,4,4,4,4,4,4,2,"",4,"",1,1,4,4,1,1,2,1,2,1,1,58,5,3,11,3,1,1,1,2,1,16,3,1,4,8,1,84,0,0,0,0,2,1,460
"461",461,512,"2017-09-07 19:14:27","2017-09-07 19:40:45",26,0.9048,5,"I believe that God is our Father in Heaven, that He loves us, and that we lived with Him before we came to Earth. I believe that He is a perfected being of flesh and blood who lives in Heaven, and I believe He wants all of His children to return to Him after we die.",NA,"I'm a member of the Church of Jesus Christ of Latter-day Saints",NA,1,80,20,7,7,7,7,7,7,7,6,7,7,0,0,0,1,0,0,0,0,0,0,0,0,0,0,0,0,0,1,2,1,"This country is going in the wrong direction. The focus is shifting from general welfare to individual ""rights,"" or in other words, to selfishness. Families are being weakened by divorce, abortion, children born out of wedlock, and because of the demand for our right to make bad choices, the government is passing laws that encourage such choices, or at least do nothing to redirect them. People want to make bad choices and then expect the government to take away their consequences.",NA,5,100,16,6,29,15,4,20,3,5,5,6,6,3,4,4,2,1,1,2,2,1,2,1,3,2,3,1,3,3,2,2,2,4,4,4,4,4,4,4,4,2,3,4,6,2,6,4,1,5,7,5,5,4,5,5,7,3,1,3,3,2,2,4,4,4,4,4,3,5,4,4,4,2,4,5,4,1,"",4,"",1,1,7,6,1,1,1,1,2,1,1,34,2,2,13,4,1,2,1,3,1,14,1,1,3,7,1,74,0,1,0,0,2,7,461
"462",462,513,"2017-09-07 19:15:09","2017-09-07 19:33:16",18,1.1159,5,"",-1,"None.",NA,2,60,40,1,1,1,1,1,1,1,1,1,1,0,0,0,0,0,0,0,0,0,0,0,0,0,1,0,0,0,1,7,7,"Wrong direction.  Our current administration is a disaster.",NA,5,5,47,3,15,15,4,20,3,4,2,6,3,3,3,5,3,3,1,1,1,2,1,1,3,2,1,1,4,3,3,3,2,4,3,4,3,4,3,4,5,1,6,6,6,1,7,2,3,5,5,2,1,2,5,6,7,2,1,1,2,2,1,4,2,2,2,4,2,2,6,5,2,2,2,4,4,2,"",3,"",1,2,1,1,1,1,7,1,1,1,1,39,3,2,10,3,1,1,1,1,3,12,5,1,3,5,2,54,0,0,0,0,1,1,462
"463",463,514,"2017-09-07 19:15:19","2017-09-07 19:42:41",27,0.9642,5,"I believe",NA,"Catholic",NA,1,67,33,5,5,5,5,5,5,6,5,5,3,1,0,0,0,0,0,0,0,0,0,0,0,0,0,0,0,0,1,5,3,"Wrong direction",NA,5,1,24,3,31,15,4,60,3,2,4,5,3,5,4,4,2,3,3,1,1,2,-1,2,3,3,4,2,4,3,3,3,2,2,2,4,2,4,3,4,3,6,5,5,6,3,5,2,3,6,2,3,3,6,3,3,4,2,3,3,3,4,2,2,3,3,3,4,3,3,5,5,3,4,3,3,5,1,"",4,"",1,1,3,3,1,1,6,1,1,1,1,65,6,4,9,2,1,2,1,5,1,19,1,1,1,1,1,14,0,0,0,1,4,5,463
"464",464,515,"2017-09-07 19:15:32","2017-09-07 19:38:05",22,1.012,5,"God does exist",NA,"None",NA,1,75,25,6,5,5,6,4,6,5,5,5,5,0,1,0,0,0,0,0,0,0,0,0,0,0,0,0,0,0,1,7,2,"Right changes needed to be made",NA,10,100,16,6,30,20,3,80,2,3,6,5,3,5,5,5,1,2,2,2,3,3,2,1,1,2,4,3,2,3,3,2,2,1,2,1,1,2,1,2,4,2,2,6,5,4,5,3,5,4,2,2,4,6,5,6,6,2,2,1,4,4,1,2,2,2,2,2,2,2,6,5,4,3,2,2,3,1,"",4,"",1,2,1,1,1,1,5,1,2,1,1,38,3,2,13,4,1,2,1,3,1,12,3,1,3,5,2,56,0,0,0,1,2,1,464
"465",465,516,"2017-09-07 19:15:50","2017-09-07 20:02:24",46,0.6293,5,"believe",NA,"Chistian",NA,1,50,50,6,5,5,5,5,5,7,5,5,5,0,0,0,0,0,0,0,0,0,0,1,0,0,0,0,0,0,1,7,3,"wrong, too much technology and to much politics",NA,10,20,24,3,15,20,9,10,3,5,5,5,4,5,5,5,1,1,1,2,1,1,1,2,3,3,3,2,2,3,2,3,2,2,2,2,2,2,2,2,4,5,6,3,5,4,5,4,2,-1,3,5,4,4,5,4,4,6,3,5,4,4,4,4,5,6,6,4,5,6,5,2,5,2,6,5,3,2,"",4,"",1,1,5,6,1,1,1,1,2,1,1,85,7,4,12,4,1,1,1,1,1,17,2,1,3,7,1,73,0,0,0,0,1,5,465
"466",466,517,"2017-09-07 19:16:24","2017-09-07 21:14:13",117,1.1626,5,"God does exist.",NA,"church",NA,1,80,20,7,7,7,7,7,7,7,7,7,4,0,1,0,0,0,0,0,0,0,0,0,0,0,0,0,0,0,1,4,1,"RIght now, I'm not sure.",NA,10,500,24,6,30,20,3,10,3,7,7,7,2,7,7,7,4,4,2,2,2,3,3,2,3,1,3,2,3,2,2,3,2,3,3,3,3,4,3,3,3,5,5,4,6,2,4,2,3,6,3,5,5,3,4,2,5,3,2,3,2,4,4,3,4,2,4,5,2,3,5,4,5,3,4,3,4,1,"",4,"",1,1,5,5,1,1,2,1,2,1,1,42,3,2,10,3,1,2,0,3,1,11,1,0,3,5,2,57,0,0,1,0,2,1,466
"467",467,518,"2017-09-07 19:16:39","2017-09-07 19:33:25",16,1.1857,5,"I BELIEVE THERE IS ONE GOD",NA,"CHRISTIAN",NA,1,80,20,7,7,7,7,5,5,7,7,7,5,0,0,0,0,0,0,0,0,0,0,1,0,0,0,0,0,0,1,7,2,"right direction. we just went thru a natural disaster and the people give me a hope that there still are good people in the world.",NA,10,100,24,3,1,20,3,30,2,4,4,4,4,4,4,4,3,3,3,3,3,3,3,3,2,2,3,3,2,2,3,2,2,2,2,2,2,2,2,2,4,4,4,4,3,4,5,4,4,4,4,3,4,4,4,4,4,3,4,5,4,4,4,4,4,4,4,4,4,3,4,4,4,4,4,4,4,1,"",4,"",1,1,4,4,1,1,3,2,5,1,1,35,3,2,9,2,1,2,1,4,1,12,1,1,3,7,1,74,1,0,1,0,2,1,467
"468",468,519,"2017-09-07 19:16:52","2017-09-07 19:41:19",24,0.6082,5,"",-1,"non religious",NA,1,90,10,5,4,4,4,4,4,4,4,4,4,0,0,0,0,0,0,0,0,0,0,0,0,0,0,1,0,0,1,8,6,"don't know",NA,10,100,24,6,15,40,6,30,2,3,3,5,3,6,3,3,1,1,1,1,1,1,1,2,4,3,2,2,3,2,3,2,2,1,1,1,1,1,1,2,4,1,2,2,4,4,-1,1,3,5,3,2,2,5,3,4,6,4,1,4,4,4,4,5,4,4,5,4,4,4,4,4,4,4,5,4,5,2,"",4,"",1,1,6,6,1,1,1,1,2,1,1,68,6,4,10,3,1,1,0,1,1,6,3,1,4,9,1,93,0,0,0,0,1,5,468
"469",469,520,"2017-09-07 19:17:39","2017-09-07 19:26:50",9,0.9555,5,"",-1,"none",NA,1,70,30,6,5,4,4,1,4,4,4,4,4,0,0,0,0,0,0,0,0,0,0,0,0,1,0,0,0,0,2,8,3,"",-1,10,100,24,3,15,0,3,20,2,5,5,5,5,5,5,5,2,2,1,1,1,1,1,2,3,2,3,2,3,3,2,3,2,1,1,1,1,3,2,4,3,5,5,3,5,3,5,3,7,7,2,3,5,2,6,5,2,5,5,2,4,5,4,3,5,5,5,5,3,5,5,3,5,3,5,5,4,1,"",4,"",1,1,4,4,1,3,6,3,5,1,1,45,4,3,9,2,1,2,1,3,1,16,1,1,2,3,1,31,0,0,1,0,2,1,469
"470",470,521,"2017-09-07 19:18:03","2017-09-07 20:19:46",61,0.5342,5,"I am a Non demoninational Christian, and I believe in the Holy Trinity (The Father, The Son, and The Holy Spirit).",NA,"Non demoninational Christian",NA,1,70,30,7,7,7,7,7,7,7,7,6,3,0,0,0,0,0,0,0,0,0,0,1,0,0,0,0,0,0,1,6,1,"Wrong direction. I feel hate and wrong doing more than before.",NA,10,20,1,3,30,20,6,20,2,2,6,7,3,6,6,6,2,2,2,2,2,1,1,2,3,2,4,2,4,3,3,3,2,2,1,1,1,2,1,1,1,2,5,3,6,2,6,2,3,5,5,5,3,3,3,4,5,4,4,4,1,4,3,4,2,2,4,4,1,3,3,4,4,4,5,3,3,1,"",4,"",2,1,4,4,1,1,5,1,3,1,1,25,2,1,12,4,5,2,1,3,1,20,5,1,4,9,1,93,0,0,0,0,3,1,470
"471",471,522,"2017-09-07 19:18:14","2017-09-08 18:13:44",1375,0.9148,5,"Yes",NA,"Catholic church",NA,1,75,25,4,1,4,4,1,3,1,4,5,1,1,0,0,0,0,0,0,0,0,0,0,0,0,0,0,0,0,1,7,6,"I feel that our president is taking us in the wrong direction.  We all just need to get along.",NA,10,5,24,3,30,20,3,20,3,3,5,5,3,5,5,5,2,1,1,1,1,1,1,2,3,1,3,1,3,4,1,4,2,2,1,2,1,4,2,4,4,3,3,3,6,2,5,2,3,5,1,2,2,5,2,1,5,2,2,3,3,5,2,1,3,3,3,5,3,3,5,6,3,3,3,3,5,1,"",4,"",1,2,2,2,1,1,6,1,1,1,1,45,4,3,9,2,1,2,1,3,1,16,1,1,1,2,1,23,0,0,1,0,2,1,471
"472",472,523,"2017-09-07 19:18:41","2017-09-07 19:46:04",27,0.7797,5,"",-1,"roman catholic",NA,1,75,25,7,6,6,6,7,7,7,6,7,5,1,0,0,0,0,0,0,0,0,0,0,0,0,0,0,0,0,2,2,2,"",-1,5,-1,-1,3,30,15,4,30,3,5,3,6,3,2,6,5,2,2,1,2,2,1,2,1,3,3,1,2,4,3,2,3,2,4,3,3,3,3,3,3,2,6,6,2,6,2,5,2,3,6,2,1,1,6,2,7,1,5,6,2,1,1,1,1,5,3,6,4,3,5,5,2,2,2,3,5,2,1,"",4,"",1,1,5,3,1,1,5,1,1,1,1,69,6,4,12,4,1,2,1,2,1,14,1,1,2,3,1,31,0,0,0,0,2,5,472
"473",473,524,"2017-09-07 19:19:14","2017-09-08 04:00:29",521,0.8687,5,"Not really.",NA,"none.",NA,2,40,60,4,1,1,1,4,4,4,4,3,1,0,0,0,0,0,0,0,0,0,0,0,0,0,0,1,0,0,1,8,7,"Wrong",NA,5,100,47,3,29,15,4,20,3,2,5,6,6,5,6,6,2,1,1,2,2,1,2,2,4,1,3,1,1,2,3,2,2,2,1,1,1,1,1,1,1,6,6,2,6,1,3,3,7,7,1,1,5,5,5,2,6,2,2,2,1,4,1,-1,5,4,5,2,2,2,3,3,6,1,6,6,2,1,"",4,"",2,2,3,6,1,1,2,1,1,1,1,35,3,2,14,4,1,2,1,2,2,18,3,1,4,8,2,86,0,1,0,0,1,1,473
"474",474,525,"2017-09-07 19:19:16","2017-09-07 19:24:17",5,2.0534,5,"",-1,"",-1,1,20,80,4,4,4,4,4,4,4,4,4,4,0,0,0,0,0,0,0,0,0,0,0,0,1,0,0,0,0,2,8,7,"",-1,-1,-1,-1,-1,-1,-1,-1,-1,1,3,3,5,4,4,4,4,2,2,2,2,2,2,2,3,2,2,2,2,3,2,3,3,1,3,2,2,3,3,2,3,4,4,4,4,4,3,3,4,3,5,4,4,4,5,4,4,4,4,4,3,4,5,4,5,4,4,4,5,5,4,4,5,5,3,4,4,3,2,"",1,"",2,1,4,4,2,4,3,3,5,1,1,21,1,1,9,2,3,1,0,3,1,11,5,1,3,5,1,56,0,0,0,1,2,7,474
"475",475,526,"2017-09-07 19:19:16","2017-09-07 19:37:57",18,0.7842,2,"",-1,"Catholic",NA,1,75,25,6,5,6,4,6,6,6,4,6,5,1,0,0,0,0,0,0,0,0,0,0,0,0,0,0,0,0,2,5,3,"Right direction",NA,10,5,24,4,30,15,3,10,2,3,5,5,3,6,5,5,2,2,1,2,2,2,2,2,3,2,3,3,4,3,3,3,2,2,1,3,2,3,2,3,3,5,4,3,5,4,5,3,5,6,3,3,2,6,4,4,6,2,2,3,4,5,5,5,4,3,3,5,4,2,5,6,4,2,5,3,3,2,"",4,"",1,2,3,3,1,1,7,1,1,2,1,65,6,4,12,4,4,1,1,3,1,10,2,1,4,8,1,86,0,0,0,0,3,5,475
"476",476,527,"2017-09-07 19:20:40","2017-09-10 12:36:37",3915,0.9041,5,"unsure",NA,"none",NA,2,75,25,2,2,5,4,5,5,4,3,3,2,1,0,0,0,0,0,0,0,0,0,0,0,0,0,0,0,0,1,5,7,"",-1,5,5,47,3,29,15,4,10,3,6,4,5,5,6,3,6,2,2,2,2,2,1,2,2,3,1,3,2,3,3,2,3,2,3,2,2,2,3,2,4,1,3,4,2,6,3,4,2,4,6,4,2,4,3,5,5,2,3,5,2,1,1,3,4,3,3,3,2,1,2,5,4,2,3,5,2,3,1,"",4,"",2,2,3,6,1,1,3,1,3,1,1,31,2,2,12,4,1,2,1,2,1,17,1,1,1,2,1,23,0,0,0,0,2,1,476
"477",477,528,"2017-09-07 19:21:06","2017-09-07 19:59:40",38,1.5239,5,"",-1,"",-1,1,50,50,5,5,5,5,5,5,5,5,5,5,1,0,0,0,0,0,0,0,0,0,0,0,0,0,0,0,0,1,7,5,"",-1,10,100,12,3,30,60,6,20,3,3,6,6,5,5,5,5,2,1,1,2,2,1,2,3,3,3,3,2,3,3,3,3,2,4,2,3,2,3,3,3,3,4,5,3,5,4,5,4,4,5,4,4,4,5,4,4,4,4,4,4,4,4,4,5,4,4,4,4,4,4,4,4,4,4,4,4,4,1,"",4,"",2,2,3,4,1,1,6,1,1,1,1,33,2,2,12,4,3,2,1,2,1,20,1,1,4,9,1,93,0,0,0,0,2,1,477
"478",478,529,"2017-09-07 19:21:45","2017-09-07 20:30:17",68,1.4126,5,"I believe in one God the Almighty Jesus Christ, who is the Son of God. In my heart, I know He lives!",NA,"Conservative Baptsit",NA,1,88,12,7,7,7,7,2,7,7,1,7,6,0,1,0,0,0,0,0,0,0,0,0,0,0,0,0,0,0,1,1,1,"I  believe that when our Great Country sees the truth about our New U.S. President Trump and supports him, then we will be on the right track, moving in the right direction",NA,10,100,24,6,1,20,6,20,2,5,5,7,2,5,5,6,1,1,1,3,1,2,3,2,4,3,4,1,4,3,4,4,3,2,2,2,1,2,2,2,5,2,5,5,6,2,7,2,5,7,2,5,2,6,2,6,7,2,2,2,2,3,3,6,4,5,5,3,5,5,5,6,5,5,5,5,6,1,"",4,"",1,1,7,2,1,1,1,1,2,1,1,61,5,4,12,4,1,2,1,3,1,12,1,0,4,9,1,92,0,0,0,0,3,2,478
"479",479,530,"2017-09-07 19:22:12","2017-09-07 20:05:50",43,0.9717,5,"God, creator, the One, Father, Abba, Christian trinity",NA,"Episcopal Church",NA,1,67,33,7,4,6,6,7,7,6,3,7,6,0,1,0,0,0,0,0,0,0,0,0,0,0,0,0,0,0,2,2,1,"Wrong. Too many people are willing to give their power and provenance over to hollow promises made by braggargs, bigots and charlatans. This is not to say all politicians are bax. We happen to have a loud mouth who has convinced people that America is bad, and by extension, they also are lacking.",NA,10,100,47,3,29,15,9,0,3,5,5,5,6,5,5,5,3,3,3,2,2,1,2,1,2,1,3,2,2,2,1,3,2,3,3,2,3,2,1,3,3,5,5,3,5,3,4,3,3,3,4,5,5,4,3,5,5,3,3,4,3,4,3,4,6,4,5,4,3,3,3,4,3,3,5,5,2,2,"",4,"",1,1,2,4,1,1,5,1,1,1,1,30,2,2,11,3,1,1,1,2,2,13,1,1,4,9,1,91,0,0,0,0,2,1,479
"480",480,532,"2017-09-07 19:22:43","2017-09-07 19:45:02",22,0.6206,5,"God exists",NA,"Roman Catholic",NA,1,75,25,7,3,6,3,6,7,7,5,6,2,1,0,0,0,0,0,0,0,0,0,0,0,0,0,0,0,0,2,2,6,"wrong direction",NA,5,5,47,3,29,15,4,20,3,6,6,6,5,5,5,6,2,1,1,2,2,4,1,1,3,3,3,2,4,4,2,3,2,3,2,2,3,3,3,2,3,6,5,4,3,4,2,4,2,5,5,2,2,3,2,4,4,1,2,3,1,1,1,2,2,6,2,2,2,2,6,6,2,6,2,5,2,2,"",4,"",1,1,2,2,1,1,5,1,1,1,1,65,6,4,14,4,1,1,1,2,1,16,1,1,1,2,1,21,0,0,0,0,2,5,480
"481",481,533,"2017-09-07 19:22:44","2017-09-07 19:46:36",23,0.8636,5,"that there aren't any.",NA,"atheist",NA,2,85,15,1,1,7,5,7,7,1,6,6,1,0,0,0,0,0,0,0,0,0,0,0,0,0,0,1,0,0,1,8,7,"wrong",NA,10,-1,-1,-1,1,-1,2,30,3,4,5,5,2,6,6,6,1,1,1,3,2,3,2,3,4,4,4,2,4,3,2,4,2,3,1,2,2,3,2,3,4,2,6,6,7,2,6,2,5,6,2,2,1,6,2,2,7,3,1,2,1,1,1,1,4,2,4,5,2,5,6,6,2,4,5,2,5,1,"",4,"",1,2,1,1,1,1,7,1,1,1,1,65,6,4,9,2,1,2,1,2,1,12,1,1,4,9,1,93,0,0,0,0,2,2,481
"482",482,534,"2017-09-07 19:22:51","2017-09-07 19:31:10",8,1.7059,2,"God is real",NA,"Catholic",NA,1,70,30,7,7,7,7,4,7,4,4,7,5,1,0,0,0,0,0,0,0,0,0,0,0,0,0,0,0,0,1,8,5,"Wrong direction",NA,-1,100,-1,-1,-1,-1,-1,10,2,3,5,5,5,6,3,6,4,4,2,1,1,3,1,2,2,2,3,3,4,2,3,2,3,2,1,1,1,2,1,1,4,7,5,1,5,5,5,5,5,6,3,2,5,5,5,2,5,2,5,2,5,7,6,7,4,6,4,4,4,6,3,4,5,4,4,5,4,1,"",4,"",1,1,4,4,1,1,6,2,5,2,1,27,2,1,7,1,4,2,0,3,3,10,6,1,4,9,2,93,1,0,0,0,2,7,482
"483",483,535,"2017-09-07 19:23:03","2017-09-07 19:39:17",16,1.0528,1,"There isn't one.",NA,"none",NA,2,80,20,2,2,3,3,2,3,2,2,3,2,1,0,0,0,0,0,0,0,0,0,0,0,0,0,0,0,0,2,8,7,"It is headed in the wrong direction. PROOF: Trump was elected president.",NA,5,5,47,3,29,45,4,0,2,3,6,5,3,6,5,5,3,2,1,2,1,2,1,1,3,1,3,3,3,2,2,2,2,2,1,2,1,1,1,1,3,5,6,2,5,2,4,2,5,5,2,3,3,3,3,2,6,2,6,2,1,2,2,3,4,2,4,3,2,2,4,4,4,4,4,2,3,2,"",3,"",1,1,2,2,1,1,6,1,1,2,1,44,3,2,10,3,4,1,1,2,3,17,6,1,4,9,2,93,0,0,0,0,2,2,483
"484",484,536,"2017-09-07 19:23:33","2017-09-07 20:48:31",84,0.9126,5,"There is a God and I am not Him.",NA,"Baptist/Christian",NA,1,100,0,7,7,7,7,7,7,7,7,7,7,0,1,0,0,0,0,0,0,0,0,0,0,0,0,0,0,0,2,1,1,"It is going in the wrong direction.  America is becoming so liberal, agreeing that if it feels good then it's ok to do.  School are dumbing down our kids and teaches them there is no God.  The government wants to remove God and morals from our society and our Constitution.  The Christian is being persecuted while Muslims are praised and welcomed.  Where is God welcomed?",NA,10,100,24,3,30,20,9,20,2,5,4,4,5,1,4,5,3,2,2,2,2,2,1,2,3,2,4,3,3,3,2,3,2,3,3,3,3,4,3,4,1,5,4,3,4,2,3,2,7,7,2,1,3,2,4,5,4,2,4,4,2,4,5,1,2,2,2,4,1,3,5,4,1,3,2,1,5,2,"",4,"",1,1,7,7,1,1,2,1,2,1,1,55,5,3,11,3,1,1,0,3,1,12,1,1,3,5,1,58,0,0,0,0,3,1,484
"485",485,537,"2017-09-07 19:24:04","2017-09-07 19:49:55",25,0.7402,5,"I believe in God and that he created our world.",NA,"Lutheran",NA,1,75,25,6,5,5,5,5,5,6,3,5,4,0,1,0,0,0,0,0,0,0,0,0,0,0,0,0,0,0,1,4,4,"Considering all that is happening right now in our world, our country is going to hell in a hand basket. I have never seen our country so divided. The word ""compromise "" no longer exists in our language. Laws mean nothing to some people. They think they have the right to pick and choose which laws they'll obey.",NA,5,100,24,3,30,20,9,10,3,6,5,5,3,5,5,5,2,2,1,2,2,1,2,1,2,2,3,2,4,3,2,3,2,2,1,2,2,2,1,2,2,5,5,3,6,3,6,3,5,5,2,3,4,4,4,2,5,4,2,4,2,2,2,2,4,4,4,4,4,4,4,4,4,4,4,4,4,2,"",4,"",1,1,5,5,1,1,3,1,2,1,1,78,7,4,9,2,1,1,1,2,1,13,1,0,2,3,1,32,0,0,0,0,2,5,485
"486",486,540,"2017-09-07 19:27:24","2017-09-08 03:24:32",477,0.6857,5,"There is a God!",NA,"",-1,1,75,25,7,7,7,1,7,7,7,2,7,7,1,0,0,0,0,0,0,0,0,0,0,0,0,0,0,0,0,2,2,1,"Wrong direction ! We need to be more Christian like!",NA,10,100,24,3,-1,20,6,206,2,2,7,6,1,6,6,7,3,2,1,1,1,2,3,1,3,2,3,3,4,4,2,4,2,4,3,3,3,4,2,4,4,3,2,6,7,2,6,2,4,5,2,3,3,6,3,4,3,4,2,3,1,2,2,5,4,2,3,4,3,1,6,5,2,4,4,3,4,1,"",4,"",1,1,5,5,1,1,3,1,2,1,1,74,6,4,12,4,1,2,1,1,3,11,2,1,1,2,2,23,0,0,0,0,1,1,486
