411,411,453,9/7/17 18:47,9/8/17 0:28,341,0.6293,5,No,NA,None,NA,2,68,32,1,1,1,5,1,1,1,6,1,1,0,0,0,0,0,0,0,0,0,0,0,0,1,0,0,0,0,1,8,7,Wrong direction....Christians are persecuted and Muslim extremist praised,NA,5,1,8,3,25,15,4,10,3,5,5,5,5,5,4,4,1,1,1,1,2,1,1,2,3,3,3,2,2,4,2,3,2,3,3,3,2,3,3,3,2,5,5,3,5,3,4,4,5,6,2,2,1,6,5,6,5,3,2,4,2,2,2,2,3,3,3,4,2,3,5,5,3,4,3,3,5,2,,4,,1,1,7,7,1,1,1,1,2,1,1,67,6,4,13,4,1,1,1,2,1,17,1,1,3,7,1,74,0,0,0,0,2,5,411
412,412,454,9/7/17 18:47,9/7/17 19:23,36,0.7266,5,don't believe it,NA,none,NA,2,60,40,1,1,1,1,1,5,1,1,4,1,0,0,0,0,0,0,0,0,0,0,0,0,1,0,0,0,0,2,8,7,i have no faith in the ability of the President of the United States. I'm hopeful Congress can become a functional body. Direction--it's hard to say.,NA,5,5,47,3,30,0,4,30,3,5,5,5,6,5,5,5,2,2,2,1,1,1,1,2,2,3,2,2,3,3,2,3,2,1,1,1,1,1,1,1,2,5,4,-1,6,2,2,2,5,6,4,5,2,-1,2,7,2,2,5,2,2,2,2,4,3,4,4,6,2,2,6,6,3,6,4,4,4,1,,4,,1,1,1,2,1,1,7,1,1,1,1,69,6,4,13,4,1,2,1,3,1,18,1,1,4,8,1,88,0,0,0,0,3,1,412
413,413,455,9/7/17 18:48,9/7/17 19:28,39,0.7569,5,I believe in the Lord and the Trinity,NA,Episcopal,NA,1,40,60,7,7,7,7,7,7,7,5,7,7,0,1,0,0,0,0,0,0,0,0,0,0,0,0,0,0,0,2,2,2,wrong direction.  organized mainstream churches are losing people,NA,10,100,24,3,1,20,3,10,3,1,1,7,1,7,1,7,1,1,1,2,2,1,2,1,3,2,2,2,2,2,3,3,2,4,2,2,1,3,2,3,1,6,7,2,7,1,7,1,3,3,5,6,2,3,5,2,3,7,3,4,1,2,1,1,3,4,5,3,4,-1,5,3,4,2,5,6,-1,1,,4,,1,2,2,3,1,1,6,1,1,1,1,70,6,4,13,4,1,2,1,1,3,15,2,1,3,5,2,52,0,0,0,0,1,5,413
414,414,456,9/7/17 18:48,9/8/17 2:45,476,0.9,5,I believe we were created by a loving Heavenly Father who sent us to earth to prove ourselves.,NA,The Church of Jesus Christ of Latter day Saints,NA,1,75,25,7,7,7,6,6,6,5,4,7,6,0,0,0,1,0,0,0,0,0,0,0,0,0,0,0,0,0,2,1,1,In the wrong direction. I think the government its self is the best we have. The men and women in the government are not honest and forthright.,NA,10,500,24,6,30,20,4,10,2,3,6,6,5,6,5,6,2,1,1,1,1,1,1,2,3,2,4,2,3,3,4,3,2,4,4,4,3,4,4,4,1,1,3,2,6,2,4,2,3,5,2,3,4,3,2,3,4,4,3,6,1,2,1,1,5,3,3,5,3,5,4,3,2,4,5,3,4,1,,4,,1,1,4,4,1,1,2,1,2,1,1,56,5,3,10,3,1,2,1,5,1,18,1,1,4,8,1,87,0,0,0,0,5,2,414
415,415,457,9/7/17 18:49,9/7/17 19:22,32,1.6111,3,"Creó que es por Dios que existen todas las cosas, el cielo la tierra ,los animales y el ser humano",NA,Iglesia católica,NA,1,90,10,7,6,7,6,6,7,4,6,7,6,1,0,0,0,0,0,0,0,0,0,0,0,0,0,0,0,0,2,2,1,"En realidad no se, pero si se que o creó que cada persona debe de hacer lo mejor, cada iglesia debe de hacer que  las personas den lo mejor de si mismas",NA,10,20,24,3,15,40,6,30,2,4,6,6,4,6,6,7,1,2,1,2,4,4,2,3,3,2,4,3,4,2,2,3,2,4,1,2,1,3,2,4,4,2,2,6,5,2,5,3,5,5,2,2,2,5,2,7,5,6,2,4,4,4,1,2,4,6,4,5,4,6,3,5,5,5,4,6,6,1,,4,,1,1,6,6,1,1,7,1,1,2,2,64,5,4,6,1,4,2,1,2,1,11,1,1,2,3,2,33,0,0,0,0,2,5,415
416,416,458,9/7/17 18:50,9/7/17 19:08,18,1.2851,2,Depende de la educacion religiosa de cada persona.,NA,Catolico,NA,2,60,40,7,6,7,7,4,7,6,4,5,1,1,0,0,0,0,0,0,0,0,0,0,0,0,0,0,0,0,2,5,1,Correcta debido que existen personas que dirigen al pais de forma educada y correcta.,NA,10,1000,24,6,15,20,3,20,3,6,5,7,3,5,6,7,2,4,2,1,3,1,1,1,4,3,4,2,4,3,4,3,2,1,1,4,1,2,2,4,4,2,4,3,5,2,5,1,6,7,1,4,3,6,2,4,6,1,1,1,1,6,1,1,4,1,5,7,6,3,6,6,3,4,4,4,3,2,,4,,1,1,2,2,1,2,5,3,5,2,2,39,3,2,10,3,4,1,0,1,3,7,1,1,4,8,2,86,0,0,0,0,1,4,416
417,417,460,9/7/17 18:50,9/7/17 19:01,11,0.9375,5,I do not believe,NA,none,NA,2,50,50,4,4,4,4,4,4,4,4,4,4,0,0,0,0,0,0,0,0,0,0,0,0,1,0,0,0,0,1,7,7,,-1,-1,-1,-1,-1,15,-1,4,0,2,4,4,4,4,4,4,4,2,2,1,1,2,1,2,-1,-1,-1,-1,-1,3,-1,-1,-1,2,-1,-1,-1,-1,-1,-1,-1,4,4,4,4,4,4,4,4,4,4,4,4,4,4,4,4,4,4,4,4,4,4,4,4,4,4,4,4,4,4,4,4,4,4,4,4,4,1,,4,,1,2,1,1,1,1,7,1,1,1,1,51,4,3,10,3,1,2,1,4,1,15,1,1,3,5,1,58,0,0,0,1,3,7,417
418,418,462,9/7/17 18:51,9/7/17 19:13,22,0.8891,5,I believe in God and worship him regularly.,NA,Lutheran,NA,1,60,40,7,6,6,4,4,6,4,4,6,4,0,1,0,0,0,0,0,0,0,0,0,0,0,0,0,0,0,2,2,1,,-1,10,5,47,3,30,20,3,30,3,4,6,6,3,6,5,5,3,2,1,2,2,2,2,3,3,3,4,2,4,3,2,3,2,4,3,4,3,4,3,3,4,4,4,5,6,2,6,2,5,6,2,2,4,5,4,4,5,4,5,4,4,4,4,6,4,4,4,4,4,5,4,5,5,4,4,6,4,1,,4,,1,2,2,4,1,1,4,1,-1,1,1,71,6,4,9,2,1,2,1,1,1,18,3,0,2,4,1,41,0,0,0,0,1,5,418
419,419,463,9/7/17 18:51,9/7/17 19:41,49,0.7497,5,i believe in one god,NA,catholic,NA,1,60,40,6,6,6,6,6,6,6,6,6,6,1,0,0,0,0,0,0,0,0,0,0,0,0,0,0,0,0,1,2,2,,-1,10,1,24,-1,29,20,4,20,3,5,6,4,4,5,4,5,2,2,1,2,2,1,1,2,3,2,3,3,3,3,3,4,2,4,2,3,2,3,4,3,5,2,5,6,6,4,5,4,6,6,3,4,4,5,5,4,6,4,2,4,4,4,4,5,4,3,4,4,4,4,4,4,4,4,4,4,4,2,,4,,2,2,5,5,1,1,3,1,2,1,1,65,6,4,9,2,1,1,1,2,1,14,1,1,2,4,1,41,0,0,0,0,2,5,419
420,420,464,9/7/17 18:52,9/7/17 19:17,25,0.7469,5,There is a God.,NA,Episcopal,NA,1,80,20,6,5,3,6,4,5,5,5,5,5,0,1,0,0,0,0,0,0,0,0,0,0,0,0,0,0,0,1,5,3,Going in the wrong direction. More and more people are losing there faith and belief in an all powerful higher power,NA,10,100,24,3,30,20,4,10,2,4,4,-1,4,4,4,5,3,3,1,3,3,3,3,2,3,4,4,4,3,3,3,3,2,3,3,3,3,3,3,3,4,3,5,4,5,5,5,3,4,3,4,5,5,4,5,3,3,5,4,4,4,4,3,4,4,4,4,4,4,4,4,4,4,5,4,4,4,2,,4,,1,2,4,4,1,2,4,3,5,1,1,50,4,3,9,2,1,1,1,1,1,2,5,1,3,5,2,57,0,0,0,0,1,6,420
421,421,465,9/7/17 18:52,9/7/17 19:08,15,1.0216,5,Very real,NA,Lutheran,NA,1,75,25,7,7,7,4,4,5,7,3,7,1,0,1,0,0,0,0,0,0,0,0,0,0,0,0,0,0,0,2,5,1,Wrong,NA,10,10,50,18,518,105,12,20,2,6,6,4,3,6,6,6,1,1,1,1,1,1,1,2,4,4,4,1,3,3,4,4,2,1,1,1,1,1,1,1,2,1,5,5,7,1,6,2,5,7,1,1,6,6,6,5,5,4,1,5,3,2,2,6,3,4,4,5,-1,5,4,4,6,4,4,4,-1,1,,1,,1,2,1,1,1,1,1,1,2,1,1,70,6,4,9,2,1,2,1,2,1,12,1,1,2,3,1,35,0,0,0,0,2,5,421
422,422,466,9/7/17 18:53,9/7/17 19:15,22,0.7986,1,I believe in one God,NA,Luthern church,NA,1,70,30,7,5,6,5,4,6,6,5,7,5,0,1,0,0,0,0,0,0,0,0,0,0,0,0,0,0,0,2,2,1,Wrong direction.  Too much violence.  Change in weather causing too much destruction and loss of lives.,NA,10,-1,-1,-1,-1,-1,-1,10,2,5,4,4,3,5,2,4,2,2,1,2,1,1,2,2,4,3,3,1,3,3,2,2,2,4,3,4,4,4,3,4,3,2,3,5,5,4,3,2,5,5,3,2,2,5,4,4,4,4,3,4,1,2,3,4,4,3,4,4,4,5,4,5,3,3,4,3,4,1,,4,,1,2,4,5,1,1,7,1,1,2,1,66,6,4,13,4,4,2,1,2,1,16,1,1,4,9,1,93,0,0,0,0,2,5,422
423,423,467,9/7/17 18:53,9/7/17 19:19,26,0.7271,5,I believe there is a god,NA,Catholic,NA,1,90,10,7,7,7,7,7,7,4,4,7,3,1,0,0,0,0,0,0,0,0,0,0,0,0,0,0,0,0,1,2,2,If the democrats were not around it would be the right direction,NA,10,5,24,3,15,20,3,10,3,5,7,5,3,7,4,7,2,2,1,2,2,1,1,1,4,3,4,1,1,3,3,3,2,1,1,3,1,3,1,3,2,5,4,7,6,4,6,1,6,7,2,3,3,6,3,4,6,4,6,5,1,4,1,1,6,4,5,4,4,4,4,1,3,1,6,4,2,2,,4,,1,1,5,6,1,1,3,1,2,1,1,73,6,4,9,2,1,1,1,2,3,17,1,1,1,2,1,21,0,0,0,0,2,5,423
424,424,469,9/7/17 18:54,9/7/17 19:19,24,0.7284,5,Everyone has an individual entity to believe in not matter what religion you tend to act with. There is only one God.,NA,I am a non-denomination person and look to the values parents were teaching before hip hop or crap music and cell phones.,NA,1,70,30,6,6,6,6,4,6,6,6,6,6,0,1,0,0,0,0,0,0,0,0,0,0,0,0,0,0,0,2,3,1,There is to much hate and anger. Too many people want something for nothing and expect others to carry the bill.,NA,0,25,24,3,1,40,3,20,3,4,5,5,4,6,4,5,3,2,2,2,2,2,1,2,3,1,3,3,3,2,3,3,2,3,2,3,2,3,3,3,5,3,4,5,5,3,5,3,5,6,3,3,4,5,4,4,5,3,5,3,4,4,4,3,4,4,5,4,5,4,4,5,5,5,4,5,5,2,,4,,1,2,7,7,1,1,3,1,2,1,1,56,5,3,14,4,1,1,1,2,1,10,3,0,3,6,1,62,0,0,1,0,1,2,424
425,425,470,9/7/17 18:54,9/7/17 19:25,30,0.8342,5,One god,NA,None. Non church goer . Raised as Catholic.,NA,1,75,25,6,6,6,6,5,5,3,3,5,4,0,0,0,0,0,0,0,0,0,0,0,0,1,0,0,0,0,2,8,1,It is headed in the wrong direction.  There is so much intolerance and hate-very sad. We have forgotten what made us a great nation . I pray every day for my country.,NA,10,500,24,12,30,20,18,80,2,3,5,5,7,5,5,5,1,1,1,2,2,1,3,2,3,3,3,2,2,3,2,3,2,3,3,3,2,3,3,2,-1,-1,-1,7,7,1,6,1,-1,6,4,3,4,4,3,4,7,3,1,3,-1,2,-1,3,5,2,4,5,5,3,5,5,4,3,2,5,5,1,,4,,1,1,2,4,1,1,6,1,1,1,1,74,6,4,10,3,1,2,0,2,1,8,3,1,3,5,1,59,0,0,0,0,2,5,425
426,426,471,9/7/17 18:54,9/7/17 19:12,17,0.7535,5,I do not believe,NA,Agnostic,NA,2,40,60,1,2,2,2,2,2,1,1,5,1,0,0,0,0,0,0,0,0,0,0,0,0,0,0,1,0,0,2,8,7,"I think it is going in the right direction where less people are going to religious places, which in and of itself does not mean you don't believe, but that you don't need an organized religion for it.",NA,5,5,24,3,30,15,4,30,3,5,6,4,2,5,6,5,3,3,3,1,2,2,2,1,4,1,3,3,2,2,2,3,2,1,1,1,1,2,1,1,6,1,2,6,6,2,6,2,3,6,1,1,2,6,2,4,5,2,2,2,2,5,2,1,4,1,5,3,2,1,5,7,1,4,5,2,2,2,,4,,1,2,4,6,1,1,2,1,2,1,1,40,3,2,13,4,1,1,1,2,1,11,1,1,1,1,1,14,0,0,0,0,2,1,426
427,427,472,9/7/17 18:55,9/7/17 19:22,27,0.8271,5,"I believe in God, as our Heavenly Father.  He created us and is the father of our spirits, and also created the earth - and everything!",NA,The Church of Jesus Christ of Latter-day Saints,NA,1,80,20,7,7,7,7,7,7,7,7,7,7,0,0,0,1,0,0,0,0,0,0,0,0,0,0,0,0,0,2,1,1,Wrong direction,NA,10,100,24,12,30,20,3,20,3,5,5,5,6,6,6,6,2,2,1,1,2,2,1,2,4,2,4,2,3,3,1,3,2,4,4,4,4,4,4,4,3,3,4,5,5,2,5,2,6,7,4,4,2,4,3,6,3,6,5,6,1,3,2,3,4,3,4,3,4,5,5,3,4,2,4,6,4,1,,4,,1,1,6,6,1,1,1,1,3,1,1,49,4,3,10,3,1,2,1,5,1,17,1,1,4,8,1,87,0,0,0,1,4,1,427
428,428,473,9/7/17 18:58,9/7/17 19:04,6,1.051,5,What god,NA,None,NA,2,50,50,4,4,4,4,4,4,4,4,4,4,0,0,0,0,0,0,0,0,0,0,0,0,0,0,0,1,0,1,7,7,Idc,NA,5,5,5,6,1,20,6,30,3,4,4,4,4,4,4,-1,1,1,1,1,1,1,1,1,1,1,1,1,1,1,1,1,1,1,1,1,1,1,1,1,4,4,4,4,4,4,4,4,4,4,4,4,4,4,4,4,4,4,4,4,4,4,4,4,4,4,4,4,4,4,4,4,4,4,4,4,4,1,,4,,1,2,4,4,1,1,3,2,5,1,1,33,2,2,8,1,1,2,0,6,1,5,1,1,3,5,2,58,0,0,3,1,2,6,428
429,429,474,9/7/17 18:58,9/7/17 19:28,29,0.7777,5,I believe there is one God and creator.,NA,An independent Christian community church.,NA,1,70,30,7,7,7,6,7,7,7,7,7,6,0,0,0,0,0,0,0,0,0,0,1,0,0,0,0,0,0,1,2,1,Wrong direction. The country wants to eliminate God from everything and will persecute those that believe.,NA,5,1,12,3,30,20,9,20,2,4,5,5,6,5,5,6,2,2,1,2,2,1,2,1,2,2,3,1,1,3,2,3,2,4,3,3,3,2,3,2,3,4,3,3,6,2,6,2,4,5,2,3,2,4,3,6,5,2,2,2,2,2,2,2,4,3,3,3,3,2,4,4,3,5,5,3,3,2,,4,,1,1,6,6,1,1,3,1,2,1,1,63,5,4,11,3,1,1,1,2,1,16,1,1,2,3,1,35,0,0,0,0,2,5,429
430,430,475,9/7/17 18:58,9/7/17 19:15,17,1.1454,5,I believe in God.,NA,Roman Catholic Church.,NA,1,75,25,-1,6,5,-1,-1,-1,6,6,-1,4,1,0,0,0,0,0,0,0,0,0,0,0,0,0,0,0,0,1,2,1,Wrong direction led by a President who is not honest and upstanding.,NA,5,100,47,3,15,15,5,30,2,6,6,5,3,6,5,6,2,2,3,2,2,2,1,1,3,2,3,2,3,3,4,3,2,4,3,3,2,3,4,3,3,5,5,4,5,3,5,-1,3,5,3,3,5,4,5,3,4,3,3,3,3,4,5,4,5,3,5,5,-1,5,3,4,5,4,5,4,3,2,,3,,1,2,4,4,1,1,7,1,1,1,1,59,5,3,13,4,3,1,1,1,2,21,5,1,4,9,1,93,0,0,0,0,1,3,430
431,431,476,9/7/17 18:58,9/7/17 19:26,27,0.9048,5,,-1,Methodist and Baptist,NA,2,66,34,2,1,2,2,1,4,1,2,4,4,0,0,0,0,0,0,0,0,0,0,0,0,1,0,0,0,0,1,7,7,no opinion,NA,10,100,24,3,15,27,9,20,3,4,5,5,2,4,4,4,2,2,1,1,1,2,1,1,3,3,4,2,1,2,2,3,1,3,2,2,1,1,1,1,1,7,4,1,3,6,3,6,7,7,2,2,2,5,2,2,4,2,4,4,2,1,1,1,4,4,5,5,4,6,4,3,6,4,4,4,4,1,,1,,1,1,4,4,1,2,3,3,5,1,1,43,3,2,12,4,1,2,1,4,1,14,1,1,3,5,1,58,0,0,2,0,2,4,431
432,432,478,9/7/17 18:58,9/7/17 19:23,24,0.6398,5,,-1,Catholic,NA,1,90,10,7,7,7,7,7,7,7,7,7,7,1,0,0,0,0,0,0,0,0,0,0,0,0,0,0,0,0,1,2,1,wrong direction- away from personal resposibility,NA,5,5,47,3,29,15,4,10,3,5,4,4,3,4,4,4,2,2,1,2,2,2,2,1,3,3,4,1,2,3,3,3,2,3,3,4,4,4,3,4,2,6,5,3,4,3,4,3,5,5,3,3,2,5,3,3,3,3,3,3,3,3,2,2,3,3,3,5,3,3,5,5,3,3,3,3,3,2,,4,,2,2,5,6,1,1,3,1,3,1,1,65,6,4,12,4,1,1,1,2,1,15,1,1,2,4,1,41,0,0,0,0,2,1,432
433,433,480,9/7/17 18:59,9/7/17 19:19,19,1.0686,5,God exist,NA,"Baptist, Methodist, Catholic",NA,1,80,20,6,5,6,4,4,5,4,4,5,4,1,0,0,0,0,0,0,0,0,0,1,0,0,0,0,1,0,1,4,2,Wrong direction.  Things used to be better.,NA,5,100,47,3,30,15,4,0,3,5,5,5,5,5,5,5,2,2,1,2,2,1,1,2,2,2,3,2,2,2,3,2,2,2,2,3,2,3,2,3,3,5,4,3,4,4,4,4,4,4,4,4,2,5,4,3,5,4,4,4,3,4,2,4,4,4,4,4,4,4,4,4,4,4,4,4,4,2,,4,,1,2,5,5,1,1,3,1,2,1,1,35,3,2,10,3,1,1,1,2,1,11,1,0,3,6,2,63,0,0,0,0,2,1,433
434,434,482,9/7/17 19:00,9/7/17 20:14,73,1.3977,5,There is one God who created the universe,NA,Christian - Catholic,NA,1,50,50,7,6,7,7,6,7,6,6,6,6,1,0,0,0,0,0,0,0,0,0,0,0,0,0,0,0,0,1,2,1,Wrong. Moral decay and lack of respect for others,NA,10,100,47,3,31,15,4,20,3,5,6,4,5,5,5,4,1,1,1,1,1,1,1,2,2,2,3,3,3,2,3,3,2,3,2,3,2,3,3,4,3,5,4,5,5,2,5,1,5,5,1,3,2,5,4,4,4,2,4,2,2,6,1,2,5,4,3,3,2,3,4,4,4,2,6,3,4,2,,4,,2,2,6,6,1,1,3,1,2,1,1,27,2,1,12,4,1,1,1,2,1,21,5,0,3,5,1,58,0,0,0,0,2,7,434
435,435,483,9/7/17 19:00,9/12/17 15:48,7007,1.4287,5,"I believe there is a GOD. I believe that he created everything that exists in the past, present, and future.",NA,Baptist,NA,1,50,50,7,7,7,7,6,7,7,7,7,5,0,1,0,0,0,0,0,0,0,0,0,0,0,0,0,0,0,1,5,4,Wrong direction. We have never had a big problem with North Korea until now. We are seeing more hate in the country. People are at a risk of losing health insurance. DACA is being affected.,NA,10,100,24,6,15,20,9,10,3,5,3,3,5,5,3,3,3,3,1,1,2,1,1,1,2,1,2,1,3,2,3,2,2,1,1,1,1,1,1,1,6,3,3,5,5,3,5,3,5,5,3,5,5,5,6,6,4,3,2,3,5,5,5,3,3,3,4,3,3,3,4,4,4,3,4,3,4,2,,4,,1,1,5,5,1,2,7,3,5,1,1,40,3,2,8,1,2,1,0,2,1,15,1,1,3,5,1,54,0,0,0,0,2,1,435
436,436,484,9/7/17 19:01,9/7/17 19:11,10,0.7984,5,THere are none,NA,Jedi,NA,2,32,68,1,1,1,1,1,5,1,1,1,1,0,0,0,0,0,0,0,0,0,0,0,0,0,0,0,1,0,2,7,7,"Wrong direction.
Selfishness and lack of compassion for our fellow humans has taken over this country's administration.",NA,10,500,47,3,29,15,4,10,3,5,5,3,5,5,3,5,2,2,2,2,2,1,2,2,3,2,4,2,4,4,2,4,2,2,2,2,1,3,2,3,3,5,5,3,3,5,3,5,3,5,3,2,4,5,5,2,6,1,2,1,2,3,2,4,3,3,3,5,3,3,5,6,3,3,3,5,3,2,,4,,2,1,1,1,2,4,5,3,5,1,1,41,3,2,13,4,1,1,1,1,2,21,1,1,4,9,1,93,0,0,0,0,1,1,436
437,437,485,9/7/17 19:01,9/7/17 19:43,42,0.9431,5,Nothing,NA,Atheist,NA,2,50,50,1,1,1,1,1,1,1,1,4,1,0,0,0,0,0,0,0,0,0,0,0,0,0,1,0,0,0,2,8,7,I really don't know,NA,10,100,24,3,1,20,4,20,3,5,4,6,6,4,2,4,4,3,1,3,3,2,4,1,1,1,3,3,3,1,4,3,2,1,-1,-1,-1,-1,-1,-1,2,4,5,5,6,3,6,3,2,3,2,5,4,4,5,4,5,4,1,4,2,4,1,3,4,-1,4,4,4,3,3,4,4,4,5,5,4,1,,4,,2,1,5,5,1,1,1,1,2,1,1,56,5,3,8,1,1,2,1,2,1,12,1,1,4,9,1,93,0,0,0,0,2,1,437
438,438,486,9/7/17 19:01,9/7/17 19:39,38,0.7899,5,I totally believe in God.,NA,Baptist church in the summer and Evangelical Free Church in the winter.,NA,1,70,30,7,7,7,7,7,7,7,6,7,1,0,1,0,0,0,0,0,0,0,0,0,0,0,0,0,0,0,1,2,1,Wrong direction. Children are getting no religious teaching and there is no prayer in public school. That didn't improve anything. Morals and values have declined.,NA,10,5,24,6,30,15,4,10,3,3,5,6,5,6,5,6,2,2,1,2,2,3,2,1,4,3,3,2,3,3,4,3,2,3,4,4,4,4,4,4,3,3,3,5,6,2,5,1,6,6,1,1,2,5,4,4,4,4,3,6,2,3,3,4,5,4,4,4,4,4,4,4,3,4,4,4,3,1,,4,,1,2,5,4,1,1,2,1,2,1,1,69,6,4,12,4,1,2,1,2,1,16,1,1,2,4,1,43,0,0,0,0,2,2,438
439,439,487,9/7/17 19:02,9/7/17 19:46,44,0.6,5,"There is one true God, but humans have created many other gods that they worship.",NA,Evangelical Christian.,NA,1,75,25,7,7,6,6,6,7,7,7,7,6,0,1,0,0,0,0,0,0,0,0,0,0,0,0,0,0,0,1,2,1,"The wrong direction. There is hate, disrespect for authority and others, and celebration and tolerance for wicked things and calling it good, while calling good evil, and not tolerating those who profess to be Christians.",NA,5,5,47,3,30,15,4,10,3,5,7,7,5,6,4,5,2,2,2,2,2,1,2,2,3,2,3,2,1,2,3,2,2,1,1,2,1,4,2,4,2,3,6,4,6,2,6,2,7,6,2,2,2,6,2,6,3,6,5,5,2,2,2,1,4,4,4,4,3,4,4,3,3,4,4,5,4,2,,4,,1,2,6,5,1,1,3,1,3,1,1,45,4,3,13,4,1,1,1,4,1,16,1,1,4,9,1,93,0,0,0,2,2,1,439
440,440,488,9/7/17 19:02,9/7/17 20:13,70,0.8384,5,"one God, Jesus the son, Holy Spirit",NA,church,NA,1,75,25,7,7,6,6,7,7,7,7,7,2,0,1,0,0,0,0,0,0,0,0,0,0,0,0,0,0,0,1,1,1,our country has forgotten how this country was founded on Biblical principals,NA,10,5,24,3,29,15,4,30,3,4,6,5,5,6,6,6,1,1,2,1,1,2,2,2,3,2,4,3,2,3,3,3,2,4,2,3,3,3,2,2,1,3,6,2,6,2,4,2,5,6,4,2,3,4,4,4,6,4,2,4,2,2,1,1,4,5,5,4,4,5,4,3,4,3,5,5,4,2,,4,,1,1,7,7,1,3,3,3,5,1,1,62,5,4,9,2,1,1,1,1,1,12,1,1,2,4,1,46,0,0,0,0,1,1,440
441,441,489,9/7/17 19:04,9/7/17 19:35,31,0.6894,5,I believe that I don't know if a god or gods exist.  I'm open to the possibility.  I know that most other people have faith in one or more gods.,NA,None.  My family members are either Catholic or general Christian.,NA,2,75,25,4,4,4,4,4,4,4,4,4,4,0,0,0,0,0,0,0,0,0,0,0,0,1,0,0,0,0,2,7,7,"It is generally going the right direction, despite political leadership.",NA,5,5,47,3,29,15,4,20,3,3,5,5,3,5,5,5,2,2,2,2,2,2,2,1,3,2,2,1,4,4,2,4,2,2,2,2,2,3,2,3,3,4,5,4,5,3,4,3,5,6,4,3,4,5,4,4,5,3,3,3,3,3,2,4,3,3,4,4,3,4,5,5,3,3,4,3,4,1,,4,,2,1,2,4,1,1,6,1,1,1,1,47,4,3,12,4,1,2,1,2,1,17,1,1,4,8,1,88,0,0,0,0,2,2,441
442,442,490,9/7/17 19:04,9/7/17 19:23,18,0.6848,5,That there is a prime mover some call god that is responsible for all that exists.,NA,Roman Catholic,NA,1,65,35,6,2,4,2,4,6,7,1,4,1,1,0,0,0,0,0,0,0,0,0,0,0,0,0,0,0,0,1,2,2,Wrong direction because our elected president is the most dangerous leader since Adolph Hitler.,NA,10,100,47,3,29,15,4,30,3,2,5,6,4,7,5,6,1,2,1,1,1,1,1,2,4,3,4,2,4,3,2,3,2,3,3,3,3,3,4,4,4,4,4,4,6,2,5,2,5,6,3,2,1,5,3,7,5,1,4,1,2,2,1,1,3,2,4,4,1,1,6,6,2,5,2,3,4,2,,4,,2,1,1,1,1,1,7,1,1,1,1,70,6,4,14,4,1,1,1,2,1,21,1,1,3,5,1,57,0,0,0,0,2,5,442
443,443,491,9/7/17 19:04,9/7/17 20:04,59,1.176,2,yes,NA,catholic,NA,1,90,10,6,6,6,5,4,5,6,2,6,6,1,0,0,0,0,0,0,0,0,0,0,0,0,0,0,0,0,2,5,4,wrong  directon          too much  greed  among  us.,NA,10,20,24,3,15,20,9,30,2,5,5,5,5,5,3,5,1,1,1,1,1,1,1,1,3,3,4,1,4,3,3,4,2,2,1,4,2,1,3,1,3,6,6,3,5,3,3,3,6,6,2,3,6,5,6,3,6,4,2,4,2,3,1,1,3,3,3,5,3,3,3,5,3,5,3,4,5,2,,4,,1,1,2,2,1,1,7,1,1,2,1,72,6,4,10,3,4,1,1,3,1,14,1,1,3,7,1,74,0,1,0,0,2,5,443
444,444,492,9/7/17 19:05,9/7/17 19:39,34,1.0527,5,yes,NA,Catholic,NA,1,50,50,6,6,6,6,4,6,6,6,6,5,1,0,0,0,0,0,0,0,0,0,0,0,0,0,0,0,0,1,7,5,wrong,NA,10,100,96,0,0,0,6,10,2,3,6,6,6,6,6,6,3,3,1,2,2,3,2,1,2,3,3,3,3,3,3,3,2,3,2,4,2,4,3,4,5,2,2,6,6,3,6,1,6,5,2,1,6,3,3,3,6,2,1,2,3,6,6,4,4,4,4,4,6,3,4,4,3,4,4,6,4,1,,4,,2,2,2,2,1,1,6,1,1,1,1,27,2,1,12,4,1,2,1,1,3,4,5,1,2,3,2,35,0,0,0,0,1,1,444
445,445,493,9/7/17 19:05,9/7/17 19:27,21,0.7649,5,,-1,catholic,NA,1,98,2,7,7,7,-1,4,7,7,7,7,7,1,0,0,0,0,0,0,0,0,0,0,0,0,0,0,0,0,1,7,2,,-1,10,100,24,3,15,20,2,10,3,3,5,6,5,5,5,5,3,3,2,2,2,3,2,1,2,3,3,1,3,4,4,3,2,4,4,4,2,3,3,3,2,-1,6,3,6,2,5,1,6,6,4,2,2,5,4,6,3,5,2,4,1,4,2,2,3,5,4,4,5,6,6,6,3,4,4,6,4,1,,4,,1,1,5,5,1,1,5,1,4,1,1,58,5,3,9,2,1,2,1,2,1,9,1,0,2,4,1,43,0,0,0,0,2,1,445
446,446,494,9/7/17 19:06,9/7/17 19:19,13,0.3023,5,"They may or may not exist (I would guess not — though it is also a matter of definition: what exactly is meant by ""god""?)  If they do, I do not think they take an active interest in our personal lives...",NA,"Atheist.
I'm a member a various dog clubs.",NA,2,55,45,2,2,2,3,2,3,2,2,2,2,0,0,0,0,0,0,0,0,1,0,0,0,1,0,0,0,0,1,8,7,"Wrong direction.
The extreme political polarization and accompanying hate is very bad and not helping anyone.",NA,5,5,47,3,29,15,4,20,3,5,6,5,4,5,4,6,2,2,2,2,2,1,1,2,3,2,2,3,4,3,3,3,3,1,1,1,1,1,1,1,2,6,5,2,5,3,4,4,3,5,4,6,4,4,5,4,5,1,-1,1,2,3,4,5,4,1,4,4,1,2,5,5,2,5,4,4,4,2,,4,,2,2,2,3,1,1,6,1,1,1,1,55,5,3,13,4,5,1,1,2,1,14,1,1,4,9,1,91,0,0,0,0,2,2,446
447,447,495,9/7/17 19:06,9/7/17 19:23,16,0.6751,5,nothing,NA,none,NA,1,75,25,6,6,4,5,3,5,4,4,5,3,0,1,0,0,0,0,0,0,0,0,0,0,0,0,0,0,0,2,8,6,"wrong, too much pc correctness",NA,10,20,24,6,30,20,9,10,2,6,6,4,5,6,3,5,2,2,1,2,2,2,1,1,3,3,4,2,2,3,3,3,2,2,2,4,1,3,2,4,1,6,6,1,7,6,6,6,7,7,3,1,4,5,3,5,2,6,3,6,1,3,4,4,5,6,6,5,5,5,6,5,3,3,4,4,5,2,,4,,1,2,6,6,1,1,3,1,2,1,1,73,6,4,10,3,1,1,1,2,1,8,1,1,1,1,1,14,0,0,0,0,2,5,447
448,448,496,9/7/17 19:06,9/7/17 19:53,46,0.7337,5,No,NA,Self-Realization Fellowship,NA,2,85,15,1,1,5,1,7,7,1,1,5,1,0,0,0,0,0,0,0,0,0,0,0,0,0,0,0,1,0,1,5,6,"Wrong direction. Market capitalism has taken control of the minds of Americans through manipulation and exploitation of humanity's natural desires (E.g., greed, lust, power, materialism, narcissism, divisionism). That coupled with lies put forth by religious authority, it has stolen human dignity and forced us into a material world where many only care for their own physical desires. There's no balance anymore between materialism and spirituality. We're now all objectified to be exploited.",NA,10,100,47,3,30,20,8,20,3,1,7,6,3,7,6,5,4,4,3,1,2,4,2,1,1,1,3,2,4,3,2,3,2,4,4,2,4,2,4,2,1,2,5,3,6,1,5,1,3,7,3,5,2,6,3,3,5,3,3,1,1,6,2,3,2,7,6,2,7,1,2,7,1,2,3,5,7,2,,3,,1,2,1,5,1,1,3,1,3,1,1,38,3,2,13,4,1,1,0,3,2,17,5,1,4,9,1,93,0,0,0,0,3,1,448
449,449,497,9/7/17 19:07,9/7/17 19:50,43,1.1833,2,,-1,Catholicism,NA,1,75,25,7,7,7,7,1,7,7,6,7,5,1,0,0,0,0,0,0,0,0,0,0,0,0,0,0,0,0,1,1,1,Wrong direction.  The wrong is becoming the norm,NA,10,100,24,3,30,20,6,10,2,2,6,5,2,6,5,5,2,1,1,1,1,1,1,1,3,2,4,2,1,3,2,3,2,3,2,4,3,4,3,4,5,4,3,6,3,6,4,3,6,5,2,1,2,6,5,6,5,4,1,4,3,6,6,1,3,3,3,5,2,2,5,6,3,3,5,2,5,2,,4,,2,2,6,6,1,1,1,1,2,2,1,50,4,3,12,4,4,1,1,1,1,19,3,1,3,7,1,74,0,0,0,0,1,1,449
450,450,498,9/7/17 19:08,9/7/17 19:31,23,1.507,5,I believe god the eternal father and in his son Jesus Christ and in the Holy Ghost,NA,The church of Jesus Christ of Latter Day Saints,NA,1,65,35,7,7,7,5,6,6,7,6,7,6,0,0,0,1,0,0,0,0,0,0,0,0,0,0,0,0,0,1,2,1,Wrong direction. Many deny the existence of god or believe but choose not to keep his commandments,NA,10,100,47,12,30,-1,9,0,3,5,5,6,4,6,4,6,2,1,1,2,2,2,3,2,3,1,3,2,3,2,2,3,2,4,4,4,4,4,4,4,2,3,4,5,5,2,5,2,4,6,3,3,3,3,4,4,6,5,2,5,1,4,2,2,4,3,5,4,4,5,4,4,2,2,4,-1,4,1,,4,,1,1,5,5,1,1,2,1,3,1,1,29,2,1,11,3,1,2,1,5,1,13,1,1,2,3,1,32,0,2,1,0,2,7,450
451,451,499,9/7/17 19:08,9/10/17 21:33,4464,0.8158,1,"I believe in a ""god"" as more of a force of the world that we interact with as to not feel alone. That force to me is purely spiritual and is within me and others.",NA,None,NA,2,85,15,2,2,5,5,6,6,1,1,6,5,0,0,0,0,0,0,0,0,0,0,0,0,1,0,0,0,0,1,8,3,"Going in the wrong direction because of the distrust that many have about our elected officials, institutions. GREED has now become the prime focus of our world, and our younger people have taken up that banner. Many have learned from their parent(s) that are owed for being on this planet.",NA,10,100,24,6,15,20,18,10,2,3,6,6,6,4,4,7,2,2,1,1,1,1,2,2,4,2,3,1,4,3,3,3,2,3,3,3,1,3,2,3,2,2,4,5,6,2,4,2,5,6,1,4,2,6,4,4,6,2,2,1,1,4,1,1,6,2,4,4,2,2,4,2,2,4,6,2,2,2,,3,,1,1,1,4,1,1,7,1,1,2,1,72,6,4,9,2,4,1,1,1,3,4,5,1,3,5,2,59,0,0,0,0,1,5,451
452,452,501,9/7/17 19:08,9/7/17 19:27,18,0.8995,5,"In the beginning, God created the heavens and earth.....",NA,Church of Christ - non denominational,NA,1,60,40,7,7,6,6,6,6,7,7,6,2,0,0,0,0,0,0,0,0,0,0,1,0,0,0,0,0,0,2,1,1,Wrong direction -- too much liberalism...   People need to sit down and think what they are doing and why....,NA,10,100,24,3,30,20,3,103,3,2,5,5,4,6,5,6,2,2,2,2,2,2,2,2,3,3,3,2,2,3,3,3,2,3,2,3,3,3,3,3,4,3,3,5,5,3,5,3,5,5,3,3,3,5,3,5,4,4,3,4,4,4,4,4,3,3,4,4,3,3,4,5,3,4,-1,4,4,2,,4,,2,2,6,6,1,1,1,1,2,1,1,59,5,3,11,3,1,1,1,5,1,18,1,1,3,5,1,59,0,0,0,0,5,1,452
453,453,502,9/7/17 19:08,9/7/17 20:01,53,0.7502,5,yes,NA,"Unitarian, Agape",NA,1,80,20,6,2,6,2,6,7,4,2,6,5,0,0,0,0,0,0,0,0,0,1,0,0,0,0,0,0,0,2,5,2,I have an abundant life and feel that everything works itself out in the end.,NA,10,100,36,3,1,20,3,30,3,3,5,6,4,6,5,5,2,1,1,1,1,1,1,2,3,4,4,2,3,4,2,4,2,3,2,3,1,3,3,3,5,3,4,5,6,2,7,3,5,6,2,3,4,5,2,3,6,2,1,2,2,4,4,4,4,2,5,4,3,4,4,4,3,5,4,5,3,1,,4,,1,2,2,3,1,1,6,1,3,1,1,59,5,3,12,4,1,2,1,1,2,20,3,1,4,9,2,93,0,0,0,0,1,2,453
454,454,504,9/7/17 19:09,9/10/17 20:29,4399,1.6179,5,God exists,NA,,-1,1,60,40,4,4,4,4,4,4,4,4,4,4,0,0,0,0,0,0,0,0,0,0,0,0,0,0,0,1,0,1,7,6,,-1,5,5,47,3,29,15,4,20,3,4,5,5,3,5,5,6,2,2,1,2,2,2,2,2,2,1,3,2,3,3,2,3,2,2,3,2,2,2,2,2,2,5,5,5,5,3,5,2,4,4,3,3,3,5,2,5,5,3,4,3,2,4,2,2,3,3,3,5,2,2,5,5,2,4,3,3,4,2,,4,,1,1,2,2,2,4,5,3,5,1,1,35,3,2,10,3,3,1,1,3,3,7,1,1,1,2,2,21,0,1,0,0,2,2,454
455,455,505,9/7/17 19:10,9/7/17 19:30,19,1.2228,5,,-1,None,NA,1,90,10,4,5,5,5,4,5,5,5,6,4,0,1,0,0,0,0,0,0,0,0,0,0,0,0,0,0,0,2,8,6,"Wrong, because we have Childish misinformed leaders, as well as selfish, corrupted politicians only out for the money and fame.",NA,5,5,47,3,30,20,3,30,2,4,5,5,4,5,3,3,2,1,2,2,1,1,1,1,3,2,2,3,3,2,4,2,2,3,1,1,2,1,1,1,3,5,5,3,4,3,2,4,4,4,4,5,3,5,3,4,5,3,3,3,3,5,5,5,3,3,4,5,4,4,5,5,3,4,4,5,4,2,,2,,2,2,3,4,1,1,5,1,1,1,1,22,1,1,11,3,1,1,0,2,1,6,5,1,3,5,1,56,0,0,0,0,2,1,455
456,456,506,9/7/17 19:10,9/7/17 19:16,5,1.6085,5,I truly believe in existence of god.,NA,temple,NA,1,70,30,6,6,6,5,6,6,6,6,7,6,0,0,0,0,0,0,0,1,0,0,0,0,0,0,0,0,0,1,5,5,"when there is good, there will be bad as well. Can't say it is going in right direction or wrong direction until the destination is reached",NA,-1,-1,-1,-1,-1,-1,-1,-1,2,-1,-1,-1,-1,-1,-1,-1,-1,-1,-1,-1,-1,-1,-1,-1,-1,-1,-1,-1,-1,-1,-1,-1,1,-1,-1,-1,-1,-1,-1,-1,-1,-1,-1,-1,-1,-1,-1,-1,-1,-1,-1,-1,-1,-1,-1,-1,-1,-1,-1,-1,-1,-1,-1,-1,-1,-1,-1,-1,-1,-1,-1,-1,-1,-1,-1,-1,-1,2,,4,,2,1,-1,-1,2,4,5,3,5,1,1,36,3,2,12,4,3,1,1,4,1,19,1,1,3,5,1,56,0,1,1,0,2,1,456
457,457,507,9/7/17 19:11,9/7/17 19:53,42,1.3824,5,"I believe that there's one God in three person.  God the father,  God the son and God the Holly Spirit. God is real,  and it is great to have hope in Jesus(the son) especially around time like these.",NA,Pentecostal,NA,1,95,5,7,7,7,7,7,7,7,6,7,6,0,1,0,0,0,0,0,0,0,0,0,0,0,0,0,0,0,2,6,1,"I truly can't tell whether it is heading into the right or wrong direction because we only see the evil that are being done while there are so many hidden good that are being done. The more evil you see,  there's even more righteousness at play.  That's my opinion.",NA,10,100,96,3,15,20,6,10,1,4,7,6,6,6,2,7,3,2,1,1,2,3,4,1,2,1,2,1,4,1,4,1,2,2,1,1,1,1,1,1,1,4,6,4,5,4,5,5,5,7,5,6,5,1,7,3,5,4,2,4,2,5,5,4,4,4,4,4,4,5,4,4,3,3,4,4,4,1,,4,,1,1,6,6,1,1,6,1,1,1,1,34,2,2,11,3,2,2,1,4,3,10,1,1,3,5,2,59,1,1,0,0,2,4,457
458,458,509,9/7/17 19:11,9/7/17 19:40,28,1.1068,5,God is the creator of the Universe.,NA,Protestant,NA,1,95,5,7,7,7,7,6,7,7,7,7,7,0,1,0,0,0,0,0,0,0,0,0,0,0,0,0,0,0,1,1,1,Wrong direction.  People have turn their backs on God and the principles this Country was founded upon.,NA,10,5,47,3,29,15,4,20,3,3,6,6,3,5,6,6,1,1,1,2,1,1,2,1,3,2,4,1,3,2,3,3,2,3,3,3,3,3,3,3,2,5,5,3,5,3,5,3,6,6,2,2,2,6,1,7,5,3,2,5,3,5,5,5,5,3,5,5,3,3,3,5,3,3,5,3,3,2,,4,,2,2,7,5,1,1,3,1,3,1,1,39,3,2,13,4,2,1,1,4,1,19,1,1,4,9,1,93,0,0,1,1,2,1,458
