"1228",386,1354,"2017-09-09 14:51:19","2017-09-09 15:06:01",14,0.8563,5,"I believe in a higher power",NA,"Used to be considered Lutheran, now would just generalize to Christian",NA,1,60,40,6,3,6,3,6,6,6,2,5,5,0,1,0,0,0,0,0,0,0,0,0,0,0,0,0,0,0,1,5,1,"Right direction--hatred is being met with a lot of resistance from the positive side",NA,5,5,47,3,29,60,4,20,3,4,6,6,1,6,6,6,1,1,1,1,2,1,2,2,2,2,3,2,4,3,2,3,2,3,3,4,2,3,3,3,1,6,6,2,6,2,6,1,5,6,2,1,4,6,5,3,6,2,1,3,1,4,1,1,5,1,5,4,1,2,5,5,3,2,3,6,3,1,"",7,"",1,2,2,2,1,1,6,1,1,1,1,38,3,2,13,4,1,2,1,1,1,11,5,1,2,4,1,41,0,0,0,0,1,1,1227
"1229",387,1355,"2017-09-09 14:53:12","2017-09-09 15:35:09",41,1.1734,5,"I believe that God exists.  He is a Spirit and with Jesus Christ  made the earth.  He sustains/maintains the earth.  I believe He is the only true God and no one can come before Him except through His Son--Jesus the Christ!",NA,"Protestant",NA,1,75,25,7,7,7,7,7,7,7,7,6,2,0,1,0,0,0,0,0,0,0,0,0,0,0,0,0,0,0,2,1,1,"I think America is going in the wrong direction.  Too many of us stand back and do not voice our spiritual beliefs.  We have interpreted the scriptures to conform to the mores of society.  We have allowed society to dictate where we can and cannot pray aloud. Outright hatred and brutality is beginning to rear its head. However, there is still a glimmer of hope.  When natural disasters occur, we ban together.",NA,10,100,12,3,15,20,9,10,2,5,-1,5,3,6,6,6,2,2,1,1,1,3,2,1,3,3,2,1,3,4,1,4,2,4,3,3,3,3,3,4,1,7,5,3,7,2,6,2,3,5,4,4,4,5,4,3,6,6,2,5,2,3,5,4,4,3,4,4,4,4,5,4,4,4,5,3,4,1,"",4,"",1,2,6,4,1,1,5,1,-1,1,1,74,6,4,12,4,2,2,1,2,1,13,1,1,3,5,1,54,0,0,0,0,2,5,1228
"1230",388,1356,"2017-09-09 15:17:01","2017-09-09 15:35:17",18,0.8311,5,"I believe in fate, whatever is meant to be will be and yes I believe in the existence of God",NA,"I am Jewish",NA,1,85,15,5,2,6,6,4,6,5,2,6,5,0,0,0,0,1,0,0,0,0,0,0,0,0,0,0,0,0,2,8,3,"I think we are headed in he wrong direction, we have a president whom seems ready to destroy this country, Sorry to say I voted for him.  War seem to be in our future, hopefully not an atomic one",NA,10,100,24,1,1,20,9,10,2,5,6,6,5,6,3,3,3,4,2,1,1,3,2,2,3,2,3,3,4,4,4,3,2,2,1,1,1,1,2,2,4,4,4,4,7,3,5,4,2,4,4,4,3,5,5,4,4,4,4,4,3,3,2,3,4,3,4,4,5,4,4,4,4,3,4,3,4,1,"",4,"",1,2,2,3,1,1,7,1,2,1,1,73,6,4,9,2,1,2,1,1,1,7,1,1,3,5,1,59,0,0,0,0,1,5,1229
"1231",389,1357,"2017-09-09 15:18:24","2017-09-09 15:23:09",4,0.8412,5,"I dont know",NA,"Im not sure",NA,1,50,50,4,-1,4,4,4,4,4,4,-1,4,0,0,0,0,0,0,0,0,0,0,0,0,0,0,0,1,0,1,8,7,"",-1,0,5,1,-1,-1,-1,2,10,3,4,4,4,4,4,4,4,2,2,2,2,2,2,2,3,3,3,3,3,3,3,3,3,2,2,2,2,2,2,2,2,4,4,4,4,4,4,4,4,4,4,4,4,4,4,4,4,4,4,4,4,4,4,4,4,4,4,4,4,4,4,4,4,4,4,4,4,4,2,"",4,"",1,1,4,4,1,2,5,3,5,1,1,31,2,2,8,1,1,1,0,1,3,4,1,1,4,9,2,93,0,0,0,0,1,7,1230
"1232",390,1359,"2017-09-09 15:23:33","2017-09-09 16:21:03",57,1.5575,3,"Si creo que existio un Dios en la tierra, y creo en Dios realmente la Biblia dice mucho de lo que nos esta pasando actualmente.",NA,"Yo soy catolica.",NA,1,99,1,4,4,6,4,4,6,4,4,7,3,1,0,0,0,0,0,0,0,0,0,0,0,0,0,0,0,0,2,8,2,"YO si creo que debe haber mucha fe en las personas ya sea de un dios o otro, se que todos son el mismo Dios, y es Bueno creer, es Bueno tener fe, la fe mueve montañas.",NA,10,100,24,3,30,20,2,20,2,5,5,3,4,4,4,6,4,3,4,4,2,2,2,1,3,2,1,4,4,1,3,3,1,1,2,2,1,2,2,4,4,3,4,5,5,3,5,3,3,7,2,3,3,4,3,5,6,1,3,5,1,7,1,2,4,3,5,2,5,5,3,6,2,5,6,4,2,1,"",4,"",1,2,1,7,2,4,3,3,5,8,2,53,4,3,9,2,4,2,0,2,2,1,3,1,3,5,1,59,0,0,0,0,2,2,1231
"1233",391,1360,"2017-09-09 15:23:53","2017-09-09 15:55:16",31,0.9007,5,"God is all knowing King of kings of the Lord of lords",NA,"the church of prayer",NA,1,30,70,7,7,7,6,4,7,7,7,7,4,0,1,0,0,0,0,0,0,0,0,0,0,0,0,0,0,0,2,1,1,"i think everything happens for a reson but we also have freewill",NA,10,5,24,3,15,60,12,0,2,6,6,7,7,7,7,5,4,4,2,2,2,2,3,2,3,3,4,2,4,3,3,3,2,4,4,4,4,4,4,4,4,5,6,5,6,6,5,3,6,7,2,2,5,3,3,6,6,3,2,4,3,7,4,5,4,2,4,6,3,4,3,4,4,3,4,5,4,1,"",4,"",1,1,4,4,1,1,7,2,5,1,1,42,3,2,9,2,1,1,1,4,2,2,1,1,1,1,1,16,0,0,0,1,3,1,1232
"1234",392,1361,"2017-09-09 15:27:04","2017-09-09 15:46:57",19,0.8435,5,"I believe in God!",NA,"",-1,1,90,10,7,7,7,7,6,7,7,7,7,5,0,0,0,0,0,0,0,0,0,0,1,0,0,0,0,0,0,2,7,6,"Wrong direction.",NA,10,100,24,6,1,30,6,10,2,4,5,5,5,6,5,6,2,1,1,4,2,1,2,2,4,3,4,2,3,1,4,3,2,4,4,4,4,4,4,4,5,3,5,2,7,1,6,1,7,7,1,1,1,3,5,3,6,1,1,4,3,4,3,4,4,4,4,4,7,1,5,7,6,6,5,4,5,1,"",4,"",2,2,4,4,1,1,3,1,2,1,1,47,4,3,9,2,1,2,1,2,1,17,1,0,2,4,1,47,0,0,0,0,2,1,1233
"1235",393,1362,"2017-09-09 15:27:24","2017-09-09 15:36:28",9,1.5464,2,"Do not believe",NA,"None",NA,2,50,50,4,4,4,4,4,4,4,4,4,4,0,0,0,0,0,0,0,0,0,0,0,0,0,0,0,0,1,2,8,7,"",-1,10,100,24,3,15,20,8,10,2,4,4,4,4,4,4,4,-1,-1,-1,-1,-1,-1,-1,-1,-1,-1,-1,-1,-1,-1,-1,-1,1,-1,-1,-1,-1,-1,-1,-1,4,4,4,4,4,4,4,4,4,4,4,4,4,4,4,4,4,4,4,4,4,4,4,4,4,4,4,4,4,4,4,4,4,4,4,4,4,1,"",4,"",1,1,-1,-1,1,1,5,2,5,3,1,31,2,2,9,2,4,2,0,1,3,7,5,1,1,2,2,21,0,0,0,0,1,1,1234
"1236",394,1363,"2017-09-09 15:31:12","2017-09-09 16:43:37",72,1.2383,5,"I believe that a higher power excists",NA,"Judism",NA,1,35,65,4,3,6,6,6,6,4,4,6,5,0,0,0,0,1,0,0,0,0,0,0,0,0,0,0,0,0,2,7,3,"The country is going in the wrong direction.  President Trump is trying to do good things but is being blocked by the elitists who control the media and are using it to retain control.",NA,5,5,47,3,15,15,4,10,1,5,5,4,5,5,2,3,2,2,1,3,3,2,3,1,3,2,3,3,1,2,3,3,2,2,2,2,2,2,2,3,4,4,3,4,5,3,4,3,3,5,3,5,4,5,4,5,6,4,3,3,3,3,5,5,3,5,3,5,3,4,5,5,4,4,4,3,5,1,"",4,"",1,1,4,6,1,1,2,1,2,1,1,26,2,1,12,4,1,2,0,2,1,19,5,1,2,3,3,31,0,0,0,0,2,1,1235
"1237",395,1364,"2017-09-09 15:31:31","2017-09-09 15:53:26",21,1.1287,5,"I believe there is a god",NA,"batish",NA,1,45,55,7,7,7,7,7,6,7,7,7,6,0,1,0,0,0,0,0,0,0,0,0,0,0,0,0,0,0,2,1,1,"going in the wrong direction people are attending church like they should",NA,10,25,24,6,15,20,3,10,2,3,5,5,4,6,4,5,4,4,2,3,3,4,3,4,4,2,3,4,4,2,4,3,2,2,4,4,3,4,3,4,5,1,4,5,7,6,6,1,2,7,5,6,6,3,6,3,6,2,6,5,7,5,2,3,5,4,5,4,7,3,4,5,5,5,3,6,5,2,"",4,"",1,2,3,4,1,1,7,1,1,1,1,66,6,4,10,3,2,1,1,1,3,3,5,0,3,6,2,64,0,0,0,0,1,5,1236
"1238",396,1365,"2017-09-09 15:31:38","2017-09-09 15:58:26",26,1.0004,5,"That jesus died on the cross for our own sins.That their is eternal life in heaven.",NA,"protestant",NA,1,85,15,7,6,6,6,5,6,7,6,6,5,0,1,0,0,0,0,0,0,0,0,0,0,0,0,0,0,0,2,5,1,"In the wrong direction. The hatred is getting worse the bi racial is coming back.",NA,10,100,24,6,30,20,18,20,2,5,5,6,4,5,5,5,3,2,1,2,2,2,4,3,3,3,3,2,3,3,2,3,2,3,1,3,3,4,4,4,3,4,4,4,6,5,5,4,4,5,5,5,5,5,3,5,5,4,3,4,6,5,4,5,4,5,4,4,3,5,4,4,5,4,4,5,4,1,"",4,"",1,2,4,5,1,2,5,3,5,1,1,57,5,3,9,2,1,2,0,2,4,4,1,0,3,5,3,56,0,0,0,0,2,7,1237
"1239",397,1366,"2017-09-09 15:32:14","2017-09-09 16:00:03",27,0.9535,5,"There is only one god with his son Jesus.",NA,"None",NA,1,75,25,7,6,7,6,6,7,6,6,7,5,0,1,0,0,0,0,0,0,0,0,0,0,0,0,0,0,0,1,7,3,"Wrong - too much government",NA,10,5,47,3,30,20,3,10,3,6,6,6,5,6,6,6,3,2,2,2,2,2,1,2,3,2,4,1,2,3,3,3,2,4,3,3,3,3,3,-1,2,7,6,3,6,4,6,4,3,5,3,3,5,5,3,2,6,3,2,4,2,2,3,3,4,3,4,4,3,5,4,4,3,3,5,3,4,1,"",4,"",1,1,6,7,1,1,2,1,2,1,1,49,4,3,10,3,1,2,1,2,1,13,1,0,2,3,1,32,0,0,0,0,2,1,1238
"1240",398,1368,"2017-09-09 15:36:30","2017-09-09 16:42:22",65,0.7395,5,"I believe in the Jewish version of G-d",NA,"Reform Judaism",NA,1,75,25,6,1,4,4,5,6,4,1,5,4,0,0,0,0,1,0,0,0,0,0,0,0,0,0,0,0,0,1,2,6,"Wrong. Animosity is on the rise. Human relations are breaking down.  Ironically, communication is breaking down even when we have the most sophisticated communications systems ever known. Thanks",NA,5,100,47,3,31,15,4,0,3,5,5,5,4,5,5,3,2,2,2,2,1,1,1,2,2,3,4,2,4,3,3,4,2,1,1,2,1,1,2,1,4,2,3,6,6,3,4,2,7,7,2,1,1,4,3,6,4,5,3,5,2,3,1,2,3,2,3,4,3,4,4,5,3,4,3,3,2,2,"",4,"",1,2,2,2,1,1,7,1,1,1,1,46,4,3,12,4,1,1,1,3,1,18,1,1,1,1,1,16,0,0,0,1,2,1,1239
"1241",399,1369,"2017-09-09 15:42:01","2017-09-09 17:13:54",91,1.3992,5,"I whole heartedly believe in God. I don't fault others for their beliefs but, I will share my beliefs if they try and push theirs on me.",NA,"Christianity",NA,1,80,20,7,6,6,6,7,7,7,7,7,3,0,0,0,0,0,0,0,0,0,0,1,0,0,0,0,0,0,2,2,1,"At this moment on this day I would say we are going in the wrong direction. The hate and cruelty seem to have risened during this presidential administration. Seeing everyone as equals and and as people should be our norm and it's not. I think it's a smaller pocket of people that act this way but, they are heard loudly. Everyday I'm disappointed in the things that comes out of some people mouths, in the news and social media. They won't change me. I still don't judge a book by its cover, no matter what you look like. I give everyone a chance until they prove to not be worth the the chance or my time. But I pray that there is enlightenment and hope on the horizon.",NA,10,-1,24,10,1,-1,6,10,2,3,7,6,2,7,7,7,2,2,-1,2,3,1,2,1,4,2,3,3,4,3,3,4,3,4,3,3,-1,2,2,3,4,2,3,6,7,2,6,2,6,7,2,1,3,6,2,3,4,4,2,4,2,4,3,3,4,2,5,5,5,2,4,3,2,4,4,5,2,1,"",4,"",1,1,3,5,1,1,7,1,1,1,1,55,5,3,9,2,2,2,1,4,1,18,1,1,3,5,1,54,0,0,0,0,4,7,1240
"1242",400,1371,"2017-09-09 15:56:16","2017-09-09 16:58:12",61,0.949,5,"",-1,"",-1,1,75,25,7,6,7,5,7,5,7,5,7,3,0,0,0,0,0,0,0,0,0,0,0,0,0,0,0,1,0,1,8,1,"",-1,5,5,47,3,30,20,9,20,3,3,5,5,2,6,6,6,3,3,2,1,2,4,1,1,3,1,4,2,4,1,3,3,2,2,2,3,3,3,3,3,2,6,6,3,6,3,3,3,6,6,3,4,6,5,6,2,6,3,1,3,2,4,5,2,3,3,3,5,3,3,5,5,6,3,3,5,5,2,"",4,"",1,2,4,4,1,2,4,3,5,1,1,35,3,2,9,2,1,1,0,5,1,13,1,1,4,8,1,86,0,0,0,0,5,7,1241
"1243",401,1372,"2017-09-09 15:58:00","2017-09-09 16:07:05",9,0.722,5,"",-1,"None",NA,1,75,25,6,6,6,6,6,7,6,6,6,4,0,0,0,0,0,0,0,0,0,0,0,0,1,0,0,0,0,1,8,1,"Wrong Way!",NA,-1,-1,-1,-1,-1,-1,12,10,2,4,4,4,4,5,4,5,2,2,1,1,1,2,1,1,1,1,2,3,4,3,1,3,1,-1,-1,-1,-1,-1,-1,-1,-1,-1,4,-1,-1,4,5,-1,-1,-1,-1,6,4,-1,4,-1,-1,4,4,4,4,7,5,-1,-1,-1,-1,-1,-1,-1,-1,-1,-1,-1,-1,-1,-1,2,"",4,"",1,1,6,6,2,4,4,3,5,1,1,49,4,3,9,2,1,1,1,1,1,11,1,1,1,2,3,23,0,0,0,0,1,7,1242
"1244",402,1373,"2017-09-09 16:00:39","2017-09-09 16:06:32",5,0.6686,5,"i dont",NA,"none",NA,1,50,50,-1,4,4,4,4,4,4,4,4,4,0,0,0,0,0,0,0,0,0,0,0,0,1,0,0,0,0,2,8,6,"not sure",NA,-1,-1,-1,-1,-1,-1,2,20,3,4,4,4,4,4,4,4,3,3,3,3,3,3,3,3,3,3,3,3,3,3,3,3,2,1,1,1,1,1,1,1,4,4,4,4,4,4,4,2,4,4,4,4,4,4,4,4,4,4,4,4,4,4,4,4,4,4,4,4,4,4,4,4,4,4,4,4,4,2,"",4,"",1,1,4,4,1,3,5,3,5,1,1,64,5,4,9,2,1,1,1,2,1,9,1,1,3,5,1,51,0,0,0,0,2,5,1243
"1245",403,1374,"2017-09-09 16:04:10","2017-09-09 16:17:31",13,0.7498,5,"",-1,"",-1,1,80,20,7,-1,7,7,6,7,7,7,7,7,1,0,0,0,0,0,0,0,0,0,0,0,0,0,0,0,0,2,7,6,"wrong direction. religious right support a president with poor morals.",NA,5,5,47,3,15,15,4,20,3,5,7,6,5,5,7,6,2,2,1,1,1,1,1,2,3,2,4,1,4,4,2,4,2,4,2,4,4,3,3,4,5,3,2,6,6,4,6,3,5,7,1,1,1,6,2,7,6,6,3,4,3,5,2,3,3,6,1,7,2,3,6,6,1,2,4,2,5,2,"",4,"",1,1,2,2,1,1,7,1,1,1,1,52,4,3,12,4,1,1,1,1,1,19,1,1,3,5,1,59,0,0,0,0,1,1,1244
"1246",404,1375,"2017-09-09 16:12:11","2017-09-09 16:30:59",18,1.5158,2,"to me their is only one god and when he is ready he will show up and clean this earth",NA,"none",NA,1,60,40,7,6,7,7,1,3,1,1,7,5,0,0,0,0,0,0,0,0,0,0,0,0,1,0,0,0,0,2,7,6,"",-1,10,100,24,6,30,-1,3,10,1,2,6,6,3,7,3,7,4,4,1,1,1,3,1,1,2,1,2,1,4,1,3,2,2,3,2,3,1,1,3,3,4,6,5,5,5,4,5,2,2,3,1,1,7,3,6,7,4,1,2,4,3,5,5,3,4,3,1,4,3,1,3,4,3,4,4,5,4,1,"",4,"",1,2,3,3,1,1,7,1,1,3,1,31,2,2,9,2,4,2,1,5,2,9,1,1,1,2,2,23,0,0,1,2,2,7,1245
"1247",405,1376,"2017-09-09 16:13:28","2017-09-09 16:31:47",18,0.7497,5,"",-1,"",-1,1,75,25,4,3,4,4,5,4,6,4,6,4,1,0,0,0,0,0,0,0,0,0,0,0,0,0,0,0,0,1,5,6,"",-1,10,50,24,6,30,20,18,10,1,3,5,3,5,5,3,5,2,2,1,2,2,2,1,2,3,3,3,2,3,3,2,3,2,2,2,2,2,2,2,2,4,6,5,4,5,5,5,5,5,6,3,6,6,4,5,4,5,5,6,4,5,5,3,5,5,5,5,4,2,5,5,3,6,5,5,5,5,2,"",4,"",1,1,3,5,1,1,7,1,2,1,1,76,7,4,9,2,1,1,1,2,1,14,1,1,2,3,1,31,0,0,0,0,2,5,1246
"1248",406,1377,"2017-09-09 16:17:26","2017-09-09 17:13:43",56,0.9469,5,"I believe there is a God",NA,"Non practicing Catholic",NA,1,60,40,7,6,5,6,5,4,6,6,7,6,1,0,0,0,0,0,0,0,0,0,1,0,1,0,0,0,0,2,8,1,"Wrong, more people don't believe in God like they used to and are taking God out of everything and sinning more than ever",NA,10,100,24,3,15,20,9,10,2,2,6,6,7,5,4,6,4,4,4,4,4,4,4,3,2,2,4,3,4,2,4,3,2,2,1,2,1,3,1,4,6,1,2,6,6,3,6,2,5,5,4,3,6,2,5,3,5,4,2,4,2,6,6,5,4,3,5,4,4,3,4,4,4,4,4,5,4,2,"",4,"",1,1,6,6,1,1,1,2,5,1,1,36,3,2,8,1,1,1,1,4,3,9,1,1,3,5,2,59,0,0,2,0,2,1,1247
"1249",407,1378,"2017-09-09 16:28:45","2017-09-09 16:49:28",20,0.7445,5,"I believe in a higher power  just not convinced its in the form of what most Christians believe. Would like to go for the life after ...kind of hard to believe.",NA,"I was born a Roman Catholic...have not practiced since my early teens. More of an agnostic.",NA,2,60,40,3,5,4,5,4,5,4,4,4,4,0,0,0,0,0,0,0,0,0,0,0,0,0,0,1,0,0,2,8,6,"Although I am not a religious person..I think that religion in many ways has hurt our country...it has caused rifts and division amongst people.
Too many so called Christians believe that they are the only truly enlightened ones that have earned a place in heaven, while everyone else is wrong. There seems to be less tolerance than there once was. I thinks Buddhista are the best.",NA,10,20,24,3,15,60,9,30,2,5,5,4,5,6,5,3,3,3,4,2,1,2,1,1,3,1,4,2,3,2,3,3,2,2,2,2,2,3,2,2,5,2,5,5,5,5,5,2,5,7,2,2,5,3,5,3,4,3,3,3,3,4,2,3,4,3,4,4,3,3,4,4,3,3,4,5,4,2,"",4,"",2,1,4,5,1,1,3,1,2,1,1,62,5,4,11,3,1,1,1,4,1,16,1,1,1,2,1,21,0,0,0,1,3,6,1248
"1250",408,1379,"2017-09-09 16:47:17","2017-09-09 17:26:20",39,0.7836,5,"I firmly believe in God; Father, Son, and Holy Spirit.",NA,"Catholic",NA,1,65,35,7,7,7,7,7,7,7,7,7,3,1,0,0,0,0,0,0,0,0,0,0,0,0,0,0,0,0,1,1,3,"Wrong direction.  The more Government tries taking God out of everything this country was built upon the worse the young children grow up to be.  We need God in all aspects of our lives in order to be the best person each of us can become.",NA,5,5,47,3,29,15,4,20,3,4,6,6,2,6,6,6,3,2,2,1,2,1,1,1,4,2,3,2,4,3,3,3,2,4,3,3,3,3,3,3,2,3,4,6,6,1,5,2,6,5,2,5,3,5,3,3,5,3,2,3,2,3,2,2,4,2,4,4,3,3,5,5,3,4,4,2,4,2,"",4,"",2,1,3,5,1,1,2,1,2,1,1,54,4,3,12,4,1,1,1,3,1,12,1,1,2,4,1,46,0,0,0,0,3,1,1249
"1251",409,1380,"2017-09-09 17:06:25","2017-09-09 17:33:24",26,0.7497,5,"",-1,"",-1,1,75,25,6,4,5,5,5,5,6,4,5,5,0,1,0,0,0,0,0,0,0,0,0,0,0,0,0,0,0,1,8,6,"",-1,10,100,24,3,30,15,3,30,2,4,6,5,5,6,4,6,2,2,1,2,2,1,2,2,3,3,3,3,4,3,2,3,2,1,1,1,1,3,1,4,4,4,4,5,5,4,5,4,3,4,2,4,2,6,3,5,4,4,3,4,4,4,2,4,4,4,4,4,4,4,4,4,4,4,4,5,4,2,"",4,"",1,2,6,6,1,1,3,1,2,1,1,72,6,4,9,2,1,1,1,2,1,14,1,1,2,4,1,42,0,0,0,0,2,5,1250
"1252",410,1381,"2017-09-09 17:16:04","2017-09-09 17:27:42",11,0.9744,5,"I think ""GOD"" was put into place t create order in society. I believe that God doesn't exist",NA,"None",NA,2,75,25,1,1,1,1,1,1,1,1,1,1,0,0,0,0,0,0,0,0,0,0,0,0,0,1,0,0,0,2,8,7,"Wrong direction. This country was founded on the belief of equality for all and a separation of church and government. We are trying o combine those 2 and it is doing nothing but harm",NA,10,100,1,3,30,20,3,10,2,3,3,3,3,3,3,3,1,2,2,1,2,2,2,2,2,2,2,2,2,2,2,2,1,2,2,2,2,2,2,2,4,4,4,4,4,4,4,4,4,4,4,4,4,4,4,4,-1,4,4,4,4,4,4,4,4,4,4,4,4,4,4,4,4,4,4,4,4,2,"",4,"",2,1,5,5,1,1,1,1,2,1,1,36,3,2,9,2,1,1,1,5,1,14,1,1,3,5,2,57,0,0,0,1,4,1,1251
"1253",411,1382,"2017-09-09 17:18:53","2017-09-09 17:42:57",24,1.1289,5,"I'm not really sure...I believe there may be something there",NA,"none",NA,1,50,50,6,6,6,6,6,6,6,6,6,6,0,0,0,0,0,0,0,0,0,0,0,0,1,0,0,0,0,2,8,5,"I think now its going in the right direction with someone who treats the country as a business like it should be",NA,10,100,24,6,30,20,9,10,2,5,6,5,4,6,5,5,4,3,2,2,2,3,1,2,3,2,3,2,2,3,3,2,2,3,1,3,1,3,2,2,2,6,6,2,5,3,4,4,5,6,5,5,5,1,5,5,5,4,2,4,2,3,2,3,4,3,4,4,5,4,4,4,4,4,2,5,4,1,"",4,"",1,2,4,4,1,1,4,2,5,1,1,28,2,1,7,1,1,2,1,4,1,11,3,0,2,4,2,43,0,1,1,0,2,4,1252
"1254",412,1384,"2017-09-09 17:25:34","2017-09-09 17:38:14",12,0.5243,5,"There is a God",NA,"Baptist",NA,1,75,25,7,7,7,7,1,7,7,7,7,7,0,1,0,0,0,0,0,0,0,0,0,0,0,0,0,0,0,2,2,1,"Wrong",NA,10,25,24,3,30,3,1,20,2,5,5,6,7,5,2,2,4,4,4,4,4,4,4,1,2,2,3,4,4,1,4,2,3,3,3,3,3,3,3,3,4,-1,5,5,6,5,6,4,5,5,5,3,4,3,6,6,5,3,4,6,5,6,3,5,5,4,4,3,5,4,3,4,2,3,5,5,2,1,"",4,"",1,2,5,4,1,1,7,1,1,1,1,31,2,2,11,3,5,2,1,4,1,10,5,1,2,4,2,47,0,0,1,1,2,1,1253
"1255",413,1385,"2017-09-09 17:37:28","2017-09-09 18:05:48",28,0.9512,5,"I believe there is a god.",NA,"Christian",NA,1,60,40,7,7,6,6,6,7,7,6,7,7,0,1,0,0,0,0,0,0,0,0,0,0,0,0,0,0,0,1,5,3,"Wrong direction...this country, our government, our traditions are all based in one way or another around god and/or Jesus.",NA,10,5,47,3,30,20,4,20,2,5,6,6,6,6,6,6,3,2,2,2,1,2,1,1,2,1,3,3,3,3,3,3,2,4,3,4,2,4,3,3,4,5,6,5,6,3,5,5,3,6,2,2,2,5,3,5,7,2,1,4,1,2,1,1,4,2,4,5,4,4,5,5,4,2,4,5,5,2,"",4,"",2,1,6,7,1,1,3,1,2,1,1,48,4,3,11,3,1,1,1,6,1,15,1,0,3,5,1,55,0,2,0,0,4,1,1254
"1256",414,1386,"2017-09-09 17:38:16","2017-09-09 18:10:00",31,0.8496,5,"Do not believe in the existence of a god or gods.",NA,"Unitarian Universalist",NA,2,85,15,1,1,1,1,1,3,1,1,5,2,0,0,0,0,0,0,0,0,0,1,0,0,0,0,0,0,0,2,5,7,"The country is divided between people who seem to only care about themselves and those who are like them, and people who want equal treatment for all",NA,5,1,24,3,30,15,3,20,3,3,7,6,3,6,6,6,1,2,1,1,1,1,1,2,3,3,3,1,4,3,1,3,2,3,3,3,1,3,1,3,2,2,2,3,6,2,2,1,5,6,2,2,2,6,2,5,3,3,3,3,2,2,2,1,2,2,2,4,2,3,6,6,3,4,3,3,5,1,"",4,"",1,2,2,2,1,1,7,1,1,1,1,51,4,3,12,4,1,2,1,5,1,21,1,1,1,2,1,23,0,0,0,1,4,7,1255
"1257",415,1387,"2017-09-09 17:45:50","2017-09-13 17:58:35",5772,1.4591,5,"I believe there is a god and creator who is our eternal father.",NA,"The Church of Jesus Christ of Latter Day Saints",NA,1,30,70,7,7,6,6,7,7,6,6,5,7,0,0,0,1,0,0,0,0,0,0,0,0,0,0,0,0,0,1,2,2,"Wrong direction. Too many people are are selfish, hateful, and vain",NA,10,100,24,3,30,20,4,20,2,4,6,5,3,6,5,5,2,1,1,2,2,1,2,2,4,3,3,2,4,3,2,3,2,3,2,3,3,3,3,4,3,5,4,2,5,3,4,4,6,6,2,5,3,4,5,4,4,3,3,4,3,4,4,5,3,3,4,4,3,3,4,4,-1,4,4,5,3,2,"",4,"",1,1,4,5,1,1,3,1,3,1,1,28,2,1,10,3,1,1,1,3,1,13,1,1,3,5,2,54,1,0,0,0,2,1,1256
"1258",416,1389,"2017-09-09 17:50:52","2017-09-09 19:03:12",72,0.905,5,"I was brought up Lutheran.Attended regularly until about age 15.Now much older and have witnessed lots of corruption in the religious field, I'm at that neutral area.I work off of my morals that I learned from my parents and also the church did give my a good foundation to start live.
Churches and ""other"" organizations have turned into businesses.Generating millions of tax free dollars and not for the better.
They form a religious tax front and get larger and larger.Turning into social elite gatherings for the wrong reasons.
Look what has become of Christmas, a commercial holiday!
Long story short,I'm a hands on,scientific type person and from the ""show-me"" state of Missouri.
At the age of 15, my dad died of cancer.I prayed for anything and promised lots if ""He"" would spare him. 
My Dad was 37 years old.My faith dropped overnight.
I do believe in somethings, more of what my parents taught me than anything else.
As long as it's a good ""deal"" for you, others, and your surroundings.....it's a win- win situation.",NA,"Lutheran or baptist",NA,1,60,40,4,4,4,4,4,4,4,4,4,4,0,1,0,0,0,0,0,0,0,0,0,0,0,0,0,0,0,2,6,6,"It is now....it's going to be a very difficult job to overcome what Obama destroyed.",NA,5,5,47,3,30,20,4,20,3,4,6,6,3,6,6,6,2,1,1,2,2,2,2,2,4,2,3,2,3,3,1,3,2,3,2,3,3,4,3,1,3,3,4,4,6,3,6,3,6,7,2,1,3,6,4,5,5,4,7,3,3,4,4,4,4,4,4,4,3,3,4,5,4,3,4,5,4,2,"",4,"",1,1,5,5,1,1,2,1,2,1,1,56,5,3,9,2,1,1,1,4,1,18,1,1,2,4,1,43,0,0,0,2,2,1,1257
"1259",417,1390,"2017-09-09 17:55:38","2017-09-09 18:12:07",16,1.5209,5,"I believe there is only one God",NA,"Baptist",NA,1,40,60,7,7,7,7,7,7,7,7,7,5,0,1,0,0,0,0,0,0,0,0,0,0,0,0,0,0,0,2,2,1,"Wrong. People would rather be evil than good",NA,10,100,47,3,29,15,4,0,3,7,1,1,7,4,2,1,3,4,3,2,2,1,1,1,1,1,1,3,3,1,2,1,2,4,3,3,3,4,3,4,1,7,6,5,5,2,4,5,7,7,1,1,5,1,5,3,6,7,4,7,1,1,1,1,4,5,5,7,3,7,5,4,7,1,3,7,5,2,"",4,"",2,2,7,7,1,1,1,1,2,1,1,28,2,1,11,3,1,1,1,3,1,14,1,0,3,6,1,61,1,0,0,0,2,1,1258
"1260",418,1391,"2017-09-09 17:56:46","2017-09-09 19:44:47",108,0.8615,5,"Not sure",NA,"Judaism",NA,2,75,25,2,2,2,2,3,3,2,2,4,2,0,0,0,0,1,0,0,0,0,0,0,0,0,0,0,0,0,1,7,7,"",-1,10,5,-1,3,30,15,4,20,3,2,5,6,5,5,3,5,3,2,2,2,2,2,2,1,2,1,2,2,3,1,3,3,2,2,1,2,2,1,2,1,3,3,3,4,7,1,7,1,5,6,2,2,3,3,3,4,4,1,2,1,3,5,5,3,4,3,4,4,2,2,5,5,3,4,4,4,4,1,"",4,"",1,2,3,4,1,1,5,2,5,1,1,45,4,3,14,4,1,2,1,4,1,21,1,1,3,5,1,52,0,0,2,0,2,2,1259
"1261",419,1392,"2017-09-09 18:00:51","2017-09-09 18:56:19",55,1.5393,3,"que solo hay uno",NA,"catolico",NA,1,90,10,6,5,6,5,6,5,4,4,5,5,1,0,0,0,0,0,0,0,0,0,0,0,0,0,0,0,0,2,7,3,"incorrecta",NA,1,100,24,3,15,20,9,0,3,5,5,5,5,5,5,5,4,4,4,2,2,3,2,2,2,2,2,2,3,3,2,2,2,2,1,2,1,1,1,2,3,6,5,3,5,4,5,3,5,4,3,5,3,5,3,5,4,5,3,5,4,4,4,4,5,4,4,4,-1,5,4,3,5,4,4,5,4,1,"",4,"",1,2,4,4,2,4,7,3,5,2,2,43,3,2,9,2,4,2,1,5,1,8,6,1,4,9,2,93,0,0,1,1,3,7,1260
"1262",420,1393,"2017-09-09 18:01:17","2017-09-10 23:14:57",1753,0.7962,5,"I BELIEVE we were created by a superior being who has a purpose for us.",NA,"Christian NON Denominational",NA,1,51,49,6,6,6,6,4,6,6,4,5,5,0,0,0,0,0,0,0,0,0,0,1,0,0,0,0,0,0,1,2,1,"Trump and God can put this country in the right direction. All opposing Trump are going in the wrong direction. Allowing Mosque and mosque going Muslims into this country IS going in the wrong direction. Liberals are going in the wrong direction. The list goes on and on.",NA,0,100,47,3,15,20,3,20,3,6,6,6,6,6,6,6,2,2,2,2,3,1,3,2,3,2,3,2,2,2,4,3,2,2,2,3,2,4,2,4,3,4,5,6,5,5,5,2,5,5,3,2,3,6,2,5,5,4,3,4,3,4,5,7,4,3,3,4,5,3,3,2,3,4,5,6,3,2,"",4,"",1,2,6,6,1,1,2,1,2,1,1,54,4,3,9,2,1,1,1,4,1,16,1,1,1,2,1,21,0,0,0,0,4,1,1261
"1263",421,1394,"2017-09-09 18:08:32","2017-09-09 18:48:15",39,1.8036,5,"I believe god is real",NA,"I'm a Christian",NA,1,100,0,7,5,4,4,4,4,7,7,4,5,0,0,0,0,0,0,0,0,0,0,0,0,1,0,0,0,0,1,8,1,"Wrong direction because we as the people are not free the government in the laws control the world",NA,10,60,28,12,15,0,6,90,1,5,5,6,5,6,4,7,4,3,1,2,4,4,2,3,2,1,4,2,4,3,4,3,2,1,2,1,1,1,2,2,5,6,5,4,4,4,7,5,4,4,5,5,7,4,5,5,4,5,4,5,4,7,5,4,4,4,4,4,4,5,4,4,5,5,5,5,4,2,"",4,"",1,2,4,4,1,1,7,2,5,1,1,28,2,1,7,1,2,1,0,2,3,1,1,1,2,3,2,31,0,0,0,0,2,6,1262
"1264",422,1395,"2017-09-09 18:19:43","2017-09-09 18:44:03",24,0.5574,5,"There is a god and he needed my daugters help
God love her",NA,"Methodist",NA,1,50,50,6,6,7,6,4,5,6,6,6,6,0,1,0,0,0,0,0,0,0,0,0,0,0,0,0,0,0,1,3,3,"??",NA,10,100,24,3,15,20,9,10,3,3,6,4,6,5,5,5,2,2,1,2,2,1,1,2,3,3,-1,3,2,4,2,4,2,-1,-1,-1,-1,-1,-1,-1,4,5,4,5,4,4,4,4,5,4,4,2,3,4,4,3,5,4,3,4,4,4,3,4,4,4,4,4,4,4,4,4,4,4,4,4,4,2,"",4,"",1,1,4,3,1,1,6,1,2,1,1,62,5,4,11,3,1,1,1,2,1,15,1,0,1,2,1,21,0,0,0,0,2,1,1263
"1265",423,1396,"2017-09-09 18:49:19","2017-09-09 18:59:05",9,1.6085,2,"They dont exist",NA,"None",NA,2,70,30,1,1,1,2,4,5,3,1,2,1,0,0,0,0,0,0,0,0,0,0,0,0,0,0,1,0,0,2,8,7,"Wrong because of trump",NA,10,5,47,3,30,15,4,0,2,5,5,4,3,5,4,5,2,2,2,2,2,2,2,3,4,3,2,2,4,3,3,4,2,1,1,1,1,1,1,1,4,5,5,4,5,4,5,3,4,5,4,2,3,4,5,-1,3,3,4,4,3,3,4,4,4,3,5,4,3,4,5,4,3,3,5,4,4,2,"",4,"",1,2,2,2,1,2,6,3,5,2,1,28,2,1,9,2,4,1,0,4,1,9,5,1,4,9,1,93,0,0,0,0,4,1,1264
"1266",424,1397,"2017-09-09 18:51:14","2017-09-09 19:38:02",46,0.722,5,"i need more proof",NA,"catholic",NA,1,75,25,6,4,6,5,4,6,4,4,4,5,1,0,0,0,0,0,0,0,0,0,0,0,0,0,0,0,0,1,5,7,"wrong direction, people don't have passion anymore, about anything",NA,10,100,24,3,15,0,3,20,2,7,5,4,7,7,5,5,2,2,1,1,1,2,1,3,4,3,4,1,4,3,1,3,2,-1,-1,-1,-1,-1,-1,-1,3,4,5,4,5,7,5,4,5,5,1,1,4,5,3,2,5,4,3,4,1,4,1,3,4,3,4,4,3,4,4,4,4,5,4,5,4,2,"",4,"",1,2,2,3,1,1,7,1,1,1,1,58,5,3,9,2,1,1,1,2,1,9,6,1,1,1,2,14,0,0,0,0,2,1,1265
"1267",425,1399,"2017-09-09 19:05:48","2017-09-09 19:11:10",5,0.9911,5,"",-1,"",-1,-1,70,30,-1,-1,-1,-1,-1,-1,-1,-1,-1,2,0,0,0,0,0,0,0,0,0,0,0,0,0,0,0,0,1,1,-1,-1,"",-1,-1,-1,-1,3,-1,-1,-1,-1,-1,-1,-1,-1,-1,-1,-1,-1,-1,-1,-1,-1,-1,-1,-1,-1,-1,-1,-1,-1,-1,-1,-1,-1,2,1,-1,-1,1,-1,-1,-1,3,-1,5,-1,-1,-1,-1,-1,6,5,-1,3,3,-1,-1,-1,-1,-1,-1,6,-1,-1,-1,-1,-1,-1,-1,-1,-1,-1,-1,-1,-1,-1,-1,-1,-1,2,"",4,"",1,1,6,6,1,1,2,1,2,1,1,42,3,2,9,2,1,1,1,5,1,13,1,0,2,3,1,35,0,0,0,1,4,1,1266
"1268",426,1400,"2017-09-09 19:11:05","2017-09-09 19:24:57",13,1.6128,2,"",-1,"Testigos de Jehova",NA,1,50,50,7,7,7,7,1,7,1,1,1,1,0,0,1,0,0,0,0,0,0,0,0,0,0,0,0,0,0,1,1,1,"Incorrecta",NA,10,500,7,6,15,15,18,20,2,5,5,6,1,7,5,5,2,4,4,2,4,3,4,3,3,1,4,4,4,2,4,2,3,4,4,4,4,4,3,4,2,6,4,5,4,1,6,2,5,5,5,4,5,4,5,3,4,4,4,4,2,3,2,1,4,3,4,4,4,4,-1,4,4,4,4,4,4,1,"",4,"",1,1,6,6,1,2,3,3,5,2,2,19,1,1,9,2,4,2,0,2,2,10,5,1,4,9,2,93,0,0,0,0,2,1,1267
"1269",427,1402,"2017-09-09 19:13:56","2017-09-09 19:38:46",24,1.4493,5,"I believe in Jesus Christ as my Lord and savor. He is the one true God.",NA,"i am a non-denominational christian  I go to church each and every week and serve.",NA,1,50,50,7,7,7,5,4,7,7,7,7,7,0,0,0,0,0,0,0,0,0,0,1,0,0,0,0,0,0,2,1,1,"the people around me the right direction, the country I pray for its hard to ""JUDGE"" GOD HELP US! ALL WE NEED IS LOVE! BUT this country needs to help one another grow in love peace and happiness its very simple and politics is prejudices and its not about THAT what happen to that paper they made in Philadelphia the Constitution!!!!!!! I rest my case Amen Again Love Does Amen GOD HELP US!",NA,-1,-1,-1,-1,15,-1,-1,-1,-1,-1,-1,-1,-1,-1,-1,-1,3,1,2,1,2,2,1,1,1,1,4,4,1,4,3,4,2,3,3,3,3,3,3,2,2,2,3,4,7,1,7,2,4,3,1,7,1,7,2,7,3,6,3,6,3,6,6,6,3,2,2,3,2,3,3,2,2,3,2,3,3,1,"",4,"",1,2,4,4,1,1,7,1,1,1,1,43,3,2,9,2,2,2,1,5,2,15,1,1,1,2,1,23,0,0,0,1,4,1,1268
"1270",428,1403,"2017-09-09 19:14:36","2017-09-09 19:27:09",12,0.9051,5,"",-1,"Je wish",NA,2,76,24,1,1,4,5,4,6,1,1,4,-1,0,0,0,0,1,0,0,0,0,0,0,0,0,0,0,0,0,2,4,-1,"Evangelicalism has eroded separation of church and state",NA,10,-1,-1,-1,-1,-1,-1,20,2,3,6,5,4,3,4,4,4,4,4,2,4,4,4,1,1,2,2,2,4,2,2,3,3,4,4,3,-1,4,-1,4,1,4,4,6,7,1,7,7,3,5,-1,2,4,2,6,4,4,2,2,1,1,-1,1,1,4,2,4,4,2,2,3,6,2,4,4,4,4,1,"",-1,"",1,1,1,2,1,1,7,1,1,1,1,59,5,3,10,3,1,2,1,2,3,4,3,1,2,4,2,47,0,0,0,0,2,2,1269
