,X,CaseID,tm_start,tm_finish,duration,weight,DOV_ACSLANG,Q01,Q01_Refused,Q03,Q03_Refused,Q04,Q05a,Q05b,Q06_1,Q06_2,Q06_3,Q06_4,Q06_5,Q06_6,Q06_7,Q06_8,Q06_9,Q06_10,Q26_1,Q26_2,Q26_3,Q26_4,Q26_5,Q26_6,Q26_7,Q26_8,Q26_9,Q26_10,Q26_11,Q26_12,Q26_13,Q26_14,Q26_15,Q26_16,Q26_Refused,Q07_order,Q07,Q07a,Q7b,Q7b_Refused,Q08a_1,Q08a_2,Q08a_3,Q08b_1,Q08b_2,Q08b_3,Q08c_1,Q08c_2,Q08d,Q09_1,Q09_2,Q09_3,Q09_4,Q09_5,Q09_6,Q09_7,Q10_1,Q10_2,Q10_3,Q10_4,Q10_5,Q10_6,Q10_7,Q11_1,Q11_2,Q11_3,Q11_4,Q11_5,Q11_6,Q11_7,Q11_8,Q11_9,Q12,Q13_1,Q13_2,Q13_3,Q13_4,Q13_5,Q13_6,Q13_7,Q14_1,Q14_2,Q14_3,Q14_4,Q14_5,Q14_6,Q14_7,Q14_8,Q14_9,Q14_10,Q14_11,Q14_12,Q14_13,Q14_14,Q14_15,Q14_16,Q14_17,Q14_18,Q14_19,Q14_20,Q14_21,Q14_22,Q14_23,Q14_24,Q16_1,Q16_2,Q16_3,Q16_4,Q16_5,Q16_6,Q16_7,Q16_8,Q16_9,Q16_10,Q16_11,Q16_12,Q16_13,Q17,Q17_Other,Q18,Q18_Other,Q19,Q20_21_order,Q20,Q21,PPP20197,PPP10003,DOV_PARTY7,PPPA1699,PPPA1690,XHISPAN,XSpanish,PPAGE,ppagecat,ppagect4,PPEDUC,PPEDUCAT,PPETHM,PPGENDER,PPHHHEAD,PPHHSIZE,PPHOUSE,PPINCIMP,PPMARIT,PPMSACAT,PPREG4,ppreg9,PPRENT,PPSTATEN,PPT01,PPT25,PPT612,PPT1317,PPT18OV,PPWORK,id
1,1,3,8/29/17 23:47,8/30/17 0:10,22,1.1574,5,I grew up believe but science us fact,NA,Atheist,NA,2,50,50,2,2,4,2,2,2,2,2,4,2,0,0,0,0,0,0,0,0,0,0,0,0,0,1,0,0,0,2,5,7,Wrong because America was found on the christian beliefs . An beacuse they dont want to offend anyone they are taking the religion out of evrything,NA,-1,100,-1,-1,30,-1,-1,0,2,6,4,4,6,4,4,4,3,3,2,2,2,2,3,2,3,1,3,3,3,2,4,2,2,4,3,2,2,2,2,2,4,4,4,1,6,3,5,5,6,4,4,5,6,4,5,3,5,4,3,4,4,7,1,1,2,4,4,3,3,3,5,4,4,4,4,4,4,1,,2,,1,1,5,5,1,1,3,2,5,1,1,27,2,1,9,2,1,2,1,2,3,11,1,1,1,2,2,23,0,0,0,0,2,1,1
2,2,4,8/29/17 23:48,8/30/17 0:14,25,1.3704,2,I believe it's all a mental) physcoligical thing.,NA,I was baptised Catholic. Raised Christian,NA,2,80,20,7,1,1,5,4,3,4,4,5,1,0,1,0,0,0,0,0,0,0,0,0,0,0,0,0,0,0,2,7,-1,Wrong,NA,10,100,24,6,30,120,5,10,1,3,6,6,3,6,6,7,4,4,4,4,4,4,4,4,1,1,3,2,4,2,4,3,2,1,1,1,1,1,1,1,6,5,3,6,6,5,6,5,7,6,1,1,5,7,3,6,5,1,1,2,2,7,6,6,1,2,2,5,2,2,6,6,2,2,2,7,2,1,,4,,1,2,3,3,1,1,5,1,3,2,1,35,3,2,10,3,4,2,0,1,2,11,5,1,4,9,1,93,0,0,0,0,1,1,2
3,3,5,8/29/17 23:51,8/30/17 0:17,26,0.6677,5,There is one God.,NA,Catholic,NA,1,60,40,6,5,5,5,5,6,4,4,6,4,1,0,0,0,0,0,0,0,0,0,0,0,0,0,0,0,0,2,2,3,"I think that social media and the extreme right and left are ruining the country! It's time for the ""middle"" to speak up.",NA,10,1,24,3,15,15,4,10,3,2,5,6,5,6,6,-1,2,2,1,1,1,2,2,2,3,3,3,2,3,3,3,3,2,2,1,2,1,2,2,2,4,4,3,4,5,3,6,2,5,6,2,5,3,6,4,3,5,3,2,3,4,4,4,5,3,4,4,4,4,4,4,4,4,4,4,4,4,1,,4,,1,1,3,5,1,1,2,1,3,1,1,71,6,4,12,4,1,2,1,2,1,17,1,1,4,9,1,93,0,0,0,0,2,2,3
4,4,6,8/29/17 23:51,8/30/17 0:05,13,1.0866,5,No,NA,None,NA,2,50,50,1,2,2,2,2,4,4,4,4,1,0,0,0,0,0,0,0,0,0,0,0,0,1,0,0,0,0,2,7,7,Wrong. Donald Trump is a joke.,NA,5,100,47,3,31,15,9,20,3,4,4,4,4,4,4,4,2,2,2,2,2,2,2,3,3,3,3,3,3,3,3,3,2,1,1,1,1,1,1,1,3,6,5,5,6,4,6,2,2,5,4,5,3,3,3,3,5,2,2,2,4,6,4,3,5,4,5,4,3,2,6,3,4,5,6,7,3,2,,4,,1,2,2,2,1,1,7,1,1,1,1,24,1,1,13,4,1,1,1,2,1,17,5,1,1,1,1,14,0,0,0,0,2,1,4
5,5,7,8/29/17 23:53,8/30/17 0:11,17,1.534,5,I believe in GOD cuz he the only one that sustains me though everyday life experences,NA,Baptist,NA,1,0,100,6,6,4,4,4,7,4,4,6,4,0,1,0,0,0,0,0,0,0,0,0,0,0,0,0,0,0,1,1,1,Donald Trump that's Self Explantory,NA,45,15,76,5,5,4,7,100,1,4,4,4,4,4,4,4,1,1,1,1,1,1,1,1,1,1,1,1,1,1,1,1,1,1,1,1,1,1,1,1,4,4,4,4,4,4,4,4,4,4,4,4,4,4,4,4,4,4,4,4,4,4,4,4,4,4,4,4,4,4,4,4,4,4,4,4,4,2,,4,,1,1,5,5,1,1,5,1,1,1,1,35,3,2,9,2,2,1,1,1,1,21,5,1,2,3,1,32,0,0,0,0,1,1,5
6,6,8,8/29/17 23:57,8/30/17 0:25,27,0.3708,5,,-1,methodist,NA,1,80,20,5,5,5,5,5,5,6,5,6,3,0,1,0,0,0,0,0,0,0,0,0,0,0,0,0,0,0,1,3,3,we are going,NA,10,5,30,3,30,20,4,20,3,4,5,4,4,6,4,5,2,2,1,2,2,2,2,2,4,3,3,2,3,3,2,3,2,2,1,3,1,2,2,4,3,4,4,3,4,4,5,4,4,4,4,2,2,5,2,5,4,2,2,3,2,5,5,5,4,4,5,3,3,2,4,4,5,4,4,4,3,1,,1,,1,2,4,4,1,1,1,1,2,1,1,67,6,4,14,4,5,2,1,1,1,19,5,1,4,9,1,95,0,0,0,0,1,2,6
7,7,9,8/29/17 23:59,8/30/17 0:10,11,0.7054,5,I believe there is a supreme being.,NA,Presbyterian,NA,1,65,35,7,6,6,6,5,6,7,6,5,3,0,1,0,0,0,0,0,0,0,0,0,0,0,0,0,0,0,2,2,2,"Wrong

Focused on identity politics rather than a melting pot improvement focus",NA,5,547,47,3,29,15,4,10,3,3,6,5,5,4,5,5,2,1,1,2,2,1,1,2,4,4,4,1,3,4,2,3,2,3,2,3,2,3,3,2,1,6,5,2,5,3,5,2,5,6,2,5,1,5,1,5,5,3,2,3,1,3,1,2,3,3,4,2,1,5,5,4,2,5,5,2,4,2,,4,,1,2,4,6,1,1,1,1,2,1,1,69,6,4,14,4,1,1,1,2,1,18,1,1,2,3,1,32,0,0,0,0,2,1,7
8,8,10,8/29/17 23:59,8/30/17 0:50,50,0.8344,5,I believe that there is a God somewhere around us but am never sure where or how--I just want to believe,NA,jewish,NA,1,60,40,4,1,2,6,1,5,6,1,2,2,0,0,0,0,1,0,0,0,0,0,0,0,0,0,0,0,0,1,7,6,wrong direction==whoever voted for Trump is a schuck---he can't do anything right--he is only out for himself to make money--his family is no better and his wife only believes she is beautiful and does not know that most of the world's women are not--do most women in the US carry a diamond on their finger that covers her whole finger---I's not jealous of her but think she is only put for his money and only has sex hen she tricks him into getting her goods!,NA,10,100,24,6,30,20,6,10,1,4,3,5,4,6,2,2,4,4,1,3,3,1,4,2,3,3,4,4,4,3,3,4,2,2,1,2,1,2,1,1,1,1,2,5,6,2,5,1,6,7,1,1,1,2,6,4,4,5,3,5,5,4,1,5,6,4,6,2,2,2,4,1,4,2,6,5,2,1,,4,,1,1,2,2,1,1,7,1,1,1,1,66,6,4,12,4,1,2,1,2,1,19,1,1,3,5,1,52,0,0,0,0,2,1,8
9,9,11,8/30/17 0:00,8/30/17 0:15,14,0.8956,5,Idk,NA,None,NA,1,85,15,4,4,4,4,4,4,4,4,4,4,0,0,0,0,0,0,0,0,0,0,0,0,1,0,0,1,0,1,8,5,Idk,NA,10,100,24,6,15,50,6,10,1,4,4,4,4,4,4,4,2,2,2,2,2,2,2,3,3,3,3,3,3,3,3,3,2,2,2,2,2,2,2,2,3,3,4,5,4,4,4,4,3,4,5,4,4,5,5,5,3,4,3,3,4,5,5,4,4,5,5,5,4,3,3,4,4,5,5,3,4,1,,4,,1,1,4,4,1,2,5,3,5,1,1,29,2,1,9,2,1,2,1,3,4,4,5,0,1,2,2,23,0,0,2,0,1,6,9
10,10,12,8/30/17 0:00,8/30/17 1:15,75,0.7569,5,no,NA,none,NA,2,85,15,1,1,1,1,1,1,1,1,1,1,0,0,0,0,0,0,0,0,0,0,0,0,1,0,0,0,0,2,8,7,It is going in the wrong direction because it's headed by an evil psychotic and his religious nutcase followers.,NA,5,5,24,3,29,15,4,0,3,5,5,5,5,3,5,5,1,1,1,2,2,1,2,2,3,4,2,3,4,4,2,3,3,2,3,2,1,3,3,3,3,4,5,4,6,2,6,2,5,5,3,3,3,5,3,5,6,3,2,3,3,4,2,4,4,3,3,3,3,3,5,5,3,3,5,4,4,1,,4,,1,2,1,1,1,1,7,1,1,1,1,76,7,4,12,4,1,2,1,2,1,14,1,1,3,5,1,58,0,0,0,0,2,5,10
11,11,13,8/30/17 0:00,8/30/17 0:16,15,0.7797,5,"I believe in the Triune God, Father, Son, and Holy Spirit. maker of the universe, redeemer of all who believe, and giver of faith.",NA,Lutheran,NA,1,60,40,7,6,4,6,6,6,7,7,6,5,0,1,0,0,0,0,0,0,0,0,0,0,0,0,0,0,0,2,2,3,"Wrong direction.  We are too concerned with ""me, me, me"" and what I think I should do and not enough about how God would have us act, including that He would have us love one another.",NA,10,5,47,3,1,14,4,20,3,3,5,6,5,5,5,5,2,2,1,2,2,2,1,2,3,3,3,2,4,3,2,3,2,3,3,3,3,4,3,4,4,2,3,4,7,2,6,1,5,6,3,3,2,5,3,6,6,2,2,3,2,2,2,2,4,4,4,3,2,4,3,5,4,2,4,5,4,1,,4,,1,2,5,4,1,1,4,1,3,1,1,67,6,4,13,4,1,2,1,1,1,14,1,1,2,4,1,43,0,0,0,0,1,1,11
12,12,14,8/30/17 0:01,8/30/17 0:44,42,0.8789,1,It is a complete creation of men trying to explain the unknown.,NA,None.,NA,2,75,25,1,2,2,2,3,6,2,2,2,1,0,0,0,0,0,0,0,0,0,0,0,0,0,0,1,0,0,2,8,-1,"Completely wrong direction. We elected a misfit absent any kind of intellectual knowledge or curiosity, whose only interest is his own aggrandizing and enrichment. Hopefully his election will be the antidote we need to start considering cooperating with the people we don't agree with, but who we need in order to get anything accomplished. However, his election has uncovered very ugly and disturbing aspects of a country most of us did not know. As a immigrant, who at one time professed a willingness to die for this country, today I'm deeply saddened to discover that the country I gave up my original citizenship for, does not deserve my loyalty nor value my love for it.",NA,10,20,24,3,30,0,6,30,2,3,5,5,3,6,3,7,1,1,1,1,1,1,1,1,3,3,4,2,4,2,3,3,2,3,2,2,2,3,2,2,3,3,3,5,6,4,5,2,5,7,2,3,2,5,3,7,5,3,2,5,1,2,5,3,3,3,4,5,2,3,5,4,4,3,4,3,4,2,,2,,1,2,2,5,1,1,6,1,1,8,1,61,5,4,10,3,4,1,1,2,1,14,1,1,1,2,1,22,0,0,0,0,2,5,12
13,13,15,8/30/17 0:05,8/30/17 0:34,28,0.8011,5,I do not believe,NA,"I consider myself an atheist but not officially ""affiliated""",NA,2,70,30,1,1,1,1,1,5,1,1,1,1,0,0,0,0,0,0,0,0,0,0,0,0,1,1,0,0,0,2,8,7,Wrong direction; Trump & Congress,NA,10,1,1,2,15,0,3,0,2,5,6,6,5,6,5,6,2,2,1,2,1,2,1,1,3,2,2,3,4,3,3,3,2,2,1,2,1,2,1,1,1,5,3,2,6,3,5,3,2,6,2,2,5,2,5,6,4,3,2,5,1,1,1,1,4,3,4,4,2,2,5,3,3,2,6,3,2,1,,4,,1,2,2,2,1,2,6,3,5,1,1,64,5,4,10,3,1,2,1,2,1,16,1,1,4,9,1,91,0,0,0,0,2,5,13
14,14,16,8/30/17 0:09,8/30/17 0:26,17,0.8687,5,There is positive and negative energy that rules the planets.  But I think Jesus and the Bible are mostly fictional,NA,Raised catholic,NA,2,80,20,3,1,6,1,4,5,5,1,2,1,1,0,0,0,0,0,0,0,0,0,0,0,0,0,0,0,0,2,5,6,The leadership is i. The wrong direction but that will pass but the American people are going in the right direction,NA,10,1000,24,12,30,30,6,20,2,7,5,6,3,3,5,4,4,4,4,1,1,4,1,1,2,1,1,4,1,3,2,4,2,4,1,2,1,3,3,3,7,2,1,6,3,4,5,5,3,6,4,4,7,4,5,1,6,3,2,2,2,6,4,6,2,6,2,4,5,2,2,6,3,2,2,2,6,1,,4,,1,2,2,2,1,1,7,1,1,1,1,43,3,2,12,4,1,2,1,4,1,21,1,1,4,9,1,93,0,0,2,0,2,2,14
15,15,17,8/30/17 0:13,9/8/17 17:51,14018,1.2631,5,1,NA,seculsr,NA,1,90,10,7,7,7,7,7,7,7,7,7,7,0,0,0,0,0,0,0,0,0,0,1,0,0,0,0,1,0,1,1,1,incorrecta,NA,3,5,2,6,2,30,2,2,1,4,4,4,4,4,4,4,1,1,1,1,1,1,1,1,1,1,1,1,1,1,1,1,1,1,1,1,1,1,1,1,4,4,4,4,4,4,4,4,4,4,4,4,4,4,4,4,4,4,4,4,4,4,4,4,4,4,4,4,4,4,4,4,4,4,4,4,4,6,no,8,no,1,1,1,1,2,4,5,3,5,1,2,18,1,1,8,1,1,1,1,1,1,6,5,1,3,7,1,74,0,0,0,0,1,7,15
16,16,18,8/30/17 0:18,8/30/17 2:35,137,0.7668,5,I believe that there is a higher power than myself or others.  I do believe in the creation of the universe by a higher power.  I do believe that man/woman is created in the image of God.  I don't believe that there are multiple Gods in a single religion.  Different religions can have their own image of what God is for those believing in that religion.,NA,Methodist,NA,1,60,40,6,5,5,4,4,5,5,5,5,4,0,1,0,0,0,0,0,0,0,0,0,0,0,0,0,0,0,1,5,6,"Wrong direction!  Many individuals have forgotten how to live by / and practice the Ten Commandments.
""Do unto others as you would have them do unto you.  Love you neighbor.  Etc."" Many in our society are only interested in their own personal rewards and gratification.  Some are not concerned with the betterment of society in general and not supportive of the American Dream for all.",NA,-1,-1,-1,-1,-1,-1,-1,-1,-1,3,5,5,3,5,6,6,1,1,1,2,2,1,2,2,3,2,3,1,2,2,4,3,2,2,1,4,2,3,3,4,4,1,5,6,6,1,6,2,6,7,2,1,2,5,4,6,4,2,3,3,4,4,2,4,6,4,6,4,2,5,3,4,5,3,6,5,2,1,,4,,1,2,4,6,1,1,1,1,2,1,1,61,5,4,12,4,1,2,1,1,1,16,3,1,3,5,1,59,0,0,0,0,1,5,16
17,17,19,8/30/17 0:20,8/30/17 0:36,16,0.8153,5,probably not,NA,Unitarian Universalist,NA,2,80,20,2,2,2,2,2,2,2,2,2,2,0,0,0,0,0,0,0,0,0,1,0,0,0,0,0,0,0,1,5,6,,-1,10,200,24,3,30,20,4,10,2,4,4,4,4,6,5,4,2,2,2,2,1,1,1,2,3,3,3,1,3,3,2,3,2,3,2,2,2,2,2,3,4,4,4,5,4,4,2,3,4,5,2,5,4,3,5,5,3,5,3,5,3,3,4,3,4,3,5,4,4,5,4,3,5,4,5,4,3,2,,4,,1,2,2,5,1,1,3,1,3,1,1,58,5,3,10,3,1,1,1,3,1,17,1,1,1,1,1,14,0,0,0,0,3,1,17
18,18,20,8/30/17 0:20,8/30/17 0:37,17,0.6527,5,No.,NA,None,NA,2,80,20,2,1,2,1,7,7,1,1,3,5,0,0,0,0,0,0,0,0,0,0,0,0,0,0,1,0,0,1,8,7,"Wrong direction with unrestrained capitalism, income inequality, division of people based on wealth, race, politics.",NA,10,1,24,12,1,20,6,30,2,5,7,6,3,6,6,6,4,2,2,2,1,2,3,2,3,3,1,2,4,2,3,3,2,2,2,1,1,1,1,1,2,3,3,2,5,5,4,5,5,6,4,3,5,3,6,2,6,3,1,1,3,6,2,3,3,3,3,4,3,3,5,3,3,3,5,5,3,2,,3,,1,2,1,1,1,1,6,1,1,1,1,59,5,3,11,3,1,1,1,2,3,8,6,1,4,9,2,93,0,0,0,0,2,1,18
19,19,21,8/30/17 0:23,8/30/17 0:53,29,0.7799,5,I am a non-believer.,NA,none,NA,2,40,60,1,1,1,1,1,1,1,1,1,1,0,0,0,0,0,0,0,0,0,0,0,0,0,1,0,0,0,1,8,7,"Trump needs to GO,sooner than later. A qualified POTUS could truly set this country in the right direction.",NA,10,5,47,0,0,0,0,0,3,4,5,5,2,4,5,5,1,1,1,1,1,1,1,3,-1,4,2,1,2,4,2,4,2,4,2,4,3,4,4,4,3,2,2,7,5,3,4,2,6,5,2,2,1,7,1,7,5,1,2,3,2,1,2,1,3,2,3,2,3,2,5,5,3,4,4,3,4,2,,4,,1,2,3,4,1,1,5,1,3,1,1,72,6,4,7,1,1,1,1,2,1,17,1,1,3,5,1,56,0,0,0,0,2,5,19
20,20,23,8/30/17 0:27,8/30/17 1:11,44,0.6207,5,I believe in the Christian God,NA,"I consider myself Christian, but do not align myself with any particular sect",NA,1,70,30,7,7,7,6,7,7,7,7,6,1,0,0,0,0,0,0,0,0,0,0,1,0,0,0,0,0,0,1,2,1,"Wrong direction. Many people claim to be Christian, but act and vote in a way completely contrary to Christian ideals. The popularity of social media and the lack of critical thinking skills has caused people to become more polarized and less accepting of differing viewpoints.",NA,5,5,47,3,29,15,4,20,3,2,7,6,2,7,6,6,2,1,1,1,1,1,1,1,1,1,3,3,4,1,3,2,2,4,1,2,2,4,2,4,2,6,6,1,5,3,2,5,4,6,2,3,1,6,2,4,3,4,5,3,2,4,2,2,2,1,2,4,1,1,6,6,3,4,2,5,4,2,,4,,2,2,2,2,1,1,5,1,1,1,1,29,2,1,12,4,5,1,0,2,1,12,1,1,3,5,2,59,0,0,0,0,2,1,20
21,21,24,8/30/17 0:27,8/30/17 1:19,52,0.6206,5,"Logically, the proverbial man in a white robe and beard is ridiculous.  There would be no reason to think a more advanced being would be similar to a human.  In a hierarchy of beings, the greatest of which being a god or gods, we would not have the capacity to understand it / them. There are scientific bases for most occurrences in the universe and I believe more discoveries will explain that which seems beyond us now.",NA,"As a non-denominational wedding officiant, I am affiliated with the Universal Life Church and the Universal Brotherhood group.  The ordinations I have through them allow me to continue doing my work.",NA,2,90,10,1,1,1,1,4,4,1,1,1,1,0,0,0,0,0,0,0,0,0,0,0,0,0,0,1,0,0,1,6,6,"Wrong direction!  Some of the more staunch believers in god (and, in many cases, Christianity) seem to be behind singling out those who are non-believers or think differently from them.  We are singling out Muslims, Blacks, Latinos, Jews, LBGTQ, and other groups.  We have seen a rise in hate crimes and neo-Naziism.  There is an overall ""us against them""... making America great again... in the stereotypical White Anglo Saxon Christian mold.  There is strong evidence that conservative predominantly white Christians believe their country is being taken away from them and destroyed... that our nation and past administrations have placed them under attack.  There seems to be no inclination toward understanding... only toward isolationism and fear.",NA,5,5,47,3,29,15,4,20,3,5,5,6,5,6,6,5,4,3,2,2,2,2,2,2,2,3,3,3,4,2,3,3,2,4,3,4,3,3,4,3,5,3,5,4,6,2,7,1,4,6,5,5,5,3,5,1,7,2,2,1,2,4,1,1,5,2,5,2,4,1,4,4,5,3,5,5,2,2,,4,,2,2,2,2,1,1,7,1,1,1,1,60,5,4,12,4,1,1,0,2,1,16,3,1,1,2,1,22,0,0,0,0,2,2,21
22,22,25,8/30/17 0:31,8/30/17 0:49,17,1.4127,2,I believe in God always have seen the day I was born I thank my parents.,NA,Catholic,NA,1,50,50,7,7,7,5,7,7,7,5,7,6,1,0,0,0,0,0,0,0,0,0,0,0,0,0,0,0,0,2,4,1,No body know.,NA,10,100,45,12,15,7,14,30,2,5,4,4,4,7,2,5,4,4,4,4,4,4,4,2,3,2,3,3,4,2,4,2,2,1,1,1,1,1,1,1,4,2,4,5,5,6,6,5,7,4,4,2,4,3,4,5,4,3,4,3,6,7,5,7,5,5,5,4,4,4,4,4,6,4,5,5,4,2,,4,,2,1,1,4,1,1,7,1,1,3,1,37,3,2,9,2,4,1,0,4,2,9,6,1,3,5,1,51,0,0,0,0,4,1,22
23,23,27,8/30/17 0:33,8/30/17 1:17,43,0.7962,5,i agree,NA,baptist,NA,1,75,25,5,5,5,5,5,5,5,5,5,5,0,1,0,0,0,0,0,0,0,0,0,0,0,0,0,0,0,2,5,3,"wrong direction, people are looking to other things for guidence",NA,5,20,47,3,30,15,4,20,3,5,5,4,5,4,4,5,2,1,1,2,2,1,1,2,3,2,3,2,3,2,3,2,2,3,2,3,2,2,2,2,4,5,5,3,5,4,5,5,5,5,3,3,6,3,4,5,5,4,3,4,3,4,4,4,4,3,3,4,4,3,5,5,3,4,4,3,4,2,,4,,1,2,2,2,1,1,3,1,2,1,1,51,4,3,9,2,1,1,1,2,1,17,1,1,1,2,1,23,0,0,0,0,2,1,23
24,24,28,8/30/17 0:37,8/30/17 1:00,23,0.9428,5,"Someone or something bigger than me I do not understand or see makes the universe and everything we encounter in our lives, both good and bad.",NA,United Methodist,NA,1,80,20,7,6,7,6,7,7,7,7,6,3,0,1,0,0,0,0,0,0,0,0,0,0,0,0,0,0,0,2,7,4,"This country is overrun with hateful, greedy, bible-thumping people who want to crush people beneath their feet on their way to acquiring more and more wealth.  And that is sad.",NA,10,100,24,3,30,0,6,20,2,5,5,6,3,6,1,6,4,4,3,2,1,2,1,1,4,3,4,3,4,2,4,3,2,4,3,4,4,4,3,4,3,4,3,4,6,5,6,5,7,7,4,2,6,1,6,2,7,1,1,1,1,5,5,5,4,1,2,6,1,1,5,7,1,3,2,7,4,2,,2,,1,2,1,2,1,1,7,1,1,1,1,52,4,3,12,4,2,1,1,2,2,14,1,1,3,7,1,74,0,0,0,0,2,1,24
25,25,29,8/30/17 0:39,8/30/17 1:11,32,0.6848,5,I believe their is a Creator,NA,United Methodist Church.   Presbyterian Church.,NA,1,60,40,6,1,4,1,5,4,5,2,5,5,0,1,0,0,0,0,0,0,0,0,0,0,0,0,0,0,0,1,2,3,"Wrong direction.  Evidenced by the divisiveness via protests, social media comments, and extreme political disagreements.  Also, lack of action by Congress.  We are NOT moving forward in a positive fashion.",NA,10,5,47,320,15,15,4,20,3,6,6,5,3,7,5,6,1,1,1,1,1,1,1,1,3,3,3,1,3,3,2,3,2,4,2,3,2,4,3,3,1,5,3,2,5,2,4,1,6,3,1,2,1,6,2,6,3,1,2,1,1,1,2,2,2,2,4,5,1,2,5,6,1,5,3,1,4,2,,4,,1,2,5,5,1,1,1,1,2,1,1,74,6,4,12,4,1,1,1,2,1,19,1,1,3,7,1,74,0,0,0,0,2,5,25
26,26,30,8/30/17 0:39,8/30/17 1:21,41,1.5245,5,I believe there is a God.,NA,Baptist,NA,1,80,20,7,7,7,4,2,7,7,6,7,4,0,1,0,0,0,0,0,0,0,0,0,0,0,0,0,0,0,2,2,1,I'm undecided about the direction.  There are good things going on and there are bad things going on.  I'm not sure which direction we are heading.,NA,10,100,24,3,29,15,5,10,3,3,5,5,5,6,5,7,2,1,1,1,2,1,2,1,3,1,3,2,3,3,3,3,2,2,2,2,1,3,2,2,3,3,3,3,3,3,6,3,7,7,3,3,2,5,3,5,4,3,2,4,4,4,7,5,4,4,4,5,3,3,4,4,4,4,4,5,4,1,,4,,1,2,5,5,1,1,6,1,1,1,1,43,3,2,11,3,2,2,1,3,1,16,1,1,3,5,1,58,0,0,0,1,2,1,26
27,27,31,8/30/17 0:43,8/30/17 0:59,15,0.7879,5,There may be one? I'm not sure.,NA,None. Was raised United Methodist,NA,1,50,50,4,4,5,5,4,5,4,2,5,3,0,0,0,0,0,0,0,0,0,0,0,0,0,0,1,0,0,2,7,6,"Wrong direction, mainly due to leadership in the White House and the resurgence of hate groups.",NA,10,100,24,3,30,15,4,10,2,4,7,6,3,-1,6,5,2,2,2,1,1,1,1,2,3,2,2,3,4,3,2,3,2,3,3,3,1,3,1,4,3,4,3,6,6,1,5,1,5,6,1,3,1,5,2,3,4,1,2,2,3,2,2,3,5,2,4,4,1,2,5,5,2,3,5,5,4,1,,4,,1,1,3,5,1,1,5,1,1,1,1,33,2,2,14,4,1,2,1,2,2,15,1,1,4,8,2,84,0,0,0,0,2,1,27
28,28,32,8/30/17 0:45,8/30/17 1:06,20,1.1329,2,I respect all religions. I belive in every religion there is a god.,NA,Chruch: catholic,NA,1,75,25,7,5,7,7,4,7,6,4,7,7,1,0,0,0,0,0,0,0,0,0,0,0,0,0,0,0,0,1,3,2,"In the wrong direction. The secretary of educatiom de vous, is not qualified for this job. School and colleges are in fear, more student debt accumulates. Our president?  Or a teenager ?",NA,10,100,24,3,29,15,4,20,3,2,6,6,4,6,6,6,1,1,1,1,2,1,1,1,4,2,3,4,4,1,2,3,2,3,3,4,3,4,3,3,5,1,4,4,5,5,2,1,6,6,3,5,3,4,3,3,5,3,2,2,3,2,1,1,2,3,2,2,2,2,6,4,2,1,5,5,2,1,,4,,2,2,2,4,1,1,7,1,1,8,1,54,4,3,12,4,4,2,1,1,3,8,1,1,3,5,2,59,0,0,0,0,1,4,28
29,29,33,8/30/17 0:46,9/10/17 14:46,16679,0.72,5,I believe there is a God,NA,Lutheran,NA,1,75,25,7,5,4,4,5,6,7,6,5,1,0,1,0,0,0,0,0,0,0,0,0,0,0,0,0,0,0,1,4,3,Wrong direction because we have the wrong leadership,NA,5,100,47,3,30,20,4,20,3,1,6,6,4,5,5,5,2,1,1,1,1,1,1,3,4,2,3,1,4,3,1,3,2,4,4,4,3,4,3,4,2,3,5,4,7,1,5,2,7,7,1,1,1,5,2,6,4,2,2,3,1,4,1,1,3,2,4,4,4,2,4,4,3,3,3,4,4,1,,4,,1,2,2,2,1,1,7,1,1,1,1,50,4,3,13,4,1,2,1,2,2,17,1,0,2,4,1,41,0,0,0,0,2,1,29
30,30,34,8/30/17 0:50,8/30/17 1:03,13,2.0797,5,They are real but we can't see God but they are always working there magic when they know they need help.,NA,None,NA,1,50,50,7,4,5,5,7,4,4,4,6,4,0,0,0,0,0,0,0,0,0,0,0,0,0,0,0,1,0,2,7,2,No explanation.,NA,10,20,24,6,30,30,3,90,2,5,5,4,4,5,3,5,4,3,4,1,4,4,4,2,2,4,4,4,2,1,4,4,3,2,2,2,1,1,1,3,1,7,5,5,7,4,5,4,4,3,5,6,6,5,7,5,6,6,6,4,2,6,2,4,4,3,3,3,5,4,4,5,5,5,4,4,3,1,,4,,1,2,2,2,1,2,7,3,5,1,1,26,2,1,12,4,3,2,1,2,2,18,1,1,1,2,1,22,0,0,0,0,2,1,30
31,31,35,8/30/17 0:51,8/30/17 1:16,25,1.012,5,"There is one true, loving God.",NA,Baptist,NA,1,70,30,7,7,6,3,7,7,7,7,6,5,0,1,0,0,0,0,0,0,0,0,0,0,0,0,0,0,0,2,4,1,"Wrong- people are self-centered, veering away from God.",NA,10,1,24,6,15,15,3,0,3,2,5,6,3,5,4,5,4,4,2,2,3,3,3,2,2,2,3,2,4,3,2,3,2,4,4,4,3,4,3,4,2,5,6,2,6,2,5,2,3,5,2,6,2,5,3,6,3,5,4,5,2,4,1,2,5,5,5,3,4,2,4,3,5,2,5,5,3,1,,4,,1,1,6,6,1,1,2,1,2,1,1,44,3,2,12,4,1,2,1,4,1,13,1,1,3,5,1,56,0,1,1,0,2,1,31
32,32,36,8/30/17 0:52,8/30/17 2:28,95,0.9936,5,"I believe there is a God. He created this earth, he has answered my many prayers. he works in mysterious ways.",NA,,-1,1,70,30,7,5,7,7,4,4,4,3,5,4,0,0,1,0,0,0,0,0,0,0,0,0,1,0,0,1,0,1,8,2,,-1,210,20,25,4,0,30,20,25,2,4,6,5,3,5,6,6,4,4,4,4,4,4,4,1,1,2,3,3,4,2,4,3,2,4,2,3,4,3,3,3,2,6,4,4,7,1,5,1,5,4,4,3,4,2,4,4,5,4,3,4,4,5,1,1,4,4,4,4,4,5,4,2,4,4,4,4,3,1,,4,,1,2,4,4,1,2,3,3,5,1,1,40,3,2,9,2,1,2,0,3,1,1,4,1,3,5,1,59,0,0,0,0,3,7,32
33,33,37,8/30/17 0:53,8/30/17 1:29,35,1.0548,5,I believe there is one God who created everything,NA,Catholic,NA,1,70,30,6,5,5,4,5,4,7,6,6,4,1,0,0,0,0,0,0,0,0,0,0,0,0,0,0,0,0,2,7,3,A bit in the wrong direction because there is such polarizing views on everything political,NA,5,5,47,3,29,15,4,0,3,6,6,5,5,5,5,5,1,2,1,2,2,1,1,2,3,2,4,2,2,3,2,3,2,3,1,3,2,3,3,4,1,7,7,2,4,3,5,3,2,5,1,4,2,6,3,6,2,4,4,4,1,4,1,1,3,4,4,4,3,5,4,3,4,3,4,4,3,1,,4,,1,1,4,5,1,1,3,1,2,1,1,58,5,3,9,2,1,2,1,3,1,13,1,1,2,3,1,34,0,0,0,0,3,7,33
34,34,38,8/30/17 0:55,8/30/17 2:45,109,0.5307,5,I believe that the dude upstairs has my back and looks out for me,NA,None,NA,1,80,20,6,5,2,5,6,7,6,4,7,4,0,0,0,0,0,0,0,0,0,0,0,0,1,0,0,0,0,1,8,6,Wrong idiots like trump make stupid choices that will impact this country in negative ways for many years to come,NA,10,5,24,3,1,30,3,10,2,5,6,3,5,3,2,3,4,4,1,1,1,4,1,2,4,2,2,1,4,2,3,2,2,2,1,3,1,3,2,1,4,6,5,5,6,1,6,3,4,5,5,5,5,3,6,1,6,2,2,2,1,6,4,5,6,4,6,4,2,3,3,3,5,5,5,5,2,2,,4,,1,2,1,3,1,1,5,1,1,1,1,24,1,1,9,2,5,1,0,3,1,7,5,1,4,9,2,91,0,0,0,0,3,6,34
35,35,39,8/30/17 1:00,8/30/17 1:34,33,0.7473,5,There one god,NA,christian,NA,1,70,30,6,6,6,6,4,6,6,6,6,5,0,0,0,0,0,0,0,0,0,0,1,0,0,0,0,0,0,1,6,1,,-1,10,5,24,6,1,0,4,0,3,5,6,6,5,5,6,5,3,3,2,2,2,2,2,2,3,3,3,2,3,3,2,3,2,2,1,2,1,3,2,2,4,4,4,3,5,3,5,3,3,4,4,4,6,4,5,5,5,5,3,4,3,4,2,2,4,4,4,5,3,4,4,4,3,3,4,4,4,1,,4,,1,1,4,4,1,1,3,1,3,1,1,53,4,3,9,2,1,2,1,5,1,7,1,1,4,8,1,82,0,0,0,0,5,1,35
36,36,40,8/30/17 1:01,8/30/17 1:15,13,0.923,5,I can't watch the sunrise in the morning without knowing that there is a God.,NA,Roman Catholic,NA,1,80,20,7,4,4,4,4,7,7,4,7,4,1,0,0,0,0,0,0,0,0,0,0,0,0,0,0,0,0,1,1,1,Neither,NA,10,100,24,3,-1,20,-1,20,3,3,3,3,3,5,3,3,3,2,1,1,1,1,1,1,1,1,3,1,3,2,2,2,2,4,2,3,2,3,2,3,1,4,6,1,4,4,3,3,4,5,2,2,4,2,3,3,4,4,3,4,1,2,1,1,5,2,4,5,5,3,4,4,3,2,5,3,2,1,,4,,2,1,6,6,1,1,1,1,2,1,1,56,5,3,13,4,1,2,1,2,1,17,1,0,3,7,1,74,0,0,0,0,2,1,36
37,37,41,8/30/17 1:09,8/30/17 1:19,10,1.2908,5,,-1,,-1,1,60,40,-1,4,4,-1,-1,-1,4,4,4,-1,0,1,0,0,0,0,0,0,0,0,0,0,0,0,0,0,0,2,4,-1,,-1,-1,-1,-1,-1,-1,-1,-1,-1,-1,-1,-1,-1,-1,-1,-1,-1,-1,-1,-1,-1,-1,-1,-1,-1,-1,-1,-1,-1,-1,-1,-1,-1,-1,-1,-1,-1,-1,-1,-1,-1,-1,-1,-1,-1,-1,-1,-1,-1,-1,-1,-1,-1,-1,-1,-1,-1,-1,-1,-1,-1,-1,-1,-1,-1,-1,-1,-1,-1,-1,-1,-1,-1,-1,-1,-1,-1,-1,-1,,-1,,-1,1,-1,-1,1,1,1,1,2,1,1,19,1,1,9,2,1,1,0,3,1,17,5,1,3,5,1,58,0,0,0,0,3,1,37
38,38,42,8/30/17 1:18,8/30/17 1:55,36,0.9535,5,"There is a God.  I believe there is one God, but every religion just has a different interpretation of Him.",NA,Catholic,NA,1,90,10,7,7,7,5,7,7,7,7,7,6,1,0,0,0,0,0,0,0,0,0,0,0,0,0,0,0,0,1,5,6,"I feel more people are turning towards religion.  I meet more young people that have a great belief in God.  They talk about their faith more than I did growing up.  Also, with the bad things happening in the world, I believe this is causing more people to acknowledge their faith publicly.",NA,5,5,47,3,29,20,4,20,3,6,6,5,3,5,3,4,4,2,3,2,2,2,2,2,3,2,3,1,4,3,3,3,2,3,1,3,2,2,1,3,1,6,5,2,6,2,6,2,3,6,1,6,4,6,5,2,4,7,6,6,2,1,1,2,5,6,6,4,5,6,4,3,2,2,6,6,2,1,,4,,1,2,4,4,1,1,3,1,2,1,1,50,4,3,10,3,1,2,1,1,1,13,5,0,2,4,1,42,0,0,0,0,1,1,38
39,39,43,8/30/17 1:21,8/30/17 1:59,38,1.2026,5,Yes.,NA,Non-denominational church,NA,1,75,25,7,7,7,7,7,7,7,7,7,3,0,1,0,0,0,0,0,0,0,0,0,0,0,0,0,0,0,2,7,3,"Wrong direction. People should be more accepting of all types of people, whatever their orientation, color, or race. It doesn't matter. Everyone is a person who feels things in the exact same way you do. Don't judge others because you never know what's going on in their life. Besides that, in terms of the country, money is not being used in the way that it should be. It should be used to better take care of the citizens in the country, rather than for nonsense that it is currently being used for.",NA,10,100,24,3,15,20,9,10,3,7,1,3,7,2,1,1,4,4,2,2,2,4,3,2,3,2,4,4,4,2,3,2,2,4,4,4,4,4,4,4,1,5,6,2,5,3,6,3,1,7,3,2,6,5,7,2,5,6,5,6,6,7,2,2,7,7,7,3,7,6,2,7,7,2,7,7,2,1,,4,,1,1,6,4,1,1,1,2,5,1,1,25,2,1,12,4,1,2,0,3,1,13,5,1,1,2,1,21,0,0,0,0,3,1,39
40,40,44,8/30/17 1:21,8/30/17 2:02,41,0.7395,5,I don't believe in a god or gods,NA,Atheist. Culturally Jewish,NA,2,85,15,1,1,1,1,1,1,1,1,1,1,0,0,0,0,1,0,0,0,0,0,0,0,0,1,0,0,0,2,7,7,I think it was going in the right direction but that is quickly getting turned around by Trump any GOP. They are destroying the environment and hurting race relations. They haven't been able to destroy the economy yet but they have only been in power for seven months. So the economy is doing fine right now. But if they don't raise the debt ceiling or the government gets shut down because of the wall the direction of the economy can change quickly,NA,5,5,47,3,29,15,4,10,3,5,6,5,2,2,4,5,4,3,2,1,2,3,1,2,2,3,2,3,4,3,3,3,2,2,1,2,2,1,2,1,3,4,4,5,5,2,5,2,3,5,4,4,4,3,6,2,5,3,3,2,1,4,3,5,3,3,4,4,3,3,6,5,3,4,3,5,4,2,,4,,1,1,2,2,1,1,7,1,1,1,1,59,5,3,14,4,1,1,1,2,1,21,1,1,1,2,1,22,0,0,0,0,2,1,40
