1241,399,1369,9/9/17 15:42,9/9/17 17:13,91,1.3992,5,"I whole heartedly believe in God. I don't fault others for their beliefs but, I will share my beliefs if they try and push theirs on me.",NA,Christianity,NA,1,80,20,7,6,6,6,7,7,7,7,7,3,0,0,0,0,0,0,0,0,0,0,1,0,0,0,0,0,0,2,2,1,"At this moment on this day I would say we are going in the wrong direction. The hate and cruelty seem to have risened during this presidential administration. Seeing everyone as equals and and as people should be our norm and it's not. I think it's a smaller pocket of people that act this way but, they are heard loudly. Everyday I'm disappointed in the things that comes out of some people mouths, in the news and social media. They won't change me. I still don't judge a book by its cover, no matter what you look like. I give everyone a chance until they prove to not be worth the the chance or my time. But I pray that there is enlightenment and hope on the horizon.",NA,10,-1,24,10,1,-1,6,10,2,3,7,6,2,7,7,7,2,2,-1,2,3,1,2,1,4,2,3,3,4,3,3,4,3,4,3,3,-1,2,2,3,4,2,3,6,7,2,6,2,6,7,2,1,3,6,2,3,4,4,2,4,2,4,3,3,4,2,5,5,5,2,4,3,2,4,4,5,2,1,,4,,1,1,3,5,1,1,7,1,1,1,1,55,5,3,9,2,2,2,1,4,1,18,1,1,3,5,1,54,0,0,0,0,4,7,1240
1242,400,1371,9/9/17 15:56,9/9/17 16:58,61,0.949,5,,-1,,-1,1,75,25,7,6,7,5,7,5,7,5,7,3,0,0,0,0,0,0,0,0,0,0,0,0,0,0,0,1,0,1,8,1,,-1,5,5,47,3,30,20,9,20,3,3,5,5,2,6,6,6,3,3,2,1,2,4,1,1,3,1,4,2,4,1,3,3,2,2,2,3,3,3,3,3,2,6,6,3,6,3,3,3,6,6,3,4,6,5,6,2,6,3,1,3,2,4,5,2,3,3,3,5,3,3,5,5,6,3,3,5,5,2,,4,,1,2,4,4,1,2,4,3,5,1,1,35,3,2,9,2,1,1,0,5,1,13,1,1,4,8,1,86,0,0,0,0,5,7,1241
1243,401,1372,9/9/17 15:58,9/9/17 16:07,9,0.722,5,,-1,None,NA,1,75,25,6,6,6,6,6,7,6,6,6,4,0,0,0,0,0,0,0,0,0,0,0,0,1,0,0,0,0,1,8,1,Wrong Way!,NA,-1,-1,-1,-1,-1,-1,12,10,2,4,4,4,4,5,4,5,2,2,1,1,1,2,1,1,1,1,2,3,4,3,1,3,1,-1,-1,-1,-1,-1,-1,-1,-1,-1,4,-1,-1,4,5,-1,-1,-1,-1,6,4,-1,4,-1,-1,4,4,4,4,7,5,-1,-1,-1,-1,-1,-1,-1,-1,-1,-1,-1,-1,-1,-1,2,,4,,1,1,6,6,2,4,4,3,5,1,1,49,4,3,9,2,1,1,1,1,1,11,1,1,1,2,3,23,0,0,0,0,1,7,1242
1244,402,1373,9/9/17 16:00,9/9/17 16:06,5,0.6686,5,i dont,NA,none,NA,1,50,50,-1,4,4,4,4,4,4,4,4,4,0,0,0,0,0,0,0,0,0,0,0,0,1,0,0,0,0,2,8,6,not sure,NA,-1,-1,-1,-1,-1,-1,2,20,3,4,4,4,4,4,4,4,3,3,3,3,3,3,3,3,3,3,3,3,3,3,3,3,2,1,1,1,1,1,1,1,4,4,4,4,4,4,4,2,4,4,4,4,4,4,4,4,4,4,4,4,4,4,4,4,4,4,4,4,4,4,4,4,4,4,4,4,4,2,,4,,1,1,4,4,1,3,5,3,5,1,1,64,5,4,9,2,1,1,1,2,1,9,1,1,3,5,1,51,0,0,0,0,2,5,1243
1245,403,1374,9/9/17 16:04,9/9/17 16:17,13,0.7498,5,,-1,,-1,1,80,20,7,-1,7,7,6,7,7,7,7,7,1,0,0,0,0,0,0,0,0,0,0,0,0,0,0,0,0,2,7,6,wrong direction. religious right support a president with poor morals.,NA,5,5,47,3,15,15,4,20,3,5,7,6,5,5,7,6,2,2,1,1,1,1,1,2,3,2,4,1,4,4,2,4,2,4,2,4,4,3,3,4,5,3,2,6,6,4,6,3,5,7,1,1,1,6,2,7,6,6,3,4,3,5,2,3,3,6,1,7,2,3,6,6,1,2,4,2,5,2,,4,,1,1,2,2,1,1,7,1,1,1,1,52,4,3,12,4,1,1,1,1,1,19,1,1,3,5,1,59,0,0,0,0,1,1,1244
1246,404,1375,9/9/17 16:12,9/9/17 16:30,18,1.5158,2,to me their is only one god and when he is ready he will show up and clean this earth,NA,none,NA,1,60,40,7,6,7,7,1,3,1,1,7,5,0,0,0,0,0,0,0,0,0,0,0,0,1,0,0,0,0,2,7,6,,-1,10,100,24,6,30,-1,3,10,1,2,6,6,3,7,3,7,4,4,1,1,1,3,1,1,2,1,2,1,4,1,3,2,2,3,2,3,1,1,3,3,4,6,5,5,5,4,5,2,2,3,1,1,7,3,6,7,4,1,2,4,3,5,5,3,4,3,1,4,3,1,3,4,3,4,4,5,4,1,,4,,1,2,3,3,1,1,7,1,1,3,1,31,2,2,9,2,4,2,1,5,2,9,1,1,1,2,2,23,0,0,1,2,2,7,1245
1247,405,1376,9/9/17 16:13,9/9/17 16:31,18,0.7497,5,,-1,,-1,1,75,25,4,3,4,4,5,4,6,4,6,4,1,0,0,0,0,0,0,0,0,0,0,0,0,0,0,0,0,1,5,6,,-1,10,50,24,6,30,20,18,10,1,3,5,3,5,5,3,5,2,2,1,2,2,2,1,2,3,3,3,2,3,3,2,3,2,2,2,2,2,2,2,2,4,6,5,4,5,5,5,5,5,6,3,6,6,4,5,4,5,5,6,4,5,5,3,5,5,5,5,4,2,5,5,3,6,5,5,5,5,2,,4,,1,1,3,5,1,1,7,1,2,1,1,76,7,4,9,2,1,1,1,2,1,14,1,1,2,3,1,31,0,0,0,0,2,5,1246
1248,406,1377,9/9/17 16:17,9/9/17 17:13,56,0.9469,5,I believe there is a God,NA,Non practicing Catholic,NA,1,60,40,7,6,5,6,5,4,6,6,7,6,1,0,0,0,0,0,0,0,0,0,1,0,1,0,0,0,0,2,8,1,"Wrong, more people don't believe in God like they used to and are taking God out of everything and sinning more than ever",NA,10,100,24,3,15,20,9,10,2,2,6,6,7,5,4,6,4,4,4,4,4,4,4,3,2,2,4,3,4,2,4,3,2,2,1,2,1,3,1,4,6,1,2,6,6,3,6,2,5,5,4,3,6,2,5,3,5,4,2,4,2,6,6,5,4,3,5,4,4,3,4,4,4,4,4,5,4,2,,4,,1,1,6,6,1,1,1,2,5,1,1,36,3,2,8,1,1,1,1,4,3,9,1,1,3,5,2,59,0,0,2,0,2,1,1247
1249,407,1378,9/9/17 16:28,9/9/17 16:49,20,0.7445,5,I believe in a higher power  just not convinced its in the form of what most Christians believe. Would like to go for the life after ...kind of hard to believe.,NA,I was born a Roman Catholic...have not practiced since my early teens. More of an agnostic.,NA,2,60,40,3,5,4,5,4,5,4,4,4,4,0,0,0,0,0,0,0,0,0,0,0,0,0,0,1,0,0,2,8,6,"Although I am not a religious person..I think that religion in many ways has hurt our country...it has caused rifts and division amongst people.
Too many so called Christians believe that they are the only truly enlightened ones that have earned a place in heaven, while everyone else is wrong. There seems to be less tolerance than there once was. I thinks Buddhista are the best.",NA,10,20,24,3,15,60,9,30,2,5,5,4,5,6,5,3,3,3,4,2,1,2,1,1,3,1,4,2,3,2,3,3,2,2,2,2,2,3,2,2,5,2,5,5,5,5,5,2,5,7,2,2,5,3,5,3,4,3,3,3,3,4,2,3,4,3,4,4,3,3,4,4,3,3,4,5,4,2,,4,,2,1,4,5,1,1,3,1,2,1,1,62,5,4,11,3,1,1,1,4,1,16,1,1,1,2,1,21,0,0,0,1,3,6,1248
1250,408,1379,9/9/17 16:47,9/9/17 17:26,39,0.7836,5,"I firmly believe in God; Father, Son, and Holy Spirit.",NA,Catholic,NA,1,65,35,7,7,7,7,7,7,7,7,7,3,1,0,0,0,0,0,0,0,0,0,0,0,0,0,0,0,0,1,1,3,Wrong direction.  The more Government tries taking God out of everything this country was built upon the worse the young children grow up to be.  We need God in all aspects of our lives in order to be the best person each of us can become.,NA,5,5,47,3,29,15,4,20,3,4,6,6,2,6,6,6,3,2,2,1,2,1,1,1,4,2,3,2,4,3,3,3,2,4,3,3,3,3,3,3,2,3,4,6,6,1,5,2,6,5,2,5,3,5,3,3,5,3,2,3,2,3,2,2,4,2,4,4,3,3,5,5,3,4,4,2,4,2,,4,,2,1,3,5,1,1,2,1,2,1,1,54,4,3,12,4,1,1,1,3,1,12,1,1,2,4,1,46,0,0,0,0,3,1,1249
1251,409,1380,9/9/17 17:06,9/9/17 17:33,26,0.7497,5,,-1,,-1,1,75,25,6,4,5,5,5,5,6,4,5,5,0,1,0,0,0,0,0,0,0,0,0,0,0,0,0,0,0,1,8,6,,-1,10,100,24,3,30,15,3,30,2,4,6,5,5,6,4,6,2,2,1,2,2,1,2,2,3,3,3,3,4,3,2,3,2,1,1,1,1,3,1,4,4,4,4,5,5,4,5,4,3,4,2,4,2,6,3,5,4,4,3,4,4,4,2,4,4,4,4,4,4,4,4,4,4,4,4,5,4,2,,4,,1,2,6,6,1,1,3,1,2,1,1,72,6,4,9,2,1,1,1,2,1,14,1,1,2,4,1,42,0,0,0,0,2,5,1250
1252,410,1381,9/9/17 17:16,9/9/17 17:27,11,0.9744,5,"I think ""GOD"" was put into place t create order in society. I believe that God doesn't exist",NA,None,NA,2,75,25,1,1,1,1,1,1,1,1,1,1,0,0,0,0,0,0,0,0,0,0,0,0,0,1,0,0,0,2,8,7,Wrong direction. This country was founded on the belief of equality for all and a separation of church and government. We are trying o combine those 2 and it is doing nothing but harm,NA,10,100,1,3,30,20,3,10,2,3,3,3,3,3,3,3,1,2,2,1,2,2,2,2,2,2,2,2,2,2,2,2,1,2,2,2,2,2,2,2,4,4,4,4,4,4,4,4,4,4,4,4,4,4,4,4,-1,4,4,4,4,4,4,4,4,4,4,4,4,4,4,4,4,4,4,4,4,2,,4,,2,1,5,5,1,1,1,1,2,1,1,36,3,2,9,2,1,1,1,5,1,14,1,1,3,5,2,57,0,0,0,1,4,1,1251
1253,411,1382,9/9/17 17:18,9/9/17 17:42,24,1.1289,5,I'm not really sure...I believe there may be something there,NA,none,NA,1,50,50,6,6,6,6,6,6,6,6,6,6,0,0,0,0,0,0,0,0,0,0,0,0,1,0,0,0,0,2,8,5,I think now its going in the right direction with someone who treats the country as a business like it should be,NA,10,100,24,6,30,20,9,10,2,5,6,5,4,6,5,5,4,3,2,2,2,3,1,2,3,2,3,2,2,3,3,2,2,3,1,3,1,3,2,2,2,6,6,2,5,3,4,4,5,6,5,5,5,1,5,5,5,4,2,4,2,3,2,3,4,3,4,4,5,4,4,4,4,4,2,5,4,1,,4,,1,2,4,4,1,1,4,2,5,1,1,28,2,1,7,1,1,2,1,4,1,11,3,0,2,4,2,43,0,1,1,0,2,4,1252
1254,412,1384,9/9/17 17:25,9/9/17 17:38,12,0.5243,5,There is a God,NA,Baptist,NA,1,75,25,7,7,7,7,1,7,7,7,7,7,0,1,0,0,0,0,0,0,0,0,0,0,0,0,0,0,0,2,2,1,Wrong,NA,10,25,24,3,30,3,1,20,2,5,5,6,7,5,2,2,4,4,4,4,4,4,4,1,2,2,3,4,4,1,4,2,3,3,3,3,3,3,3,3,4,-1,5,5,6,5,6,4,5,5,5,3,4,3,6,6,5,3,4,6,5,6,3,5,5,4,4,3,5,4,3,4,2,3,5,5,2,1,,4,,1,2,5,4,1,1,7,1,1,1,1,31,2,2,11,3,5,2,1,4,1,10,5,1,2,4,2,47,0,0,1,1,2,1,1253
1255,413,1385,9/9/17 17:37,9/9/17 18:05,28,0.9512,5,I believe there is a god.,NA,Christian,NA,1,60,40,7,7,6,6,6,7,7,6,7,7,0,1,0,0,0,0,0,0,0,0,0,0,0,0,0,0,0,1,5,3,"Wrong direction...this country, our government, our traditions are all based in one way or another around god and/or Jesus.",NA,10,5,47,3,30,20,4,20,2,5,6,6,6,6,6,6,3,2,2,2,1,2,1,1,2,1,3,3,3,3,3,3,2,4,3,4,2,4,3,3,4,5,6,5,6,3,5,5,3,6,2,2,2,5,3,5,7,2,1,4,1,2,1,1,4,2,4,5,4,4,5,5,4,2,4,5,5,2,,4,,2,1,6,7,1,1,3,1,2,1,1,48,4,3,11,3,1,1,1,6,1,15,1,0,3,5,1,55,0,2,0,0,4,1,1254
1256,414,1386,9/9/17 17:38,9/9/17 18:10,31,0.8496,5,Do not believe in the existence of a god or gods.,NA,Unitarian Universalist,NA,2,85,15,1,1,1,1,1,3,1,1,5,2,0,0,0,0,0,0,0,0,0,1,0,0,0,0,0,0,0,2,5,7,"The country is divided between people who seem to only care about themselves and those who are like them, and people who want equal treatment for all",NA,5,1,24,3,30,15,3,20,3,3,7,6,3,6,6,6,1,2,1,1,1,1,1,2,3,3,3,1,4,3,1,3,2,3,3,3,1,3,1,3,2,2,2,3,6,2,2,1,5,6,2,2,2,6,2,5,3,3,3,3,2,2,2,1,2,2,2,4,2,3,6,6,3,4,3,3,5,1,,4,,1,2,2,2,1,1,7,1,1,1,1,51,4,3,12,4,1,2,1,5,1,21,1,1,1,2,1,23,0,0,0,1,4,7,1255
1257,415,1387,9/9/17 17:45,9/13/17 17:58,5772,1.4591,5,I believe there is a god and creator who is our eternal father.,NA,The Church of Jesus Christ of Latter Day Saints,NA,1,30,70,7,7,6,6,7,7,6,6,5,7,0,0,0,1,0,0,0,0,0,0,0,0,0,0,0,0,0,1,2,2,"Wrong direction. Too many people are are selfish, hateful, and vain",NA,10,100,24,3,30,20,4,20,2,4,6,5,3,6,5,5,2,1,1,2,2,1,2,2,4,3,3,2,4,3,2,3,2,3,2,3,3,3,3,4,3,5,4,2,5,3,4,4,6,6,2,5,3,4,5,4,4,3,3,4,3,4,4,5,3,3,4,4,3,3,4,4,-1,4,4,5,3,2,,4,,1,1,4,5,1,1,3,1,3,1,1,28,2,1,10,3,1,1,1,3,1,13,1,1,3,5,2,54,1,0,0,0,2,1,1256
1258,416,1389,9/9/17 17:50,9/9/17 19:03,72,0.905,5,"I was brought up Lutheran.Attended regularly until about age 15.Now much older and have witnessed lots of corruption in the religious field, I'm at that neutral area.I work off of my morals that I learned from my parents and also the church did give my a good foundation to start live.
Churches and ""other"" organizations have turned into businesses.Generating millions of tax free dollars and not for the better.
They form a religious tax front and get larger and larger.Turning into social elite gatherings for the wrong reasons.
Look what has become of Christmas, a commercial holiday!
Long story short,I'm a hands on,scientific type person and from the ""show-me"" state of Missouri.
At the age of 15, my dad died of cancer.I prayed for anything and promised lots if ""He"" would spare him. 
My Dad was 37 years old.My faith dropped overnight.
I do believe in somethings, more of what my parents taught me than anything else.
As long as it's a good ""deal"" for you, others, and your surroundings.....it's a win- win situation.",NA,Lutheran or baptist,NA,1,60,40,4,4,4,4,4,4,4,4,4,4,0,1,0,0,0,0,0,0,0,0,0,0,0,0,0,0,0,2,6,6,It is now....it's going to be a very difficult job to overcome what Obama destroyed.,NA,5,5,47,3,30,20,4,20,3,4,6,6,3,6,6,6,2,1,1,2,2,2,2,2,4,2,3,2,3,3,1,3,2,3,2,3,3,4,3,1,3,3,4,4,6,3,6,3,6,7,2,1,3,6,4,5,5,4,7,3,3,4,4,4,4,4,4,4,3,3,4,5,4,3,4,5,4,2,,4,,1,1,5,5,1,1,2,1,2,1,1,56,5,3,9,2,1,1,1,4,1,18,1,1,2,4,1,43,0,0,0,2,2,1,1257
1259,417,1390,9/9/17 17:55,9/9/17 18:12,16,1.5209,5,I believe there is only one God,NA,Baptist,NA,1,40,60,7,7,7,7,7,7,7,7,7,5,0,1,0,0,0,0,0,0,0,0,0,0,0,0,0,0,0,2,2,1,Wrong. People would rather be evil than good,NA,10,100,47,3,29,15,4,0,3,7,1,1,7,4,2,1,3,4,3,2,2,1,1,1,1,1,1,3,3,1,2,1,2,4,3,3,3,4,3,4,1,7,6,5,5,2,4,5,7,7,1,1,5,1,5,3,6,7,4,7,1,1,1,1,4,5,5,7,3,7,5,4,7,1,3,7,5,2,,4,,2,2,7,7,1,1,1,1,2,1,1,28,2,1,11,3,1,1,1,3,1,14,1,0,3,6,1,61,1,0,0,0,2,1,1258
1260,418,1391,9/9/17 17:56,9/9/17 19:44,108,0.8615,5,Not sure,NA,Judaism,NA,2,75,25,2,2,2,2,3,3,2,2,4,2,0,0,0,0,1,0,0,0,0,0,0,0,0,0,0,0,0,1,7,7,,-1,10,5,-1,3,30,15,4,20,3,2,5,6,5,5,3,5,3,2,2,2,2,2,2,1,2,1,2,2,3,1,3,3,2,2,1,2,2,1,2,1,3,3,3,4,7,1,7,1,5,6,2,2,3,3,3,4,4,1,2,1,3,5,5,3,4,3,4,4,2,2,5,5,3,4,4,4,4,1,,4,,1,2,3,4,1,1,5,2,5,1,1,45,4,3,14,4,1,2,1,4,1,21,1,1,3,5,1,52,0,0,2,0,2,2,1259
1261,419,1392,9/9/17 18:00,9/9/17 18:56,55,1.5393,3,que solo hay uno,NA,catolico,NA,1,90,10,6,5,6,5,6,5,4,4,5,5,1,0,0,0,0,0,0,0,0,0,0,0,0,0,0,0,0,2,7,3,incorrecta,NA,1,100,24,3,15,20,9,0,3,5,5,5,5,5,5,5,4,4,4,2,2,3,2,2,2,2,2,2,3,3,2,2,2,2,1,2,1,1,1,2,3,6,5,3,5,4,5,3,5,4,3,5,3,5,3,5,4,5,3,5,4,4,4,4,5,4,4,4,-1,5,4,3,5,4,4,5,4,1,,4,,1,2,4,4,2,4,7,3,5,2,2,43,3,2,9,2,4,2,1,5,1,8,6,1,4,9,2,93,0,0,1,1,3,7,1260
1262,420,1393,9/9/17 18:01,9/10/17 23:14,1753,0.7962,5,I BELIEVE we were created by a superior being who has a purpose for us.,NA,Christian NON Denominational,NA,1,51,49,6,6,6,6,4,6,6,4,5,5,0,0,0,0,0,0,0,0,0,0,1,0,0,0,0,0,0,1,2,1,Trump and God can put this country in the right direction. All opposing Trump are going in the wrong direction. Allowing Mosque and mosque going Muslims into this country IS going in the wrong direction. Liberals are going in the wrong direction. The list goes on and on.,NA,0,100,47,3,15,20,3,20,3,6,6,6,6,6,6,6,2,2,2,2,3,1,3,2,3,2,3,2,2,2,4,3,2,2,2,3,2,4,2,4,3,4,5,6,5,5,5,2,5,5,3,2,3,6,2,5,5,4,3,4,3,4,5,7,4,3,3,4,5,3,3,2,3,4,5,6,3,2,,4,,1,2,6,6,1,1,2,1,2,1,1,54,4,3,9,2,1,1,1,4,1,16,1,1,1,2,1,21,0,0,0,0,4,1,1261
1263,421,1394,9/9/17 18:08,9/9/17 18:48,39,1.8036,5,I believe god is real,NA,I'm a Christian,NA,1,100,0,7,5,4,4,4,4,7,7,4,5,0,0,0,0,0,0,0,0,0,0,0,0,1,0,0,0,0,1,8,1,Wrong direction because we as the people are not free the government in the laws control the world,NA,10,60,28,12,15,0,6,90,1,5,5,6,5,6,4,7,4,3,1,2,4,4,2,3,2,1,4,2,4,3,4,3,2,1,2,1,1,1,2,2,5,6,5,4,4,4,7,5,4,4,5,5,7,4,5,5,4,5,4,5,4,7,5,4,4,4,4,4,4,5,4,4,5,5,5,5,4,2,,4,,1,2,4,4,1,1,7,2,5,1,1,28,2,1,7,1,2,1,0,2,3,1,1,1,2,3,2,31,0,0,0,0,2,6,1262
1264,422,1395,9/9/17 18:19,9/9/17 18:44,24,0.5574,5,"There is a god and he needed my daugters help
God love her",NA,Methodist,NA,1,50,50,6,6,7,6,4,5,6,6,6,6,0,1,0,0,0,0,0,0,0,0,0,0,0,0,0,0,0,1,3,3,??,NA,10,100,24,3,15,20,9,10,3,3,6,4,6,5,5,5,2,2,1,2,2,1,1,2,3,3,-1,3,2,4,2,4,2,-1,-1,-1,-1,-1,-1,-1,4,5,4,5,4,4,4,4,5,4,4,2,3,4,4,3,5,4,3,4,4,4,3,4,4,4,4,4,4,4,4,4,4,4,4,4,4,2,,4,,1,1,4,3,1,1,6,1,2,1,1,62,5,4,11,3,1,1,1,2,1,15,1,0,1,2,1,21,0,0,0,0,2,1,1263
1265,423,1396,9/9/17 18:49,9/9/17 18:59,9,1.6085,2,They dont exist,NA,None,NA,2,70,30,1,1,1,2,4,5,3,1,2,1,0,0,0,0,0,0,0,0,0,0,0,0,0,0,1,0,0,2,8,7,Wrong because of trump,NA,10,5,47,3,30,15,4,0,2,5,5,4,3,5,4,5,2,2,2,2,2,2,2,3,4,3,2,2,4,3,3,4,2,1,1,1,1,1,1,1,4,5,5,4,5,4,5,3,4,5,4,2,3,4,5,-1,3,3,4,4,3,3,4,4,4,3,5,4,3,4,5,4,3,3,5,4,4,2,,4,,1,2,2,2,1,2,6,3,5,2,1,28,2,1,9,2,4,1,0,4,1,9,5,1,4,9,1,93,0,0,0,0,4,1,1264
1266,424,1397,9/9/17 18:51,9/9/17 19:38,46,0.722,5,i need more proof,NA,catholic,NA,1,75,25,6,4,6,5,4,6,4,4,4,5,1,0,0,0,0,0,0,0,0,0,0,0,0,0,0,0,0,1,5,7,"wrong direction, people don't have passion anymore, about anything",NA,10,100,24,3,15,0,3,20,2,7,5,4,7,7,5,5,2,2,1,1,1,2,1,3,4,3,4,1,4,3,1,3,2,-1,-1,-1,-1,-1,-1,-1,3,4,5,4,5,7,5,4,5,5,1,1,4,5,3,2,5,4,3,4,1,4,1,3,4,3,4,4,3,4,4,4,4,5,4,5,4,2,,4,,1,2,2,3,1,1,7,1,1,1,1,58,5,3,9,2,1,1,1,2,1,9,6,1,1,1,2,14,0,0,0,0,2,1,1265
1267,425,1399,9/9/17 19:05,9/9/17 19:11,5,0.9911,5,,-1,,-1,-1,70,30,-1,-1,-1,-1,-1,-1,-1,-1,-1,2,0,0,0,0,0,0,0,0,0,0,0,0,0,0,0,0,1,1,-1,-1,,-1,-1,-1,-1,3,-1,-1,-1,-1,-1,-1,-1,-1,-1,-1,-1,-1,-1,-1,-1,-1,-1,-1,-1,-1,-1,-1,-1,-1,-1,-1,-1,-1,2,1,-1,-1,1,-1,-1,-1,3,-1,5,-1,-1,-1,-1,-1,6,5,-1,3,3,-1,-1,-1,-1,-1,-1,6,-1,-1,-1,-1,-1,-1,-1,-1,-1,-1,-1,-1,-1,-1,-1,-1,-1,2,,4,,1,1,6,6,1,1,2,1,2,1,1,42,3,2,9,2,1,1,1,5,1,13,1,0,2,3,1,35,0,0,0,1,4,1,1266
1268,426,1400,9/9/17 19:11,9/9/17 19:24,13,1.6128,2,,-1,Testigos de Jehova,NA,1,50,50,7,7,7,7,1,7,1,1,1,1,0,0,1,0,0,0,0,0,0,0,0,0,0,0,0,0,0,1,1,1,Incorrecta,NA,10,500,7,6,15,15,18,20,2,5,5,6,1,7,5,5,2,4,4,2,4,3,4,3,3,1,4,4,4,2,4,2,3,4,4,4,4,4,3,4,2,6,4,5,4,1,6,2,5,5,5,4,5,4,5,3,4,4,4,4,2,3,2,1,4,3,4,4,4,4,-1,4,4,4,4,4,4,1,,4,,1,1,6,6,1,2,3,3,5,2,2,19,1,1,9,2,4,2,0,2,2,10,5,1,4,9,2,93,0,0,0,0,2,1,1267
1269,427,1402,9/9/17 19:13,9/9/17 19:38,24,1.4493,5,I believe in Jesus Christ as my Lord and savor. He is the one true God.,NA,i am a non-denominational christian  I go to church each and every week and serve.,NA,1,50,50,7,7,7,5,4,7,7,7,7,7,0,0,0,0,0,0,0,0,0,0,1,0,0,0,0,0,0,2,1,1,"the people around me the right direction, the country I pray for its hard to ""JUDGE"" GOD HELP US! ALL WE NEED IS LOVE! BUT this country needs to help one another grow in love peace and happiness its very simple and politics is prejudices and its not about THAT what happen to that paper they made in Philadelphia the Constitution!!!!!!! I rest my case Amen Again Love Does Amen GOD HELP US!",NA,-1,-1,-1,-1,15,-1,-1,-1,-1,-1,-1,-1,-1,-1,-1,-1,3,1,2,1,2,2,1,1,1,1,4,4,1,4,3,4,2,3,3,3,3,3,3,2,2,2,3,4,7,1,7,2,4,3,1,7,1,7,2,7,3,6,3,6,3,6,6,6,3,2,2,3,2,3,3,2,2,3,2,3,3,1,,4,,1,2,4,4,1,1,7,1,1,1,1,43,3,2,9,2,2,2,1,5,2,15,1,1,1,2,1,23,0,0,0,1,4,1,1268
1270,428,1403,9/9/17 19:14,9/9/17 19:27,12,0.9051,5,,-1,Je wish,NA,2,76,24,1,1,4,5,4,6,1,1,4,-1,0,0,0,0,1,0,0,0,0,0,0,0,0,0,0,0,0,2,4,-1,Evangelicalism has eroded separation of church and state,NA,10,-1,-1,-1,-1,-1,-1,20,2,3,6,5,4,3,4,4,4,4,4,2,4,4,4,1,1,2,2,2,4,2,2,3,3,4,4,3,-1,4,-1,4,1,4,4,6,7,1,7,7,3,5,-1,2,4,2,6,4,4,2,2,1,1,-1,1,1,4,2,4,4,2,2,3,6,2,4,4,4,4,1,,-1,,1,1,1,2,1,1,7,1,1,1,1,59,5,3,10,3,1,2,1,2,3,4,3,1,2,4,2,47,0,0,0,0,2,2,1269
1271,429,1404,9/9/17 19:23,9/9/17 19:48,24,1.0038,5,show me scientific proof.,NA,none.,NA,2,85,15,2,1,1,1,2,2,1,1,1,1,0,0,0,0,0,0,0,0,0,0,0,0,1,0,0,0,0,2,8,7,"Wrong direction. The main stream media is pushing their beliefs and opinions as fact and have broken away from following a clear set of ethics and rules in regards to being fair and unbiased. Groups like Black Lives Matter and Antifa have been given a free pass, by the main stream media as well as politicians, to commit violence, suppress free speech, promote racism  and hatred towards white people, especially straight white men.",NA,5,5,47,3,29,15,4,20,2,2,7,7,2,7,7,6,3,2,3,2,2,2,1,2,3,2,2,2,3,2,3,3,2,1,1,1,1,1,1,1,4,4,4,4,6,2,5,2,6,6,2,2,2,4,2,6,2,2,2,2,2,2,2,2,4,2,3,3,2,2,5,5,2,4,4,2,5,2,,4,,1,2,5,5,1,1,3,1,2,1,1,41,3,2,9,2,1,1,1,6,1,15,1,1,2,3,1,34,0,0,1,3,2,1,1270
1272,430,1405,9/9/17 19:50,9/9/17 20:33,43,0.8968,1,There is no god.,NA,atheist,NA,2,50,50,1,1,1,1,1,1,1,1,1,1,0,0,0,0,0,0,0,0,0,0,0,0,1,1,0,0,0,1,8,7,I think it is heading in the wrong direction.  To many people ignore the true.  Twain: “It ain’t what you don’t know that gets you into trouble. It’s what you know for sure that just ain’t so.”,NA,10,20,47,3,15,20,2,10,3,3,5,6,1,7,5,5,2,1,2,2,2,2,3,1,2,2,4,2,3,2,4,3,2,2,1,3,2,1,2,2,2,4,4,5,3,4,5,3,3,4,2,5,4,3,2,2,6,2,2,2,2,4,2,4,2,2,4,4,2,2,5,7,2,4,2,2,4,2,,4,,2,1,1,7,1,1,5,1,1,4,1,54,4,3,12,4,4,1,1,6,1,18,1,1,3,6,1,63,0,0,3,0,3,1,1271
1273,431,1406,9/9/17 19:53,9/9/17 20:15,22,0.9167,5,I believe there is a god,NA,Lutheran,NA,1,90,10,5,4,5,3,2,5,5,4,5,3,0,1,0,0,0,0,0,0,0,0,0,0,0,0,0,0,0,2,8,6,stable but not going in any direction,NA,10,100,24,3,15,10,3,30,2,2,7,5,4,7,6,6,3,2,2,2,1,1,1,2,3,1,3,1,3,2,3,2,2,2,1,1,1,1,1,1,2,4,4,2,6,3,4,3,5,6,2,2,2,6,2,6,2,3,3,4,1,3,2,3,3,3,4,4,3,4,6,4,4,3,3,5,4,1,,4,,2,2,4,4,1,1,2,1,2,1,1,42,3,2,12,4,1,2,1,2,1,16,1,1,3,5,1,59,0,0,0,0,2,1,1272
1274,432,1408,9/9/17 20:00,9/9/17 20:26,26,1.8698,3,De 1,NA,Catolico,NA,1,80,20,5,4,5,4,4,5,5,5,5,5,1,0,0,0,0,0,0,0,0,0,0,0,0,0,0,0,0,2,5,6,"Incorrecta, no estoy muy de acuerdo con las decisiones del Presidente",NA,10,100,24,3,15,20,-1,20,3,4,5,4,5,5,4,4,2,2,2,2,2,2,2,1,3,2,2,2,2,2,2,3,2,2,1,3,1,4,2,4,1,1,5,6,2,2,6,2,6,7,1,1,7,6,2,7,1,6,3,5,1,6,1,1,4,4,4,4,4,4,4,4,4,2,4,3,2,1,,4,,1,2,4,4,2,4,6,3,5,2,2,34,2,2,7,1,4,2,1,5,4,8,1,1,3,7,2,74,1,0,1,1,2,7,1273
1275,433,1409,9/9/17 20:04,9/9/17 20:38,33,0.7722,5,"I do not believe in the existence of a god, or gods, outside the human mind.",NA,Atheist,NA,2,97,3,1,1,1,1,1,1,1,1,-1,1,0,0,0,0,0,0,0,0,0,0,0,0,1,1,0,0,0,2,8,7,The country is going in the only direction possible.,NA,5,5,47,3,31,15,4,30,3,6,7,7,1,7,7,7,4,4,2,1,1,2,1,1,3,2,1,2,4,2,2,3,2,2,1,1,2,1,1,1,2,5,5,5,6,1,4,1,2,6,4,5,5,4,6,2,5,4,2,2,1,1,1,1,2,2,2,4,2,2,6,5,2,6,2,5,6,2,,4,,1,1,1,5,1,1,5,1,3,1,1,57,5,3,10,3,1,1,1,1,3,11,3,1,2,4,2,43,0,0,0,0,1,1,1274
1276,434,1411,9/9/17 20:06,9/9/17 20:38,32,0.7833,5,I believe,NA,Protestant,NA,1,75,25,6,6,6,5,6,6,6,6,6,6,0,1,0,0,0,0,0,0,0,0,0,0,0,0,0,0,0,2,5,5,Wrong,NA,10,5,47,3,30,20,5,0,3,3,6,5,3,6,5,5,2,2,1,2,2,2,2,2,3,3,3,2,3,3,3,3,2,2,2,2,2,3,2,3,4,5,4,5,5,5,5,3,5,5,3,3,3,5,3,6,5,3,3,5,3,4,5,5,3,3,4,4,3,3,4,5,4,3,4,3,4,2,,4,,1,2,3,3,1,1,7,1,1,1,1,58,5,3,10,3,1,1,1,3,1,18,1,1,4,9,1,91,0,0,0,0,3,1,1275
1277,435,1412,9/9/17 20:07,9/11/17 1:10,1742,0.6251,5,There is one God.,NA,Non denominational.,NA,1,80,20,7,7,7,7,7,7,7,7,7,1,0,0,0,0,0,0,0,0,0,0,0,0,0,0,0,0,1,1,2,1,Wrong.  Lack of interest in Good and serving selves.,NA,10,20,47,3,31,20,3,10,-1,7,5,4,4,5,5,3,3,2,1,2,2,2,3,2,3,3,3,2,3,4,3,4,2,4,4,4,4,4,3,4,1,5,5,6,6,2,5,3,5,5,3,5,5,4,5,5,3,5,4,5,2,2,1,1,-1,-1,6,2,3,5,3,-1,5,2,-1,-1,-1,1,,4,,1,2,6,4,1,1,5,1,2,1,1,55,5,3,13,4,1,2,1,2,1,11,1,1,4,9,1,91,0,0,0,0,2,2,1276
1278,436,1413,9/9/17 20:15,9/9/17 20:29,13,1.1379,5,I believe there is only one God,NA,Pentecostal,NA,1,80,20,7,7,7,7,6,7,7,7,7,6,0,1,0,0,0,0,0,0,0,0,0,0,0,0,0,0,0,2,2,1,The wrong direction,NA,10,100,24,3,30,20,6,0,3,3,6,6,3,6,6,6,2,1,2,2,3,1,3,2,4,4,4,3,3,4,2,4,2,3,1,4,2,3,4,4,2,5,5,5,7,2,5,3,5,6,3,3,3,3,5,3,3,3,6,3,3,2,5,3,4,4,4,6,5,5,4,4,6,3,5,6,4,1,,4,,1,1,7,7,1,1,1,1,2,1,1,26,2,1,12,4,1,2,0,7,1,17,5,1,2,3,1,34,0,0,0,0,7,1,1277
1279,437,1414,9/9/17 20:15,9/9/17 21:32,76,1.8219,3,Solo hay un solo Dios los demás se los inventan según a su conveniencia.Eso creo yo,NA,Soy catolico,NA,1,60,40,7,7,7,7,5,-1,7,7,7,2,1,0,0,0,0,0,0,0,0,0,0,0,0,0,0,0,0,2,2,3,"Muy incorrecta no estoy de acuerdo con los homosexuales y no es que los discrimine pero Dios dijo que una familia la forma hombre y mujer ,o que pensaran los homosexuales solo adoptar eso no es correcto un bebé debe crecer en una familia de un hombre y una mujer.",NA,10,100,24,615,15,20,12,10,2,2,7,7,4,7,6,7,3,2,3,3,2,2,4,2,3,2,4,2,2,1,4,2,2,3,3,4,2,4,4,4,2,5,4,3,5,3,6,1,5,4,1,5,5,2,5,4,4,3,1,3,3,4,2,3,4,3,4,4,4,3,4,4,3,4,4,3,4,2,,4,,1,1,7,7,2,4,3,3,5,8,2,39,3,2,4,1,4,1,1,4,1,13,1,1,4,9,1,93,0,0,1,1,2,1,1278
1280,438,1415,9/9/17 20:27,9/9/17 20:50,23,0.9126,5,no,NA,none,NA,2,80,20,2,4,5,5,4,5,4,4,6,1,0,0,0,0,0,0,0,0,0,0,0,0,1,0,0,0,0,1,8,7,right,NA,10,5,24,3,1,20,9,10,3,2,6,5,2,6,5,4,2,1,1,1,1,1,1,2,3,3,4,4,4,3,2,3,2,1,1,1,1,1,1,1,1,6,7,2,6,4,6,4,2,7,2,1,1,7,1,6,6,2,1,4,1,4,1,1,4,2,4,4,4,2,4,6,4,3,2,2,4,2,,4,,1,2,4,4,1,1,6,2,5,1,1,59,5,3,10,3,1,1,1,2,2,13,1,1,3,5,1,59,0,0,0,0,2,1,1279
1281,439,1416,9/9/17 20:44,9/10/17 5:05,500,0.7411,5,He knows all & sees all.,NA,Protestant,NA,1,80,20,7,5,6,5,6,7,6,5,7,5,0,1,0,0,0,0,0,0,0,0,0,0,0,0,0,0,0,1,8,3,Wrong direction. Too much anger and hatred in our country,NA,10,1,24,6,15,20,18,30,2,3,6,6,5,6,5,6,3,3,1,2,2,3,4,1,3,4,3,1,3,3,2,3,2,3,2,4,2,3,3,3,5,5,2,6,6,5,5,2,6,6,2,2,2,6,3,6,5,5,2,5,3,2,2,5,3,5,3,5,5,3,5,3,3,5,5,3,5,1,,4,,1,1,4,4,1,1,6,1,2,1,1,70,6,4,11,3,1,2,1,1,3,4,3,1,4,9,2,93,0,0,0,0,1,5,1280
1282,440,1417,9/9/17 20:47,9/9/17 21:24,36,0.8023,5,I believe there is a God,NA,Catholic,NA,1,75,25,6,5,5,5,4,5,6,4,5,5,1,0,0,0,0,0,0,0,0,0,0,0,0,0,0,0,0,1,7,6,none,NA,10,1,24,3,15,15,5,20,3,5,4,5,3,4,4,6,3,3,1,2,2,2,2,2,3,3,3,3,4,3,2,3,2,2,1,2,2,3,2,4,3,4,4,4,5,3,5,4,3,5,4,2,2,5,4,6,4,4,4,4,3,4,3,4,3,4,4,4,3,3,5,5,4,4,3,4,4,2,,4,,1,1,3,4,1,1,5,1,1,1,1,75,7,4,9,2,1,1,1,2,1,18,1,1,3,5,1,59,0,0,0,0,2,5,1281
1283,441,1418,9/9/17 20:53,9/10/17 1:46,293,1.6148,3,Creo que si ay uno solo,NA,Catolica,NA,1,70,30,6,6,6,6,4,5,6,2,6,2,1,0,0,0,0,0,0,0,0,0,0,0,0,0,0,0,0,2,2,3,Creo que si pero tafaltando mas informacion p los jovdnes para estar vien informados,NA,10,5,47,2,15,20,4,20,3,3,2,3,5,5,5,5,3,2,2,3,2,2,1,3,3,3,4,4,3,1,4,3,3,2,2,4,2,1,1,2,3,4,5,5,5,6,2,5,7,6,2,3,3,3,5,3,5,3,2,5,3,5,5,3,3,5,5,5,3,6,5,5,6,5,5,6,5,1,,2,,1,2,4,4,1,1,7,1,1,2,2,46,4,3,4,1,4,2,1,5,1,8,1,1,3,7,1,74,0,0,1,0,4,4,1282
1284,442,1419,9/9/17 20:53,9/9/17 21:20,26,1.0038,5,,-1,,-1,1,90,10,4,4,4,4,4,4,4,5,4,4,0,0,0,0,0,0,0,0,0,0,0,0,1,0,0,0,0,2,7,7,,-1,10,100,24,3,30,20,4,10,2,5,4,5,5,5,3,5,3,4,3,3,2,1,2,2,3,1,4,2,4,2,4,3,2,2,1,2,1,2,2,4,3,4,5,2,3,4,2,3,2,7,2,2,4,4,5,4,6,4,1,4,4,3,2,1,2,4,5,3,2,4,5,4,4,2,-1,4,5,2,,4,,1,2,5,5,1,1,1,1,2,1,1,38,3,2,9,2,1,1,1,1,3,15,5,1,2,3,2,33,0,0,0,0,1,1,1283
1285,443,1421,9/9/17 20:56,9/10/17 19:49,1372,0.9498,5,I believe Jesus Christ came from Heaven above to die for our sins. I Believe it was Gods plan of salvation so we may live eternity with him if we recieve in faith his son.,NA,The church of Jesus Christ of latter day saints,NA,1,75,25,7,7,7,7,7,7,7,5,7,6,0,0,0,1,0,0,0,0,0,0,0,0,0,0,0,0,0,2,1,1,I believe it is going in the direction it is supposed to be going in accordance to Gods word.,NA,10,5,24,3,15,20,3,10,2,5,6,6,6,6,5,5,3,3,2,2,2,2,2,2,2,2,4,2,4,2,3,3,3,2,1,2,2,3,1,3,4,7,3,6,6,2,6,2,5,6,3,2,3,4,5,3,6,4,2,4,1,4,4,3,4,3,4,4,3,5,4,5,4,3,4,6,4,1,,4,,1,1,5,5,1,1,1,1,2,1,1,51,4,3,10,3,1,2,1,5,1,17,1,1,3,7,2,74,0,0,1,2,2,7,1284
1286,444,1422,9/9/17 20:58,9/9/17 21:20,21,1.4036,5,I think ther is a higher power 5then us but I don't know what you woild call it.,NA,none,NA,1,60,40,4,4,4,4,5,4,4,4,5,3,0,0,0,0,0,0,0,0,0,0,0,0,1,0,0,0,0,2,8,3,wrong direction. our government is encouraging people to judge people for there beliefs and color and this will end up destroying everything our country has stood for.,NA,10,1,24,6,15,3,6,30,2,3,3,4,3,5,5,6,4,4,4,2,2,3,2,1,1,1,2,3,4,1,3,3,2,2,1,1,4,2,1,3,2,6,5,1,5,3,4,3,6,4,4,5,4,3,4,6,4,4,5,4,1,4,1,1,4,4,4,5,4,4,4,5,3,4,4,4,4,1,,4,,1,2,1,4,1,2,4,3,5,1,1,59,5,3,9,2,1,2,1,4,1,8,1,0,4,8,2,82,0,0,0,0,4,7,1285
1287,445,1423,9/9/17 20:59,9/10/17 1:49,289,1.0858,5,God Is Good Always,NA,None,NA,1,100,0,7,2,6,2,5,6,7,6,6,2,0,0,0,0,0,0,0,0,0,0,0,0,1,0,0,0,0,1,8,1,The right direction because of President Donald Trump,NA,10,25,12,1,15,2,6,0,3,6,6,5,2,6,5,5,4,1,1,3,4,3,1,1,2,3,1,1,1,2,3,1,2,2,3,3,4,3,3,3,6,1,4,5,6,5,5,1,7,7,1,5,5,3,1,6,1,2,3,3,1,1,7,7,2,4,5,4,2,1,4,6,2,4,4,1,4,2,,4,,1,1,6,6,1,1,1,1,2,1,1,59,5,3,10,3,2,1,1,2,1,18,1,1,4,9,1,93,0,0,0,0,2,1,1286
